D1: 宁夏回族自治区1991年
D2: 主要统计数据指标简表
D3: 本表主要根据《宁夏统计年鉴2003》整理
D4: 单位:亿元（人民币）(注：本表中第6、7项除外) | E4: 精确度：小数点后保留两位
A5: 项目号 | B5: 指标名称 | C5: 基本情况 | D5: 备注 | E5: 出处
A6: 1 | B6: 国内生产总值
B7: a GDP 总额 | C7: 71.78 | D7: 按当年价格计算 | E7: 《宁夏统计年鉴2003》38页
B8: b GDP增加额 | C8: =C7-64.84 -> 6.94 | D8: 按当年价格计算 | E8: 《宁夏统计年鉴2003》38页
B9: c 人均GDP(单位：元) | C9: 1511 | D9: 按当年价格计算 | E9: 《宁夏统计年鉴2003》38页
B10: d 第一产业增加值 | C10: 17.9 | D10: 按当年价格计算 | E10: 《宁夏统计年鉴2003》38页
B11: e 第二产业增加值 | C11: 27.77 | D11: 按当年价格计算 | E11: 《宁夏统计年鉴2003》38页
B12: f 第三产业增加值 | C12: 26.11 | D12: 按当年价格计算 | E12: 《宁夏统计年鉴2003》38页
A13: 2 | B13: 全年实现工业增加值 | C13: 23.12 | D13: 按当年价格计算 | E13: 《宁夏统计年鉴2003》38页
A14: 3 | B14: 农业情况
B15: a全年农业总产值 | C15: 26.945799999999998 | D15: 按当年价格计算 | E15: 《宁夏统计年鉴2003》210页
B16: b农业总产值 | C16: 19.1221 | D16: 按当年价格计算 | E16: 《宁夏统计年鉴2003》210页
B17: c林业总产值 | C17: 1.2586999999999999 | D17: 按当年价格计算 | E17: 《宁夏统计年鉴2003》210页
B18: d畜牧业总产值 | C18: 6.0429000000000004 | D18: 按当年价格计算 | E18: 《宁夏统计年鉴2003》210页
B19: e渔业总产值 | C19: 0.52210000000000001 | D19: 按当年价格计算 | E19: 《宁夏统计年鉴2003》210页
A20: 4 | B20: 投资情况
B21: a全社会固定资产投资额 | C21: 28.813400000000001 | D21: 按当年价格计算 | E21: 《宁夏统计年鉴2003》111页
B22: b基本建设投资额 | C22: 15.833399999999999 | D22: 按当年价格计算 | E22: 《宁夏统计年鉴2003》111页
B23: c更新改造投资额 | C23: 5.4523000000000001 | D23: 按当年价格计算 | E23: 《宁夏统计年鉴2003》111页
B24: d房地产开发投资额
A25: 5 | B25: 全年居民消费水平
B26: a居民消费价格总指数（%） | C26: 106.3 | D26: 上年价格=100 | E26: 《宁夏统计年鉴2003》163页
B27: ①城镇居民消费价格指数（%） | C27: 106.9 | D27: 上年价格=100 | E27: 《宁夏统计年鉴2003》163页
B28: ②农村居民消费价格指数（%） | C28: 105.3 | D28: 上年价格=100 | E28: 《宁夏统计年鉴2003》163页
B29: b消费品零售总额 | C29: 28.146799999999999 | D29: 按当年价格计算 | E29: 《宁夏统计年鉴2003》350页
B30: ①城市消费品零售额 | C30: 16.058599999999998 | D30: 按当年价格计算 | E30: 《宁夏统计年鉴2003》350页
B31: ②农村消费品零售额 | C31: =C29-C30 -> 12.088200000000001 | D31: 按当年价格计算 | E31: 《宁夏统计年鉴2003》350页
A32: ★6 | B32: 外贸情况(亿美元)
B33: a全年外贸总额(亿美元) | C33: 1.0286 | D33: 按当年价格计算 | E33: 《宁夏统计年鉴2003》359页
B34: b出口总额(亿美元) | C34: 0.90290000000000004 | D34: 按当年价格计算 | E34: 《宁夏统计年鉴2003》359页
B35: c 进口总额(亿美元) | C35: 0.12570000000000001 | D35: 按当年价格计算 | E35: 《宁夏统计年鉴2003》359页
A36: ★7 | B36: 全年利用外资情况(亿美元)
B37: a 外资直接投资(亿美元)
B38: b 合同外资(亿美元) | D38: 注意使用
B39: c 实际利用外资(亿美元)
A40: 8 | B40: 全省(市)财政总收入
B41: a财政收入/GDP （%） | C41: 9.49 | E41: 《宁夏统计年鉴2003》147页
B42: b地方财政收入（实际） | C42: 6.8121999999999998 | D42: 按当年价格计算 | E42: 《宁夏统计年鉴2003》145页
B43: d 一般预算收入
B44: e税收收入总额
B45: ①增值税税收收入
B46: ②企业所得税税收收入 | C46: 0.99350000000000005 | D46: 按当年价格计算 | E46: 《宁夏统计年鉴2003》145页
B47: ③个人所得税税收收入
B48: ④营业税税收收入
B49: ⑤资源税税收收入
B50: ⑥本省税收收入占本省财政收入比例（%）
B51: ⑦税收收入占国内生产总值比例（%）
A52: 9 | B52: a全省（市）财政支出总额（实际）
B53: b一般财政预算支出 | C53: 16.049600000000002 | D53: 按当年价格计算 | E53: 《宁夏统计年鉴2003》146页
B54: c基本建设支出 | C54: 1.5313000000000001 | D54: 按当年价格计算 | E54: 《宁夏统计年鉴2003》146页
B55: d农业支出
B56: e支农支出 | C56: 21.585000000000001 | D56: 按当年价格计算 | E56: 《宁夏统计年鉴2003》146页
B57: f科技三项支出
B58: g社会保障支出 | C58: 0.26579999999999998 | D58: 按当年价格计算 | E58: 《宁夏统计年鉴2003》146页
B59: h科教文卫支出 | C59: 3.8592 | D59: 按当年价格计算 | E59: 《宁夏统计年鉴2003》146页
A60: 10 | B60: 本省财政收入与全国财政收入的比较
B61: a全国财政收入 | C61: 3149.48 | D61: 按当年价格计算 | E61: 《中国统计年鉴1996》http://www.stats.gov.cn/ndsj/information/zh1/g011a
B62: b省(市)财政收入
B63: c本省财政收入占全国的比例
A64: 11 | B64: 人民生活水平指标
B65: a城市居民人均可支配收入 | C65: 1565.17 | D65: 按当年价格计算 | E65: 《宁夏统计年鉴2003》182页
B66: b城市居民恩格尔系数(%) | C66: =678.12/1353.86 -> 0.50087896828327894 | D66: 人均食品支出/人均消费支出 | E66: 《宁夏统计年鉴2003》182页
B67: c农村居民人均纯收入 | C67: 608.13 | D67: 按当年价格计算 | E67: 《宁夏统计年鉴2003》191页
B68: d农村居民恩格尔系数(%) | C68: =292.81/518.79 -> 0.56440949131633222 | E68: 《宁夏统计年鉴2003》191页
B69: e城乡收入水平差距 | C69: =C65-C67 -> 957.04 | D69: e=a-c