D1: 宁夏回族自治区2003年
D2: 主要统计数据指标简表
D3: 本表主要根据《2003年宁夏回族自治区国民经济和社会发展统计公报》整理
D4: 单位:亿元（人民币）(注：本表中第6、7项除外) | E4: 精确度：小数点后保留两位
A5: 项目号 | B5: 指标名称 | C5: 基本情况 | D5: 备注 | E5: 出处
A6: 1 | B6: 国内生产总值
B7: a GDP 总额 | C7: 385 | D7: 按可比价格计算 | E7: 2003年宁夏回族自治区国民经济和社会发展统计公报
B8: b GDP增加额 | C8: 55 | D8: 计算而得
B9: c 人均GDP(单位：元) | C9: 6635 | D9: 按当年价格计算 | E9: 宁夏回族自制区党校图书馆《宁夏经济发展现状》http://www.nxdxlib.gov.cn/qx13.htm
B10: d 第一产业增加值 | C10: 55.5 | D10: 按当年价格计算 | E10: 2003年宁夏回族自治区国民经济和社会发展统计公报
B11: e 第二产业增加值 | C11: 191.7 | D11: 按当年价格计算 | E11: 2003年宁夏回族自治区国民经济和社会发展统计公报
B12: f 第三产业增加值 | C12: 137.8 | D12: 按当年价格计算 | E12: 2003年宁夏回族自治区国民经济和社会发展统计公报
A13: 2 | B13: 全年实现工业增加值 | C13: 143.3 | D13: 按当年价格计算 | E13: 2003年宁夏回族自治区国民经济和社会发展统计公报
A14: 3 | B14: 农业情况
B15: a全年农业总产值 | C15: 103.4 | D15: 含副业产值 | E15: 2004年中国统计年鉴http://www.stats.gov.cn/tjsj/ndsj/yb2004-c/indexch.htm
B16: b农业总产值 | C16: 54.1 | D16: 按当年价格计算 | E16: 2004年中国统计年鉴http://www.stats.gov.cn/tjsj/ndsj/yb2004-c/indexch.htm
B17: c林业总产值 | C17: 7.5 | D17: 按当年价格计算 | E17: 2004年中国统计年鉴http://www.stats.gov.cn/tjsj/ndsj/yb2004-c/indexch.htm
B18: d畜牧业总产值 | C18: 36.4 | D18: 按当年价格计算 | E18: 2004年中国统计年鉴http://www.stats.gov.cn/tjsj/ndsj/yb2004-c/indexch.htm
B19: e渔业总产值 | C19: 2.6 | D19: 按当年价格计算 | E19: 2004年中国统计年鉴http://www.stats.gov.cn/tjsj/ndsj/yb2004-c/indexch.htm
A20: 4 | B20: 投资情况
B21: a全社会固定资产投资额 | C21: 318.2 | D21: 按当年价格计算 | E21: 2003年宁夏回族自治区国民经济和社会发展统计公报
B22: b基本建设投资额 | C22: 164.6 | D22: 按当年价格计算 | E22: 2003年宁夏回族自治区国民经济和社会发展统计公报
B23: c更新改造投资额 | C23: 41.1 | D23: 按当年价格计算 | E23: 2003年宁夏回族自治区国民经济和社会发展统计公报
B24: d房地产开发投资额 | C24: 50.9 | D24: 按当年价格计算 | E24: 2003年宁夏回族自治区国民经济和社会发展统计公报
A25: 5 | B25: 全年居民消费水平
B26: a居民消费价格总指数（%） | C26: 101.7 | D26: 上年价格=100 | E26: 2004年中国统计年鉴http://www.stats.gov.cn/tjsj/ndsj/yb2004-c/indexch.htm
B27: ①城镇居民消费价格指数（%） | C27: 101.5 | D27: 上年价格=100 | E27: 2004年中国统计年鉴http://www.stats.gov.cn/tjsj/ndsj/yb2004-c/indexch.htm
B28: ②农村居民消费价格指数（%） | C28: 102 | D28: 上年价格=100 | E28: 2004年中国统计年鉴http://www.stats.gov.cn/tjsj/ndsj/yb2004-c/indexch.htm
B29: b消费品零售总额 | C29: 117 | D29: 按当年价格计算 | E29: 2003年宁夏回族自治区国民经济和社会发展统计公报
B30: ①城市消费品零售额 | C30: 80 | D30: 按当年价格计算 | E30: 2003年宁夏回族自治区国民经济和社会发展统计公报
B31: ②农村消费品零售额 | C31: 37 | D31: 按当年价格计算 | E31: 2003年宁夏回族自治区国民经济和社会发展统计公报
A32: ★6 | B32: 外贸情况(亿美元)
B33: a全年外贸总额(亿美元) | C33: 6.5 | D33: 按当年价格计算 | E33: 2003年宁夏回族自治区国民经济和社会发展统计公报
B34: b出口总额(亿美元) | C34: 5.1 | D34: 按当年价格计算 | E34: 2003年宁夏回族自治区国民经济和社会发展统计公报
B35: c 进口总额(亿美元) | C35: 1.4 | D35: 按当年价格计算 | E35: 2003年宁夏回族自治区国民经济和社会发展统计公报
A36: ★7 | B36: 全年利用外资情况(亿美元)
B37: a 外资直接投资(亿美元) | C37: 0.317 | D37: 按当年价格计算 | E37: 宁夏回族自制区党校图书馆《宁夏经济发展现状》http://www.nxdxlib.gov.cn/qx13.htm
B38: b 合同外资(亿美元) | C38: 0.33539999999999998 | D38: 按当年价格计算 | E38: 宁夏回族自制区党校图书馆《宁夏经济发展现状》http://www.nxdxlib.gov.cn/qx13.htm
B39: c 实际利用外资(亿美元) | C39: 0.71860000000000002 | D39: 按当年价格计算 | E39: 2003年宁夏回族自治区国民经济和社会发展统计公报
A40: 8 | B40: 全省(市)财政总收入 | C40: 53.32 | D40: 中央加地方 | E40: 宁夏回族自制区党校图书馆《宁夏经济发展现状》http://www.nxdxlib.gov.cn/qx13.htm
B41: a财政收入（即a）/GDP （%） | C41: =C40/C7 -> 0.1384935064935065 | D41: 计算而得
B42: b地方财政收入（实际） | C42: 30.03 | D42: 按当年价格计算 | E42: 2003年宁夏回族自治区国民经济和社会发展统计公报
B43: d 一般预算收入 | C43: 50.7 | D43: 地方一般预算收入30亿元 | E43: 2003年宁夏回族自治区国民经济和社会发展统计公报
B44: e税收收入总额 | C44: 45.1 | D44: 按当年价格计算 | E44: 宁夏回族自制区党校图书馆《宁夏经济发展现状》http://www.nxdxlib.gov.cn/qx13.htm
B45: f国税收入总额 | C45: 27 | D45: 按当年价格计算 | E45: 宁夏回族自制区党校图书馆《宁夏经济发展现状》http://www.nxdxlib.gov.cn/qx13.htm
B46: g地税收入总额 | C46: 18.2 | D46: 按当年价格计算 | E46: 宁夏回族自制区党校图书馆《宁夏经济发展现状》http://www.nxdxlib.gov.cn/qx13.htm
B47: ①增值税税收收入 | C47: 5.04 | D47: 按当年价格计算 | E47: 2004年中国统计年鉴http://www.stats.gov.cn/tjsj/ndsj/yb2004-c/indexch.htm
B48: ②企业所得税税收收入 | C48: 1.68 | D48: 按当年价格计算 | E48: 2004年中国统计年鉴http://www.stats.gov.cn/tjsj/ndsj/yb2004-c/indexch.htm
B49: ③个人所得税税收收入 | C49: 1.3 | D49: 按当年价格计算 | E49: 2004年中国统计年鉴http://www.stats.gov.cn/tjsj/ndsj/yb2004-c/indexch.htm
B50: ④营业税税收收入 | C50: 10.9 | D50: 按当年价格计算 | E50: 2004年中国统计年鉴http://www.stats.gov.cn/tjsj/ndsj/yb2004-c/indexch.htm
B51: ⑤资源税税收收入 | C51: 0.13 | D51: 按当年价格计算 | E51: 2004年中国统计年鉴http://www.stats.gov.cn/tjsj/ndsj/yb2004-c/indexch.htm
B52: ⑥本省税收收入占本省财政收入比例（%） | C52: =C44/C42 -> 1.5018315018315018 | D52: 计算而得
B53: ⑦税收收入占国内生产总值比例（%） | C53: =C44/C7 -> 0.11714285714285715 | D53: 计算而得
A54: 9 | B54: a全省（市）财政支出总额（实际） | C54: 105.78 | D54: 按当年价格计算 | E54: 2004年中国统计年鉴http://www.stats.gov.cn/tjsj/ndsj/yb2004-c/indexch.htm
B55: b一般财政预算支出 | C55: 105.7 | D55: 按当年价格计算 | E55: 2004年中国统计年鉴http://www.stats.gov.cn/tjsj/ndsj/yb2004-c/indexch.htm
B56: c基本建设支出 | C56: 20.36 | D56: 按当年价格计算 | E56: 2004年中国统计年鉴http://www.stats.gov.cn/tjsj/ndsj/yb2004-c/indexch.htm
B57: d农业支出 | C57: 5.1 | D57: 按当年价格计算 | E57: 2004年中国统计年鉴http://www.stats.gov.cn/tjsj/ndsj/yb2004-c/indexch.htm
B58: e支农支出 | D58: 待查 | E58: 2004年中国统计年鉴http://www.stats.gov.cn/tjsj/ndsj/yb2004-c/indexch.htm
B59: f科技三项支出 | C59: 0.75 | D59: 按当年价格计算 | E59: 2004年中国统计年鉴http://www.stats.gov.cn/tjsj/ndsj/yb2004-c/indexch.htm
B60: g社会保障支出 | C60: 16.89 | D60: 按当年价格计算 | E60: 2004年中国统计年鉴http://www.stats.gov.cn/tjsj/ndsj/yb2004-c/indexch.htm
B61: h科教文卫支出 | C61: 22 | D61: 按当年价格计算 | E61: 2004年中国统计年鉴http://www.stats.gov.cn/tjsj/ndsj/yb2004-c/indexch.htm
A62: 10 | B62: 本省财政收入与全国财政收入的比较
B63: a全国财政收入 | C63: 21715.25 | D63: 按当年价格计算 | E63: 2004年中国统计年鉴http://www.stats.gov.cn/tjsj/ndsj/yb2004-c/indexch.htm
B64: b省(市)财政收入 | C64: 30.03 | D64: 按当年价格计算 | E64: 2003年宁夏回族自治区国民经济和社会发展统计公报
B65: c本省财政收入占全国的比例 | C65: =C64/C63 -> 1.3828991146774732E-3 | D65: 计算得出
A66: 11 | B66: 人民生活水平指标
B67: a城市居民人均可支配收入（单位：元） | C67: 6530 | D67: 按当年价格计算 | E67: 2003年宁夏回族自治区国民经济和社会发展统计公报
B68: b城市居民恩格尔系数(%) | C68: 0.371 | E68: 2004年中国统计年鉴http://www.stats.gov.cn/tjsj/ndsj/yb2004-c/indexch.htm
B69: c农村居民人均纯收入（单位：元） | C69: 2043.3 | D69: 按当年价格计算 | E69: 2003年宁夏回族自治区国民经济和社会发展统计公报
B70: d农村居民恩格尔系数(%) | C70: 0.45590000000000003 | D70: 计算而得
B71: e城乡收入水平差距 | C71: =C67-C69 -> 4486.7 | D71: e=a-c