A1: 1952.2 | B1: 2011.48 | C1: =A1/B1 -> 0.97052916260663791 | D1: =C1-1 -> -2.9470837393362093E-2
A2: 981.25 | B2: 1165.49 | C2: =A2/B2 -> 0.8419205655990184 | D2: =C2-1 -> -0.1580794344009816
A3: 31.49 | B3: 36.29 | C3: =A3/B3 -> 0.86773215761917877 | D3: =C3-1 -> -0.13226784238082123
A4: 458.87 | B4: 456.02 | C4: =A4/B4 -> 1.0062497258892154 | D4: =C4-1 -> 6.2497258892153518E-3
A5: 371.56 | B5: 353.68 | C5: =A5/B5 -> 1.0505541732639674 | D5: =C5-1 -> 5.0554173263967384E-2