D1: 贵州省1978年
D2: 主要统计数据指标简表
D3: 本表主要根据《贵州统计年鉴2003》整理 | E3: 精确度：小数点后保留两位
E4: 单位:亿元（人民币）(注：本表中第6、7项除外)
A5: 项目号 | B5: 指标名称 | C5: 基本情况 | D5: 备注 | E5: 出处
A6: 1 | B6: 国内生产总值
B7: a GDP 总额 | C7: 46.62 | D7: 按当年价格计算 | E7: 《贵州统计年鉴2003》512页
B8: b GDP增加额 | C8: ―――― | D8: 按当年价格计算
B9: c 第一产业增加值 | C9: 19.42 | D9: 按当年价格计算 | E9: 《贵州统计年鉴2003》512页
B10: d 第二产业增加值 | C10: 18.73 | D10: 按当年价格计算 | E10: 《贵州统计年鉴2003》512页
B11: e 第三产业增加值 | C11: 8.47 | D11: 按当年价格计算 | E11: 《贵州统计年鉴2003》512页
A12: 2 | B12: 工业总产值 | C12: 41.26 | D12: 按当年价格计算 | E12: 《贵州统计年鉴2003》525页
A13: 3 | B13: 农业情况
B14: a全年农业总产值 | C14: 27.46 | D14: 按当年价格计算 | E14: 《贵州统计年鉴2003》521页
B15: b农业总产值 | C15: 21.72 | D15: 按当年价格计算 | E15: 《贵州统计年鉴2003》521页
B16: c林业总产值 | C16: 1.07 | D16: 按当年价格计算 | E16: 《贵州统计年鉴2003》521页
B17: d畜牧业总产值 | C17: 4.64 | D17: 按当年价格计算 | E17: 《贵州统计年鉴2003》521页
B18: e渔业总产值 | C18: 0.03 | D18: 按当年价格计算 | E18: 《贵州统计年鉴2003》521页
A19: 4 | B19: 投资情况
B20: a全社会固定资产投资额 | C20: 10.93 | D20: 按当年价格计算 | E20: 《贵州统计年鉴2003》518页
B21: b基本建设投资额 | C21: 8.81 | D21: 按当年价格计算 | E21: 《贵州统计年鉴2003》518页
B22: c更新改造投资额 | C22: 0.86 | D22: 按当年价格计算 | E22: 《贵州统计年鉴2003》518页
A23: 5 | B23: 全年居民消费水平
B24: 消费品零售总额 | C24: 21.23 | D24: 按当年价格计算 | E24: 《贵州统计年鉴2003》532页
B25: ①城市消费品零售额 | C25: 14.83 | D25: 按当年价格计算 | E25: 《贵州统计年鉴2003》532页
B26: ②农村消费品零售额 | C26: 6.4 | D26: 按当年价格计算 | E26: 《贵州统计年鉴2003》532页
A27: ★6 | B27: 外贸情况(万美元)
B28: a全年外贸总额(万美元) | C28: 1645 | D28: 按当年价格计算 | E28: 《贵州统计年鉴2003》532页
B29: b出口总额(万美元) | C29: 285 | D29: 按当年价格计算 | E29: 《贵州统计年鉴2003》532页
B30: c 进口总额(万美元) | C30: =C28-C29 -> 1360 | D30: 按当年价格计算 | E30: 《贵州统计年鉴2003》532页
A31: ★7 | B31: 全年利用外资情况(万美元)
B32: a 外资直接投资(万美元) | C32: ―――― | D32: 按当年价格计算 | E32: 《贵州统计年鉴2003》533页
B33: b 对外借款(万美元) | C33: ―――― | D33: 按当年价格计算 | E33: 《贵州统计年鉴2003》533页
B34: c 实际利用外资(万美元) | C34: ―――― | D34: 按当年价格计算 | E34: 《贵州统计年鉴2003》533页
A35: 8 | B35: 全省(市)财政总收入 | C35: 14.2 | D35: 按当年价格计算 | E35: 《贵州统计年鉴2003》519页
B36: a财政收入/GDP （%） | C36: =C35*100/C7 -> 30.459030459030462 | D36: 此处GDP为全省当年GDP | E36: 《贵州统计年鉴2003》519页
B37: b地方财政收入（实际） | C37: 6.26 | D37: 按当年价格计算 | E37: 《贵州统计年鉴2003》519页
B38: c工商税收 | C38: 4.75 | E38: 《贵州统计年鉴2003》519页
A39: 9 | B39: 全省（市）财政支出总额（实际） | C39: 12.3 | D39: 按当年价格计算 | E39: 《贵州统计年鉴2003》519页
B40: a基本建设支出 | C40: 3.41 | D40: 按当年价格计算 | E40: 《贵州统计年鉴2003》519页
B41: b企业挖潜改造 | C41: 0.91 | D41: 按当年价格计算 | E41: 《贵州统计年鉴2003》519页
B42: c科教文卫支出 | C42: 2.29 | D42: 按当年价格计算 | E42: 《贵州统计年鉴2003》519页
B43: d行政管理 | C43: 1.2 | D43: 按当年价格计算 | E43: 《贵州统计年鉴2003》519页
A44: 11 | B44: 人民生活水平指标
B45: a城市居民人均可支配收入（单位：元） | C45: 261.26 | D45: 按当年价格计算 | E45: 《贵州统计年鉴2003》536页
B46: b城市居民恩格尔系数(%) | C46: =150.105*100/246.53 -> 60.887113130247833 | D46: 食品支出/消费性支出*100 | E46: 《贵州统计年鉴2003》536页
B47: c农村居民人均纯收入（单位：元） | C47: 109.3 | D47: 按当年价格计算 | E47: 《贵州统计年鉴2003》537页
B48: d农村居民恩格尔系数(%) | C48: =72.2*100/104.25 -> 69.256594724220619 | D48: 食品支出/生活消费支出*100 | E48: 《贵州统计年鉴2003》537页
B49: e城乡收入水平差距 | C49: =C45-C47 -> 151.96 | D49: e＝a－c