D1: 贵州省1995年
D2: 主要统计数据指标简表
D3: 本表主要根据《贵州统计年鉴2001》整理 | F3: 精确度：小数点后保留两位
F4: 单位:亿元（人民币）(注：本表中第6、7项除外)
A5: 项目号 | B5: 指标名称 | C5: 基本情况 | D5: 备注 | E5: 出处
A6: 1 | B6: 国内生产总值
B7: a GDP 总额 | C7: 630.07 | D7: 按当年价格计算 | E7: 《贵州统计年鉴2001》13页
B8: b GDP增加额 | C8: =C7-521.17 -> 108.9 | D8: 按当年价格计算
B9: c 人均GDP(单位：元) | C9: 1853 | D9: 按当年价格计算 | E9: 《贵州统计年鉴2001》17页
B10: d 第一产业增加值 | C10: 227.06 | D10: 按当年价格计算 | E10: 《贵州统计年鉴2001》13页
B11: e 第二产业增加值 | C11: 234.1 | D11: 按当年价格计算 | E11: 《贵州统计年鉴2001》13页
B12: f 第三产业增加值 | C12: 168.91 | D12: 按当年价格计算 | E12: 《贵州统计年鉴2001》13页
A13: 2 | B13: 全年工业总产值 | C13: 531.93 | D13: 按当年价格计算 | E13: 《贵州统计年鉴2003》525页
A14: 3 | B14: 农业情况
B15: a全年农业总产值 | C15: 344.85 | D15: 按当年价格计算 | E15: 《贵州统计年鉴2001》106页
B16: b农业总产值 | C16: 224.16 | D16: 按当年价格计算 | E16: 《贵州统计年鉴2001》106页
B17: c林业总产值 | C17: 15.29 | D17: 按当年价格计算 | E17: 《贵州统计年鉴2001》106页
B18: d畜牧业总产值 | C18: 102.54 | D18: 按当年价格计算 | E18: 《贵州统计年鉴2001》106页
B19: e渔业总产值 | C19: 2.86 | D19: 按当年价格计算 | E19: 《贵州统计年鉴2001》106页
A20: 4 | B20: 投资情况
B21: a全社会固定资产投资额 | C21: 173.66 | D21: 按当年价格计算 | E21: 《贵州统计年鉴2001》75页
B22: b基本建设投资额 | C22: 65.73 | D22: 按当年价格计算 | E22: 《贵州统计年鉴2001》75页
B23: c更新改造投资额 | C23: 39.49 | D23: 按当年价格计算 | E23: 《贵州统计年鉴2001》75页
A24: 5 | B24: 全年居民消费水平
B25: a居民消费价格总指数（%） | C25: 121.4 | D25: 上年指数＝100 | E25: 《中国统计年鉴1996》电子版 中国统计局网站
B26: ①城镇居民消费价格指数（%） | C26: 119.5 | D26: 上年指数＝100 | E26: 《中国统计年鉴1996》电子版 中国统计局网站
B27: ②农村居民消费价格指数（%） | C27: 124.7 | D27: 上年指数＝100 | E27: 《中国统计年鉴1996》电子版 中国统计局网站
B28: b消费品零售总额 | C28: 191.67 | D28: 按当年价格计算 | E28: 《贵州统计年鉴2003》第532页
B29: ①城市消费品零售额 | C29: 145.48 | D29: 按当年价格计算 | E29: 《贵州统计年鉴2003》第532页
B30: ②农村消费品零售额 | C30: 46.19 | D30: 按当年价格计算 | E30: 《贵州统计年鉴2003》第532页
A31: ★6 | B31: 外贸情况(亿美元)
B32: a全年外贸总额(亿美元) | C32: 6.81 | D32: 按当年价格计算 | E32: 《贵州统计年鉴2003》第532页
B33: b出口总额(亿美元) | C33: 4.3 | D33: 按当年价格计算 | E33: 《贵州统计年鉴2003》第532页
B34: c 进口总额(亿美元) | C34: 2.51 | D34: 按当年价格计算 | E34: 《贵州统计年鉴2003》第532页
A35: ★7 | B35: 全年利用外资情况(亿美元)
B36: a 外资直接投资(亿美元) | C36: 5703 | D36: 按当年价格计算 | E36: 《贵州统计年鉴2003》第532页
B37: b 合同外资(亿美元) | D37: 待查 | E37: 《贵州统计年鉴2003》第532页
B38: c 实际利用外资(亿美元) | C38: 3637 | D38: 按当年价格计算 | E38: 《贵州统计年鉴2003》第532页
A39: 8 | B39: 全省(市)财政总收入 | C39: 87.4 | D39: 按当年价格计算 | E39: 《贵州统计年鉴2001》第519页
B40: a财政收入（即a）/GDP （%） | C40: =C39*100/C7 -> 13.871474598060532 | D40: 此处GDP为全省当年GDP
B41: b地方财政收入（实际） | C41: 38.8 | D41: 按当年价格计算 | E41: 《贵州统计年鉴2001》第519页
B42: c 一般预算收入 | C42: ――――
B43: d税收收入总额 | C43: ―――― | E43: 《贵州统计年鉴2001》242页
B44: ①工商税收收入 | C44: 22.26 | D44: 按当年价格计算 | E44: 《贵州统计年鉴2001》239页
B45: ②企业所得税税收收入 | C45: 3.2132999999999998 | D45: 按当年价格计算 | E45: 《贵州统计年鉴2001》239页
B46: ③个人所得税税收收入 | C46: ―――― | E46: 《贵州统计年鉴2001》239页
B47: ④营业税税收收入 | C47: ―――― | E47: 《贵州统计年鉴2001》239页
B48: ⑤资源税税收收入 | C48: ―――― | E48: 《中国统计年鉴1996》电子版 中国统计局网站
B49: ⑥本省税收收入占本省财政收入比例（%） | C49: ――――
B50: ⑦税收收入占国内生产总值比例（%） | C50: ―――― | D50: 此处GDP为全省当年GDP
A51: 9 | B51: a全省（市）财政支出总额（实际） | C51: 85.33 | D51: 按当年价格计算 | E51: 《贵州统计年鉴2003》第519页
B52: b一般财政预算支出 | D52: 待查
B53: c基本建设支出 | C53: 5.78 | D53: 按当年价格计算 | E53: 《贵州统计年鉴2003》第519页
B54: d农业支出 | C54: ――――
B55: e支农支出 | C55: 3.9306000000000001 | D55: 按当年价格计算 | E55: 《中国统计年鉴1996》电子版 中国统计局网站
B56: f科技三项支出 | C56: 0.43 | D56: 指国家为支持科技事业发展而设立的新产品试制费、中间试验费和重大科研项目补助费。 | E56: 《中国统计年鉴1996》电子版 中国统计局网站
B57: g社会保障支出 | C57: 20646 | D57: 包括社会补助支出 | E57: 《中国统计年鉴1996》电子版 中国统计局网站
B58: h科教文卫支出 | C58: 24.46 | D58: 科学教育文体卫生事业支出 | E58: 《贵州统计年鉴2003》第519页
A59: 10 | B59: 本省财政收入与全国财政收入的比较
B60: a全国财政收入 | C60: 6242.2 | D60: 指当年全国的财政收入总额 | E60: 《中国统计年鉴1996》电子版 中国统计局网站
B61: b省(市)财政收入 | C61: 87.4 | D61: 按当年价格计算 | E61: 《贵州统计年鉴2003》第519页
B62: c本省财政收入占全国的比例 | C62: =C61*100/C60 -> 1.400147383935151 | D62: a/c*100
A63: 11 | B63: 人民生活水平指标
B64: a城市居民人均可支配收入（单位：元） | C64: 3931.46 | D64: 按当年价格计算 | E64: 《贵州统计年鉴2003》第536页
B65: b城市居民恩格尔系数(%) | C65: =1748.58/3250.55*100 -> 53.793358047099716 | D65: 食品支出/消费性支出*100 | E65: 《2003年贵州统计年鉴》第536页
B66: c农村居民人均纯收入（单位：元） | C66: 1086.62 | D66: 按当年价格计算 | E66: 《贵州统计年鉴2003》第537页
B67: d农村居民恩格尔系数(%) | C67: =661.85/930.59*100 -> 71.121546545739804 | D67: 食品支出/消费性支出*100 | E67: 《2003年贵州统计年鉴》第537页
B68: e城乡收入水平差距 | C68: =C64-C66 -> 2844.84 | D68: e＝a-c