D1: 贵州省2001年
D2: 主要统计数据指标简表
D3: 本表主要根据《贵州统计年鉴2003》整理 | F3: 精确度：小数点后保留两位
F4: 单位:亿元（人民币）(注：本表中第6、7项除外)
A5: 项目号 | B5: 指标名称 | C5: 基本情况 | D5: 备注 | E5: 出处
A6: 1 | B6: 国内生产总值
B7: a GDP 总额 | C7: 1084.9 | D7: 按当年价格计算 | E7: 《贵州统计年鉴2003》512页
B8: b GDP增加额 | C8: 91.37 | D8: 按当年价格计算
B9: c 人均GDP(单位：元) | C9: 2895 | D9: 按当年价格计算 | E9: 《贵州统计年鉴2003》19页
B10: d 第一产业增加值 | C10: 274.17 | D10: 按当年价格计算 | E10: 《贵州统计年鉴2003》512页
B11: e 第二产业增加值 | C11: 419.74 | D11: 按当年价格计算 | E11: 《贵州统计年鉴2003》512页
B12: f 第三产业增加值 | C12: 390.99 | D12: 按当年价格计算 | E12: 《贵州统计年鉴2003》512页
A13: 2 | B13: 全年实现工业增加值 | C13: 335 | D13: 按当年价格计算 | E13: 《2001年贵州省国民经济和社会发展统计公报》贵州省人民政府网站
A14: 3 | B14: 农业情况
B15: a全年农业总产值 | C15: 418.61 | D15: 按当年价格计算 | E15: 《贵州统计年鉴2003》521页
B16: b农业总产值 | C16: 279.95 | D16: 按当年价格计算 | E16: 《贵州统计年鉴2003》521页
B17: c林业总产值 | C17: 15.08 | D17: 按当年价格计算 | E17: 《贵州统计年鉴2003》521页
B18: d畜牧业总产值 | C18: 118.46 | D18: 按当年价格计算 | E18: 《贵州统计年鉴2003》521页
B19: e渔业总产值 | C19: 5.13 | D19: 按当年价格计算 | E19: 《贵州统计年鉴2003》521页
A20: 4 | B20: 投资情况
B21: a全社会固定资产投资额 | C21: 533.74 | D21: 按当年价格计算 | E21: 《贵州统计年鉴2003》518页
B22: b基本建设投资额 | C22: 238.81 | D22: 按当年价格计算 | E22: 《贵州统计年鉴2003》518页
B23: c更新改造投资额 | C23: 118.55 | D23: 按当年价格计算 | E23: 《贵州统计年鉴2003》518页
B24: d房地产开发投资额 | C24: 67.01 | D24: 按当年价格计算 | E24: 《贵州统计年鉴2003》77页
A25: 5 | B25: 全年居民消费水平
B26: a居民消费价格总指数（%） | C26: 101.8 | D26: 上年指数＝100 | E26: 《中国统计年鉴2002》电子版 中国统计局网站
B27: ①城镇居民消费价格指数（%） | C27: 102.4 | D27: 上年指数＝100 | E27: 《中国统计年鉴2002》电子版 中国统计局网站
B28: ②农村居民消费价格指数（%） | C28: 101.1 | D28: 上年指数＝100 | E28: 《中国统计年鉴2002》电子版 中国统计局网站
B29: b消费品零售总额 | C29: 378.01 | D29: 按当年价格计算 | E29: 《贵州统计年鉴2003》532页
B30: ①城市消费品零售额 | C30: 292.35 | D30: 按当年价格计算 | E30: 《贵州统计年鉴2003》532页
B31: ②农村消费品零售额 | C31: 85.66 | D31: 县及县以下 | E31: 《贵州统计年鉴2003》532页
A32: ★6 | B32: 外贸情况(亿美元)
B33: a全年外贸总额(亿美元) | C33: 6.5 | D33: 按当年价格计算 | E33: 《贵州统计年鉴2003》532页
B34: b出口总额(亿美元) | C34: 4.21 | D34: 按当年价格计算 | E34: 《贵州统计年鉴2003》532页
B35: c 进口总额(亿美元) | C35: 2.28 | D35: 按当年价格计算 | E35: 《贵州统计年鉴2003》532页
A36: ★7 | B36: 全年利用外资情况(亿美元)
B37: a 外资直接投资(亿美元) | C37: 0.28 | D37: 按当年价格计算 | E37: 《贵州统计年鉴2003》533页
B38: b 合同外资(亿美元) | C38: 0.04 | E38: 《贵州统计年鉴2003》220页
B39: c 实际利用外资(亿美元) | C39: 1.4 | D39: 按当年价格计算 | E39: 《贵州统计年鉴2003》533页
A40: 8 | B40: 全省(市)财政总收入 | C40: 177.04 | D40: 按当年价格计算 | E40: 《贵州统计年鉴2003》519页
B41: a全省（市）财政总收入/GDP （%） | C41: =C40/C7*100 -> 16.318554705502809 | D41: 按当年价格计算
B42: b地方财政收入（实际） | C42: 99.75 | D42: 按当年价格计算 | E42: 《贵州统计年鉴2003》519页
B43: c 一般预算收入 | C43: 92.67 | D43: 按当年价格计算 | E43: 《贵州省2001年省本级和全省财政预算执行情况及2002年省本级财政预算草案报告》贵州省人大常委会网站
B44: d税收收入总额 | C44: 122.74 | D44: 工商税和农业四税总和 | E44: 《贵州统计年鉴2003》247页
B45: ①增值税税收收入 | C45: 14.26 | D45: 按当年价格计算 | E45: 《贵州统计年鉴2003》247页
B46: ②企业所得税税收收入 | C46: 12.34 | D46: 按当年价格计算 | E46: 《贵州统计年鉴2003》247页
B47: ③个人所得税税收收入 | C47: 6.67 | D47: 按当年价格计算 | E47: 《贵州统计年鉴2003》247页
B48: ④营业税税收收入 | C48: 22.08 | D48: 按当年价格计算 | E48: 《贵州统计年鉴2003》247页
B49: ⑤资源税税收收入 | C49: 0.43 | D49: 按当年价格计算 | E49: 《中国统计年鉴2003》电子版 中国统计局网站
B50: ⑥本省税收收入占本省（市）财政总收入比例（%） | C50: =C44/C40*100 -> 69.328965205603254 | D50: 按当年价格计算
B51: ⑦税收收入占国内生产总值比例（%） | C51: =100*C44/C7 -> 11.313485113835375 | D51: 按当年价格计算
A52: 9 | B52: a全省（市）财政支出总额（实际） | C52: 275.2 | D52: 按当年价格计算 | E52: 《贵州统计年鉴2003》519页
B53: b一般财政预算支出 | C53: 148 | D53: 按当年价格计算 | E53: 《贵州省2001年省本级和全省财政预算执行情况及2002年省本级财政预算草案报告》贵州省人大常委会网站
B54: c基本建设支出 | C54: 43.13 | D54: 按当年价格计算 | E54: 《贵州统计年鉴2003》519页
B55: d农业支出 | C55: ―――― | D55: 按当年价格计算
B56: e支农支出 | C56: 4.9581999999999997 | E56: 《中国统计年鉴2003》电子版 中国统计局网站
B57: f科技三项支出 | C57: 1.49 | D57: 按当年价格计算 | E57: 《中国统计年鉴2003》电子版 中国统计局网站
B58: g社会保障支出 | C58: 16.24 | D58: 包括社会补助支出 | E58: 《中国统计年鉴2003》电子版 中国统计局网站
B59: h科教文卫支出 | C59: 67.52 | D59: 科学教育文体卫生事业支出 | E59: 519页
A60: 10 | B60: 本省财政收入与全国财政收入的比较
B61: a全国财政收入 | C61: 18903.64 | D61: 指当年全国的财政收入总额 | E61: 《中国统计年鉴2003》电子版 中国统计局网站
B62: b省(市)财政收入 | C62: 177.04 | D62: 此处为地方财政收入 | E62: 《贵州统计年鉴2003》519页
B63: c本省财政收入占全国的比例 | C63: =100*C62/C61 -> 0.93653920620578901 | D63: a/c*100
A64: 11 | B64: 人民生活水平指标
B65: a城市居民人均可支配收入（单位：元） | C65: 5451.91 | D65: 按当年价格计算 | E65: 《贵州统计年鉴2003》269页
B66: b城市居民恩格尔系数(%) | C66: 40.8 | D66: 食品支出*100/消费性支出 | E66: 《贵州统计年鉴2003》270页
B67: c农村居民人均纯收入（单位：元） | C67: 1411.73 | D67: 按当年价格计算 | E67: 《贵州统计年鉴2003》275页
B68: d农村居民恩格尔系数(%) | C68: 60.03 | D68: 食品支出*100/消费性支出 | E68: 《贵州统计年鉴2003》276页
B69: e城乡收入水平差距 | C69: =C65-C67 -> 4040.18 | D69: e＝a-c