D1: 贵州省2003年
D2: 主要统计数据指标简表
D3: 本表主要根据《中国统计年鉴2004》电子版整理 | E3: 精确度：小数点后保留两位
E4: 单位:亿元（人民币）(注：本表中第6、7项除外)
A5: 项目号 | B5: 指标名称 | C5: 基本情况 | D5: 备注 | E5: 出处
A6: 1 | B6: 国内生产总值
B7: a GDP 总额 | C7: 1356.11 | D7: 按当年价格计算 | E7: 3-11 各地区生产总值(2003年)
B8: b GDP增加额 | C8: =C7-1185.04 -> 171.07 | D8: 按当年价格计算
B9: c 人均GDP(单位：元) | C9: 6568.91 | D9: 按当年价格计算 | E9: 《2003年贵州省国民经济和社会发展统计公报》贵州省人民政府网站http://www.gzgov.gov.cn/pages/zfgg/show_tjgb.asp?id=1422
B10: d 第一产业增加值 | C10: 298.37 | D10: 按当年价格计算 | E10: 3-11 各地区生产总值(2003年)
B11: e 第二产业增加值 | C11: 579.31 | D11: 按当年价格计算 | E11: 3-11 各地区生产总值(2003年)
B12: f 第三产业增加值 | C12: 478.43 | D12: 按当年价格计算 | E12: 3-11 各地区生产总值(2003年)
A13: 2 | B13: 全年实现工业增加值 | C13: 450.53 | D13: 按当年价格计算 | E13: 《2003年贵州省国民经济和社会发展统计公报》贵州省人民政府网站http://www.gzgov.gov.cn/pages/zfgg/show_tjgb.asp?id=1422
A14: 3 | B14: 农业情况
B15: a全年农业总产值 | C15: 466.7 | D15: 按当年价格计算 | E15: 13-6 农、林、牧、渔业总产值及指数
B16: b农业总产值 | C16: 275.5 | D16: 按当年价格计算 | E16: 13-6 农、林、牧、渔业总产值及指数
B17: c林业总产值 | C17: 25.9 | D17: 按当年价格计算 | E17: 13-6 农、林、牧、渔业总产值及指数
B18: d畜牧业总产值 | C18: 139.5 | D18: 按当年价格计算 | E18: 13-6 农、林、牧、渔业总产值及指数
B19: e渔业总产值 | C19: 6.1 | D19: 按当年价格计算 | E19: 13-6 农、林、牧、渔业总产值及指数
A20: 4 | B20: 投资情况
B21: a全社会固定资产投资额 | C21: 754.13 | D21: 按当年价格计算 | E21: 《2003年贵州省国民经济和社会发展统计公报》贵州省人民政府网站http://www.gzgov.gov.cn/pages/zfgg/show_tjgb.asp?id=1422
B22: b基本建设投资额 | C22: 384.81 | D22: 按当年价格计算 | E22: 《2003年贵州省国民经济和社会发展统计公报》贵州省人民政府网站http://www.gzgov.gov.cn/pages/zfgg/show_tjgb.asp?id=1422
B23: c更新改造投资额 | C23: 140.54 | D23: 按当年价格计算 | E23: 《2003年贵州省国民经济和社会发展统计公报》贵州省人民政府网站http://www.gzgov.gov.cn/pages/zfgg/show_tjgb.asp?id=1422
B24: d房地产开发投资额 | C24: 104.95 | D24: 按当年价格计算 | E24: 《2003年贵州省国民经济和社会发展统计公报》贵州省人民政府网站http://www.gzgov.gov.cn/pages/zfgg/show_tjgb.asp?id=1422
A25: 5 | B25: 全年居民消费水平
B26: a居民消费价格总指数（%） | C26: 101.23860000000001 | D26: 上年指数＝100 | E26: 9-5 居民消费价格指数和商品零售价格指数
B27: ①城镇居民消费价格指数（%） | C27: 100.87390000000001 | D27: 上年指数＝100 | E27: 9-5 居民消费价格指数和商品零售价格指数
B28: ②农村居民消费价格指数（%） | C28: 102.0121 | D28: 上年指数＝100 | E28: 9-5 居民消费价格指数和商品零售价格指数
B29: b消费品零售总额 | C29: 458.76 | D29: 按当年价格计算 | E29: 《2003年贵州省国民经济和社会发展统计公报》贵州省人民政府网站http://www.gzgov.gov.cn/pages/zfgg/show_tjgb.asp?id=1422
B30: ①城市消费品零售额 | C30: 271.95 | D30: 按当年价格计算 | E30: 《2003年贵州省国民经济和社会发展统计公报》贵州省人民政府网站http://www.gzgov.gov.cn/pages/zfgg/show_tjgb.asp?id=1422
B31: ②农村消费品零售额 | C31: 186.81 | D31: 县及县以下 | E31: 《2003年贵州省国民经济和社会发展统计公报》贵州省人民政府网站http://www.gzgov.gov.cn/pages/zfgg/show_tjgb.asp?id=1422
A32: ★6 | B32: 外贸情况(亿美元)
B33: a全年外贸总额(亿美元) | C33: 9.84 | D33: 按当年价格计算 | E33: 18-10 各地区按经营单位所在地分商品进出口总额
B34: b出口总额(亿美元) | C34: 5.88 | D34: 按当年价格计算 | E34: 18-10 各地区按经营单位所在地分商品进出口总额
B35: c 进口总额(亿美元) | C35: 3.96 | D35: 按当年价格计算 | E35: 18-10 各地区按经营单位所在地分商品进出口总额
A36: ★7 | B36: 全年利用外资情况(亿美元)
B37: a 外资直接投资(亿美元) | C37: 0.45 | D37: 按当年价格计算 | E37: 18-16 按地区分实际外商投资额
B38: b 合同外资(亿美元) | C38: ――――
B39: c 实际利用外资(亿美元) | C39: 0.56 | D39: 按当年价格计算 | E39: 《2003年贵州省国民经济和社会发展统计公报》贵州省人民政府网站http://www.gzgov.gov.cn/pages/zfgg/show_tjgb.asp?id=1422
A40: 8 | B40: 全省(市)财政总收入 | C40: 236.77 | D40: 按当年价格计算 | E40: 《贵州省2003年全省和省级预算执行情况及2004年全省和省级预算草案报告》贵州省人民政府网站http://www.gzgov.gov.cn/pages/zfgg/show_czys.asp?id=1360
B41: a全省（市）财政总收入/GDP （%） | C41: =C40*100/C7 -> 17.459498123308581 | D41: 按当年价格计算
B42: b地方财政收入（实际） | C42: 124.56 | D42: 按当年价格计算 | E42: 8-14 各地区财政收入(2003年)
B43: c 一般预算收入 | C43: 118.1 | D43: 按当年价格计算 | E43: 《贵州省2003年全省和省级预算执行情况及2004年全省和省级预算草案报告》贵州省人民政府网站http://www.gzgov.gov.cn/pages/zfgg/show_czys.asp?id=1360
B44: d税收收入总额 | C44: ―――― | D44: 工商税和农业四税总和
B45: ①增值税税收收入 | C45: 19.43 | D45: 按当年价格计算 | E45: 8-14 各地区财政收入(2003年)
B46: ②企业所得税税收收入 | C46: 8.41 | D46: 按当年价格计算 | E46: 8-14 各地区财政收入(2003年)
B47: ③个人所得税税收收入 | C47: 5.44 | D47: 按当年价格计算 | E47: 8-14 各地区财政收入(2003年)
B48: ④营业税税收收入 | C48: 31.46 | D48: 按当年价格计算 | E48: 8-14 各地区财政收入(2003年)
B49: ⑤资源税税收收入 | C49: 0.97 | D49: 按当年价格计算 | E49: 8-14 各地区财政收入(2003年)
B50: ⑥本省税收收入占本省（市）财政总收入比例（%） | C50: ―――― | D50: 按当年价格计算
B51: ⑦税收收入占国内生产总值比例（%） | C51: ―――― | D51: 按当年价格计算
A52: 9 | B52: a全省（市）财政支出总额（实际） | C52: 332.35 | D52: 按当年价格计算 | E52: 《贵州省2003年全省和省级预算执行情况及2004年全省和省级预算草案报告》贵州省人民政府网站http://www.gzgov.gov.cn/pages/zfgg/show_czys.asp?id=1360
B53: b一般财政预算支出 | C53: 202 | D53: 按当年价格计算 | E53: 《贵州省2003年全省和省级预算执行情况及2004年全省和省级预算草案报告》贵州省人民政府网站http://www.gzgov.gov.cn/pages/zfgg/show_czys.asp?id=1360
B54: c基本建设支出 | C54: 31.64 | D54: 按当年价格计算 | E54: 8-15 各地区财政支出(2003年)
B55: d农业支出 | C55: 14.51 | D55: 按当年价格计算 | E55: 8-15 各地区财政支出(2003年)
B56: e支农支出 | C56: ――――
B57: f科技三项支出 | C57: 2.31 | D57: 按当年价格计算 | E57: 8-15 各地区财政支出(2003年)
B58: g社会保障支出 | C58: 19.73 | D58: 包括社会补助支出 | E58: 8-15 各地区财政支出(2003年)
B59: h科教文卫支出 | C59: =(115871+601258+19641+172994)/10000 -> 90.976399999999998 | D59: 科学教育文体卫生事业支出 | E59: 8-15 各地区财政支出(2003年)
A60: 10 | B60: 本省财政收入与全国财政收入的比较
B61: a全国财政收入 | C61: 21715.25 | D61: 指当年全国的财政收入总额 | E61: 8-1 国家财政收支总额及增长速度
B62: b省(市)财政收入 | C62: 236.77 | D62: 此处为地方财政收入 | E62: 《贵州省2003年全省和省级预算执行情况及2004年全省和省级预算草案报告》贵州省人民政府网站http://www.gzgov.gov.cn/pages/zfgg/show_czys.asp?id=1360
B63: c本省财政收入占全国的比例 | C63: =C62*100/C61 -> 1.0903397382024154 | D63: a/c*100
A64: 11 | B64: 人民生活水平指标
B65: a城市居民人均可支配收入（单位：元） | C65: 6569.23 | D65: 按当年价格计算 | E65: 10-15 各地区城镇居民平均每人全年家庭收入来源（2004年）
B66: b城市居民恩格尔系数(%) | C66: =1968.22/4948.98*100 -> 39.770215276683281 | D66: 食品支出*100/消费性支出 | E66: 10-16 各地区城镇居民家庭平均每人全年消费性支出（2003年）
B67: c农村居民人均纯收入（单位：元） | C67: 1564.66 | D67: 按当年价格计算 | E67: 10-21 各地区农村居民家庭平均每人纯收入
B68: d农村居民恩格尔系数(%) | C68: =674.71*100/1185.17 -> 56.929385657753734 | D68: 食品支出*100/消费性支出 | E68: 10-26 各地区农村居民家庭平均每人生活消费支出 (2004年)
B69: e城乡收入水平差距 | C69: =C65-C67 -> 5004.57 | D69: e＝a-c