D1: 贵州省2004年
D2: 主要统计数据指标简表
D3: 本表主要根据《中国统计年鉴2005》电子版整理 | E3: 精确度：小数点后保留两位
E4: 单位:亿元（人民币）(注：本表中第6、7项除外)
A5: 项目号 | B5: 指标名称 | C5: 基本情况 | D5: 备注 | E5: 出处
A6: 1 | B6: 国内生产总值
B7: a GDP 总额 | C7: 1591.9 | D7: 按当年价格计算 | E7: 3-11 地区生产总值 (2004年)
B8: b GDP增加额 | C8: 235.78 | D8: 按当年价格计算
B9: c 人均GDP(单位：元) | C9: 7322.04 | D9: 按当年价格计算 | E9: 《2004年贵州省国民经济和社会发展统计公报》贵州省人民政府网站http://www.gzgov.gov.cn/pages/zfgg/show_tjgb.asp?id=1422
B10: d 第一产业增加值 | C10: 334.11 | D10: 按当年价格计算 | E10: 3-11 地区生产总值 (2004年)
B11: e 第二产业增加值 | C11: 714.66 | D11: 按当年价格计算 | E11: 3-11 地区生产总值 (2004年)
B12: f 第三产业增加值 | C12: 543.13 | D12: 按当年价格计算 | E12: 3-11 地区生产总值 (2004年)
A13: 2 | B13: 全年实现工业增加值 | C13: 574.62 | D13: 按当年价格计算 | E13: 《2004年贵州省国民经济和社会发展统计公报》贵州省人民政府网站http://www.gzgov.gov.cn/pages/zfgg/show_tjgb.asp?id=1422
A14: 3 | B14: 农业情况
B15: a全年农业总产值 | C15: 524.64449999999999 | D15: 按当年价格计算 | E15: 13-6 农、林、牧、渔业总产值及指数
B16: b农业总产值 | C16: 317.69316000000003 | D16: 按当年价格计算 | E16: 13-6 农、林、牧、渔业总产值及指数
B17: c林业总产值 | C17: 23.2455 | D17: 按当年价格计算 | E17: 13-6 农、林、牧、渔业总产值及指数
B18: d畜牧业总产值 | C18: 168.79781 | D18: 按当年价格计算 | E18: 13-6 农、林、牧、渔业总产值及指数
B19: e渔业总产值 | C19: 7.0162600000000008 | D19: 按当年价格计算 | E19: 13-6 农、林、牧、渔业总产值及指数
A20: 4 | B20: 投资情况
B21: a全社会固定资产投资额 | C21: 867.16 | D21: 按当年价格计算 | E21: 《2004年贵州省国民经济和社会发展统计公报》贵州省人民政府网站http://www.gzgov.gov.cn/pages/zfgg/show_tjgb.asp?id=1422 | F21: 《2004年贵州省国民经济和社会发展统计公报》贵州省人民政府网站http://www.gzgov.gov.cn/pages/zfgg/show_tjgb.asp?id=1422 | G21: 《2004年贵州省国民经济和社会发展统计公报》贵州省人民政府网站http://www.gzgov.gov.cn/pages/zfgg/show_tjgb.asp?id=1422 | H21: 《2004年贵州省国民经济和社会发展统计公报》贵州省人民政府网站http://www.gzgov.gov.cn/pages/zfgg/show_tjgb.asp?id=1422 | I21: 《2004年贵州省国民经济和社会发展统计公报》贵州省人民政府网站http://www.gzgov.gov.cn/pages/zfgg/show_tjgb.asp?id=1422 | J21: 《2004年贵州省国民经济和社会发展统计公报》贵州省人民政府网站http://www.gzgov.gov.cn/pages/zfgg/show_tjgb.asp?id=1422 | K21: 《2004年贵州省国民经济和社会发展统计公报》贵州省人民政府网站http://www.gzgov.gov.cn/pages/zfgg/show_tjgb.asp?id=1422
B22: b基本建设投资额 | C22: 472.27 | D22: 按当年价格计算 | E22: 《2004年贵州省国民经济和社会发展统计公报》贵州省人民政府网站http://www.gzgov.gov.cn/pages/zfgg/show_tjgb.asp?id=1422 | F22: 《2004年贵州省国民经济和社会发展统计公报》贵州省人民政府网站http://www.gzgov.gov.cn/pages/zfgg/show_tjgb.asp?id=1422 | G22: 《2004年贵州省国民经济和社会发展统计公报》贵州省人民政府网站http://www.gzgov.gov.cn/pages/zfgg/show_tjgb.asp?id=1422 | H22: 《2004年贵州省国民经济和社会发展统计公报》贵州省人民政府网站http://www.gzgov.gov.cn/pages/zfgg/show_tjgb.asp?id=1422 | I22: 《2004年贵州省国民经济和社会发展统计公报》贵州省人民政府网站http://www.gzgov.gov.cn/pages/zfgg/show_tjgb.asp?id=1422 | J22: 《2004年贵州省国民经济和社会发展统计公报》贵州省人民政府网站http://www.gzgov.gov.cn/pages/zfgg/show_tjgb.asp?id=1422 | K22: 《2004年贵州省国民经济和社会发展统计公报》贵州省人民政府网站http://www.gzgov.gov.cn/pages/zfgg/show_tjgb.asp?id=1422
B23: c更新改造投资额 | C23: 151.75 | D23: 按当年价格计算 | E23: 《2004年贵州省国民经济和社会发展统计公报》贵州省人民政府网站http://www.gzgov.gov.cn/pages/zfgg/show_tjgb.asp?id=1422
B24: d房地产开发投资额 | C24: 121.66 | D24: 按当年价格计算 | E24: 《2004年贵州省国民经济和社会发展统计公报》贵州省人民政府网站http://www.gzgov.gov.cn/pages/zfgg/show_tjgb.asp?id=1422 | F24: 《2004年贵州省国民经济和社会发展统计公报》贵州省人民政府网站http://www.gzgov.gov.cn/pages/zfgg/show_tjgb.asp?id=1422 | G24: 《2004年贵州省国民经济和社会发展统计公报》贵州省人民政府网站http://www.gzgov.gov.cn/pages/zfgg/show_tjgb.asp?id=1422 | H24: 《2004年贵州省国民经济和社会发展统计公报》贵州省人民政府网站http://www.gzgov.gov.cn/pages/zfgg/show_tjgb.asp?id=1422 | I24: 《2004年贵州省国民经济和社会发展统计公报》贵州省人民政府网站http://www.gzgov.gov.cn/pages/zfgg/show_tjgb.asp?id=1422 | J24: 《2004年贵州省国民经济和社会发展统计公报》贵州省人民政府网站http://www.gzgov.gov.cn/pages/zfgg/show_tjgb.asp?id=1422 | K24: 《2004年贵州省国民经济和社会发展统计公报》贵州省人民政府网站http://www.gzgov.gov.cn/pages/zfgg/show_tjgb.asp?id=1422
A25: 5 | B25: 全年居民消费水平
B26: a居民消费价格总指数（%） | C26: 103.98150000000001 | D26: 上年指数＝100 | E26: 9-5 居民消费价格指数和商品零售价格指数
B27: ①城镇居民消费价格指数（%） | C27: 103.45360000000001 | D27: 上年指数＝100 | E27: 9-5 居民消费价格指数和商品零售价格指数
B28: ②农村居民消费价格指数（%） | C28: 105.34400000000001 | D28: 上年指数＝100 | E28: 9-5 居民消费价格指数和商品零售价格指数
B29: b消费品零售总额 | C29: 517.56 | D29: 按当年价格计算 | E29: 《2004年贵州省国民经济和社会发展统计公报》贵州省人民政府网站http://www.gzgov.gov.cn/pages/zfgg/show_tjgb.asp?id=1422 | F29: 《2004年贵州省国民经济和社会发展统计公报》贵州省人民政府网站http://www.gzgov.gov.cn/pages/zfgg/show_tjgb.asp?id=1422 | G29: 《2004年贵州省国民经济和社会发展统计公报》贵州省人民政府网站http://www.gzgov.gov.cn/pages/zfgg/show_tjgb.asp?id=1422 | H29: 《2004年贵州省国民经济和社会发展统计公报》贵州省人民政府网站http://www.gzgov.gov.cn/pages/zfgg/show_tjgb.asp?id=1422 | I29: 《2004年贵州省国民经济和社会发展统计公报》贵州省人民政府网站http://www.gzgov.gov.cn/pages/zfgg/show_tjgb.asp?id=1422 | J29: 《2004年贵州省国民经济和社会发展统计公报》贵州省人民政府网站http://www.gzgov.gov.cn/pages/zfgg/show_tjgb.asp?id=1422 | K29: 《2004年贵州省国民经济和社会发展统计公报》贵州省人民政府网站http://www.gzgov.gov.cn/pages/zfgg/show_tjgb.asp?id=1422
B30: ①城市消费品零售额 | C30: 308.07 | D30: 按当年价格计算 | E30: 《2004年贵州省国民经济和社会发展统计公报》贵州省人民政府网站http://www.gzgov.gov.cn/pages/zfgg/show_tjgb.asp?id=1422 | F30: 《2004年贵州省国民经济和社会发展统计公报》贵州省人民政府网站http://www.gzgov.gov.cn/pages/zfgg/show_tjgb.asp?id=1422 | G30: 《2004年贵州省国民经济和社会发展统计公报》贵州省人民政府网站http://www.gzgov.gov.cn/pages/zfgg/show_tjgb.asp?id=1422 | H30: 《2004年贵州省国民经济和社会发展统计公报》贵州省人民政府网站http://www.gzgov.gov.cn/pages/zfgg/show_tjgb.asp?id=1422 | I30: 《2004年贵州省国民经济和社会发展统计公报》贵州省人民政府网站http://www.gzgov.gov.cn/pages/zfgg/show_tjgb.asp?id=1422 | J30: 《2004年贵州省国民经济和社会发展统计公报》贵州省人民政府网站http://www.gzgov.gov.cn/pages/zfgg/show_tjgb.asp?id=1422 | K30: 《2004年贵州省国民经济和社会发展统计公报》贵州省人民政府网站http://www.gzgov.gov.cn/pages/zfgg/show_tjgb.asp?id=1422
B31: ②农村消费品零售额 | C31: 202.49 | D31: 县及县以下 | E31: 《2004年贵州省国民经济和社会发展统计公报》贵州省人民政府网站http://www.gzgov.gov.cn/pages/zfgg/show_tjgb.asp?id=1422 | F31: 《2004年贵州省国民经济和社会发展统计公报》贵州省人民政府网站http://www.gzgov.gov.cn/pages/zfgg/show_tjgb.asp?id=1422 | G31: 《2004年贵州省国民经济和社会发展统计公报》贵州省人民政府网站http://www.gzgov.gov.cn/pages/zfgg/show_tjgb.asp?id=1422 | H31: 《2004年贵州省国民经济和社会发展统计公报》贵州省人民政府网站http://www.gzgov.gov.cn/pages/zfgg/show_tjgb.asp?id=1422 | I31: 《2004年贵州省国民经济和社会发展统计公报》贵州省人民政府网站http://www.gzgov.gov.cn/pages/zfgg/show_tjgb.asp?id=1422 | J31: 《2004年贵州省国民经济和社会发展统计公报》贵州省人民政府网站http://www.gzgov.gov.cn/pages/zfgg/show_tjgb.asp?id=1422 | K31: 《2004年贵州省国民经济和社会发展统计公报》贵州省人民政府网站http://www.gzgov.gov.cn/pages/zfgg/show_tjgb.asp?id=1422
A32: ★6 | B32: 外贸情况(亿美元)
B33: a全年外贸总额(亿美元) | C33: 15.14 | D33: 按当年价格计算 | E33: 《2004年贵州省国民经济和社会发展统计公报》贵州省人民政府网站http://www.gzgov.gov.cn/pages/zfgg/show_tjgb.asp?id=1422
B34: b出口总额(亿美元) | C34: 8.67 | D34: 按当年价格计算 | E34: 《2004年贵州省国民经济和社会发展统计公报》贵州省人民政府网站http://www.gzgov.gov.cn/pages/zfgg/show_tjgb.asp?id=1422
B35: c 进口总额(亿美元) | C35: 6.47 | D35: 按当年价格计算 | E35: 《2004年贵州省国民经济和社会发展统计公报》贵州省人民政府网站http://www.gzgov.gov.cn/pages/zfgg/show_tjgb.asp?id=1422
A36: ★7 | B36: 全年利用外资情况(亿美元)
B37: a 外资直接投资(亿美元) | C37: 0.45 | D37: 按当年价格计算 | E37: 18-16 按地区分实际外商投资额
B38: b 合同外资(亿美元) | C38: ――――
B39: c 实际利用外资(亿美元) | C39: 0.65 | D39: 按当年价格计算 | E39: 《2004年贵州省国民经济和社会发展统计公报》贵州省人民政府网站http://www.gzgov.gov.cn/pages/zfgg/show_tjgb.asp?id=1422
A40: 8 | B40: 全省(市)财政总收入 | C40: 296.49 | D40: 按当年价格计算 | E40: 《关于2004年贵州省和省级预算执行情况及2005年全省和省级预算草案的报告》金黔网http://www.gog.com.cn/jqzt/zt0201/ca765253.htm
B41: a财政收入（即a）/GDP （%） | C41: =C40*100/C7 -> 18.624913625227713 | D41: 按当年价格计算
B42: b地方财政收入（实际） | C42: 149.29 | D42: 按当年价格计算 | E42: 8-14 各地区财政收入 (2004年)
B43: c 一般预算收入 | C43: 137 | D43: 按当年价格计算 | E43: 《关于2004年贵州省和省级预算执行情况及2005年全省和省级预算草案的报告》金黔网http://www.gog.com.cn/jqzt/zt0201/ca765253.htm
B44: d税收收入总额 | C44: 100.56 | D44: 工商税和农业四税总和 | E44: 《2004年贵州省国民经济和社会发展统计公报》贵州省人民政府网站http://www.gzgov.gov.cn/pages/zfgg/show_tjgb.asp?id=1422
B45: ①增值税税收收入 | C45: 24.7 | D45: 按当年价格计算 | E45: 8-14 各地区财政收入 (2004年)
B46: ②企业所得税税收收入 | C46: 12.1 | D46: 按当年价格计算 | E46: 8-14 各地区财政收入 (2004年)
B47: ③个人所得税税收收入 | C47: 7.05 | D47: 按当年价格计算 | E47: 8-14 各地区财政收入 (2004年)
B48: ④营业税税收收入 | C48: 37.95 | D48: 按当年价格计算 | E48: 8-14 各地区财政收入 (2004年)
B49: ⑤资源税税收收入 | C49: 1.2 | D49: 按当年价格计算 | E49: 8-14 各地区财政收入 (2004年)
B50: ⑥本省税收收入占本省财政收入比例（%） | C50: =C44*100/C40 -> 33.916826874430839 | D50: 按当年价格计算
B51: ⑦税收收入占国内生产总值比例（%） | C51: =C44*100/C7 -> 6.3169797097807647 | D51: 按当年价格计算
A52: 9 | B52: a全省（市）财政支出总额（实际） | C52: 418.42 | D52: 按当年价格计算 | E52: 8-15 各地区财政支出 (2004年)
B53: b一般财政预算支出 | C53: 229 | D53: 按当年价格计算 | E53: 《关于2004年贵州省和省级预算执行情况及2005年全省和省级预算草案的报告》金黔网http://www.gog.com.cn/jqzt/zt0201/ca765253.htm
B54: c基本建设支出 | C54: 38.28 | D54: 按当年价格计算 | E54: 8-15 各地区财政支出 (2004年)
B55: d农业支出 | C55: 17.28 | D55: 按当年价格计算 | E55: 8-15 各地区财政支出 (2004年)
B56: e支农支出 | C56: ―――― | E56: 8-15 各地区财政支出 (2004年)
B57: f科技三项支出 | C57: 2.59 | D57: 按当年价格计算 | E57: 8-15 各地区财政支出 (2004年)
B58: g社会保障支出 | C58: 22.91 | D58: 包括社会补助支出 | E58: 8-15 各地区财政支出 (2004年)
B59: h科教文卫支出 | C59: 110.63 | D59: 科学教育文体卫生事业支出 | E59: 8-15 各地区财政支出 (2004年)
A60: 10 | B60: 本省财政收入与全国财政收入的比较
B61: a全国财政收入 | C61: 26396.47 | D61: 指当年全国的财政收入总额 | E61: 8-1 国家财政收支总额及增长速度
B62: b省(市)财政收入 | C62: 149.29 | D62: 此处为地方财政收入 | E62: 8-14 各地区财政收入 (2004年)
B63: c本省财政收入占全国的比例 | C63: =C62*100/C61 -> 0.56556804754575141 | D63: a/c*100
A64: 11 | B64: 人民生活水平指标
B65: a城市居民人均可支配收入 | C65: 7322.05 | D65: 按当年价格计算 | E65: 10-15 各地区城镇居民平均每人全年家庭收入来源（2004年）
B66: b城市居民恩格尔系数(%) | C66: =2260.46*100/5494.45 -> 41.140787521953975 | D66: 食品支出*100/消费性支出 | E66: 10-16 各地区城镇居民家庭平均每人全年消费性支出（2003年）
B67: c农村居民人均纯收入 | C67: 1721.55 | D67: 按当年价格计算 | E67: 10-21 各地区农村居民家庭平均每人纯收入
B68: d农村居民恩格尔系数(%) | C68: =754.39*100/1296.34 -> 58.193838036317636 | D68: 食品支出*100/消费性支出 | E68: 10-26 各地区农村居民家庭平均每人生活消费支出 (2004年)
B69: e城乡收入水平差距 | C69: =C65-C67 -> 5600.5 | D69: e＝a-c