D2: 海南省1995年主要统计数据指标简表
D3: 本表主要根据《2003海南统计年鉴》整理 | E3: 精确度：小数点后保留两位
D4: 单位:亿元（人民币）(注：本表中第6、7项除外)
A5: 项目号 | B5: 指标名称 | C5: 基本情况 | D5: 备注 | E5: 出处
A6: 1 | B6: 国内生产总值
B7: a GDP 总额 | C7: 364.17 | D7: 按当年价格计算 | E7: 《2003海南统计年鉴》28页
B8: b GDP增加额 | C8: 33.22 | D8: 按当年价格计算 | E8: 《2003海南统计年鉴》28页
B9: c 人均GDP(单位：元) | C9: 5225 | D9: 按当年价格计算 | E9: 《2003海南统计年鉴》28页
B10: d 第一产业增加值 | C10: 130.86 | D10: 按当年价格计算 | E10: 《2003海南统计年鉴》28页
B11: e 第二产业增加值 | C11: 78.64 | D11: 按当年价格计算 | E11: 《2003海南统计年鉴》28页
B12: f 第三产业增加值 | C12: 154.67 | D12: 按当年价格计算 | E12: 《2003海南统计年鉴》28页
A13: 2 | B13: 全年实现工业增加值 | C13: 42.13 | D13: 按当年价格计算 | E13: 《2003海南统计年鉴》30页
A14: 3 | B14: 农业情况
B15: a全年农业总产值 | C15: 130.86 | D15: 按当年价格计算 | E15: 《2003海南统计年鉴》30页
B16: b农业总产值 | C16: 41.47 | D16: 按1990年不变价格计算 | E16: 《2003海南统计年鉴》218页
B17: c林业总产值 | C17: 31.06 | D17: 按1990年不变价格计算 | E17: 《2003海南统计年鉴》218页
B18: d畜牧业总产值 | C18: 16.1 | D18: 按1990年不变价格计算 | E18: 《2003海南统计年鉴》218页
B19: e渔业总产值 | C19: 20.15 | D19: 按1990年不变价格计算 | E19: 《2003海南统计年鉴》218页
A20: 4 | B20: 投资情况
B21: a全社会固定资产投资额 | C21: 198.07 | E21: 《2003海南统计年鉴》99页
B22: b基本建设投资额 | C22: 132.45 | E22: 《2003海南统计年鉴》99页
B23: c更新改造投资额 | C23: 6.55 | E23: 《2003海南统计年鉴》99页
B24: d房地产开发投资额 | C24: 38.9 | E24: 《2003海南统计年鉴》99页
A25: 5 | B25: 全年居民消费水平
B26: a居民消费价格总指数（%） | C26: 113.5 | E26: 国家统计局
B27: ①城镇居民消费价格指数（%） | C27: 110.6 | E27: 国家统计局
B28: ②农村居民消费价格指数（%） | C28: 118.4 | E28: 国家统计局
B29: b消费品零售总额 | C29: 109.22 | E29: 《2003海南统计年鉴》355页
B30: ①城市消费品零售额 | C30: 83.82 | E30: 《2003海南统计年鉴》355页
B31: ②农村消费品零售额 | C31: 25.4 | E31: 《2003海南统计年鉴》355页
A32: ★6 | B32: 外贸情况(亿美元)
B33: a全年外贸总额(亿美元) | C33: 22.67 | E33: 《2003海南统计年鉴》384页
B34: b出口总额(亿美元) | C34: 8.3 | E34: 《2003海南统计年鉴》384页
B35: c 进口总额(亿美元) | C35: 14.37 | E35: 《2003海南统计年鉴》384页
A36: ★7 | B36: 全年利用外资情况(亿美元)
B37: a 外资直接投资(亿美元) | C37: 1055 | D37: 实际利用外商直接投资 | E37: 《2003海南统计年鉴》392页
B38: b 合同外资(亿美元) | C38: 30.7 | E38: 《2003海南统计年鉴》391页
B39: c 实际利用外资(亿美元) | C39: 14.55 | E39: 《2003海南统计年鉴》392页
A40: 8 | B40: 全省(市)财政总收入 | C40: 28.53 | D40: 慎用 | E40: 国家统计局
B41: a财政收入/GDP （%） | C41: =28.53/364.17*100 -> 7.8342532333800143 | D41: 慎用 | E41: 计算
B42: b地方财政收入（实际） | C42: 28.53 | E42: 《2003海南统计年鉴》409页
B43: c一般预算收入 | C43: 待查
B44: d税收收入总额 | C44: 24.81 | E44: 《2003海南统计年鉴》409页
B45: ①增值税税收收入 | D45: 包含在工商税收18.45内 | E45: 《2003海南统计年鉴》409页
B46: ②企业所得税税收收入 | C46: 2.14 | E46: 《2003海南统计年鉴》409页
B47: ③个人所得税税收收入 | C47: 待查
B48: ④营业税税收收入 | D48: 包含在工商税收18.45内 | E48: 《2003海南统计年鉴》409页
B49: ⑤资源税税收收入 | C49: 待查
B50: ⑥本省税收收入占本省财政收入比例（%） | C50: =24.81/28.53*100 -> 86.96109358569926 | D50: 慎用 | E50: 计算
B51: ⑦税收收入占国内生产总值比例（%） | C51: =24.81/364.17*100 -> 6.8127522860202641 | E51: 计算
A52: 9 | B52: a全省（市）财政支出总额（实际） | C52: 42.39 | E52: 《2003海南统计年鉴》410页
B53: b一般财政预算支出 | C53: 待查
B54: c基本建设支出 | C54: 6.08 | E54: 《2003海南统计年鉴》410页
B55: d农业支出 | D55: 农业综合开发，农林水利气象各支出0.54，1.62
B56: e支农支出 | C56: 3.94 | E56: 《2003海南统计年鉴》410页
B57: f科技三项支出 | C57: 0.14 | E57: http://www.stats.gov.cn/ndsj/information/zh1/g181a
B58: g社会保障支出 | C58: 待查
B59: h科教文卫支出 | C59: 11.35 | E59: 《2003海南统计年鉴》410页
A60: 10 | B60: 本省财政收入与全国财政收入的比较
B61: a全国财政收入 | C61: 6242.2 | E61: 国家统计局
B62: b省(市)财政收入 | C62: 28.53 | D62: 慎用 | E62: 国家统计局
B63: c本省财政收入占全国的比例 | C63: =28.53/6242.2 -> 4.5705039889782448E-3 | D63: 慎用 | E63: 计算
A64: 11 | B64: 人民生活水平指标
B65: a城市居民人均可支配收入（元） | C65: 4770 | E65: 《2003海南统计年鉴》178页
B66: b城市居民恩格尔系数(%) | C66: 待查
B67: c农村居民人均纯收入（元） | C67: 1872 | E67: 《2003海南统计年鉴》178页
B68: d农村居民恩格尔系数(%) | C68: 待查
B69: e城乡收入水平差距（元） | C69: =4770-1872 -> 2898 | E69: 计算