D2: 海南省2001年主要统计数据指标简表
C3: 国家统计局 | D3: 本表主要根据《2003海南统计年鉴》整理 | E3: 精确度：小数点后保留两位
D4: 单位:亿元（人民币）(注：本表中第6、7项除外)
A5: 项目号 | B5: 指标名称 | C5: 基本情况 | D5: 备注 | E5: 出处
A6: 1 | B6: 国内生产总值
B7: a GDP 总额 | C7: 566.72 | D7: 绝对数按现价计算 | E7: 2003海南统计年鉴
B8: b GDP增加额 | C8: 48.24 | D8: 绝对数按现价计算 | E8: 2003海南统计年鉴
B9: c 人均GDP(单位：元) | C9: 7406 | D9: 绝对数按现价计算 | E9: 2003海南统计年鉴
B10: d 第一产业增加值 | C10: 201.79 | D10: 绝对数按现价计算 | E10: 2003海南统计年鉴
B11: e 第二产业增加值 | C11: 132.01 | D11: 绝对数按现价计算 | E11: 2003海南统计年鉴
B12: f 第三产业增加值 | C12: 232.92 | D12: 绝对数按现价计算 | E12: 2003海南统计年鉴
A13: 2 | B13: 全年实现工业增加值 | C13: 91.05 | D13: 绝对数按现价计算 | E13: 国家统计局
A14: 3 | B14: 农业情况
B15: a全年农业总产值 | C15: 325.13 | D15: 按当年价格计算 | E15: 2003海南统计年鉴
B16: b农业总产值 | C16: 141.3 | D16: 按当年价格计算 | E16: 国家统计局
B17: c林业总产值 | C17: 43.3 | D17: 按当年价格计算 | E17: 国家统计局
B18: d畜牧业总产值 | C18: 58.2 | D18: 按当年价格计算 | E18: 国家统计局
B19: e渔业总产值 | C19: 82.3 | D19: 按当年价格计算 | E19: 国家统计局
A20: 4 | B20: 投资情况
B21: a全社会固定资产投资额 | C21: 206 | D21: 绝对数按现价计算 | E21: 国家统计局
B22: b基本建设投资额 | C22: 140.5 | D22: 绝对数按现价计算 | E22: 国家统计局
B23: c更新改造投资额 | C23: 10.6 | D23: 绝对数按现价计算 | E23: 国家统计局
B24: d房地产开发投资额 | C24: 12.5 | D24: 绝对数按现价计算 | E24: 国家统计局
A25: 5 | B25: 全年居民消费水平
B26: a居民消费价格总指数（%） | C26: 98.5 | E26: 2003海南统计年鉴
B27: ①城镇居民消费价格指数（%） | D27: 待查
B28: ②农村居民消费价格指数（%） | D28: 待查
B29: b消费品零售总额 | C29: 187.46 | D29: 绝对数按现价计算 | E29: 2003海南统计年鉴
B30: ①城市消费品零售额 | C30: 140.05 | D30: 绝对数按现价计算 | E30: 2003海南统计年鉴
B31: ②农村消费品零售额 | C31: 47.41 | D31: 绝对数按现价计算 | E31: 2003海南统计年鉴
A32: ★6 | B32: 外贸情况(亿美元)
B33: a全年外贸总额(亿美元) | C33: 17.62 | D33: 绝对数按现价计算 | E33: 2003海南统计年鉴
B34: b出口总额(亿美元) | C34: 9.61 | D34: 绝对数按现价计算 | E34: 2003海南统计年鉴
B35: c 进口总额(亿美元) | C35: 8.01 | D35: 绝对数按现价计算 | E35: 2003海南统计年鉴
A36: ★7 | B36: 全年利用外资情况(亿美元)
B37: a 外资直接投资(亿美元) | C37: 4.67 | D37: 绝对数按现价计算 | E37: 2003海南统计年鉴
B38: b 合同外资(亿美元) | C38: 1.54 | D38: 绝对数按现价计算 | E38: 2003海南统计年鉴
B39: c 实际利用外资(亿美元) | C39: 5.73 | D39: 绝对数按现价计算 | E39: 2003海南统计年鉴
A40: 8 | B40: 全省(市)财政总收入 | C40: 107.24 | E40: 2003海南统计年鉴
B41: a财政收入/GDP （%） | C41: =107.24/566.72*100 -> 18.92292490118577 | E41: 2003海南统计年鉴
B42: b地方财政收入（实际） | C42: 49.59 | E42: 2003海南统计年鉴
B43: c一般预算收入 | D43: 待查
B44: d税收收入总额 | C44: 48.64 | D44: 含国税收入 | E44: 国家统计局
B45: ①增值税税收收入 | C45: 3.52 | E45: 国家统计局
B46: ②企业所得税税收收入 | C46: 4.3 | E46: 国家统计局
B47: ③个人所得税税收收入 | C47: 4.37 | E47: 国家统计局
B48: ④营业税税收收入 | C48: 12.74 | E48: 国家统计局
B49: ⑤资源税税收收入 | C49: 0.42 | E49: 国家统计局
B50: ⑥本省税收收入占本省财政收入比例（%） | C50: =48.64/107.24*100 -> 45.356210369265206 | D50: 本省财政收入为全省财政总收入 | E50: 计算
B51: ⑦税收收入占国内生产总值比例（%） | C51: =48.64/566.72*100 -> 8.582721626199886 | E51: 计算
A52: 9 | B52: a全省（市）财政支出总额（实际） | C52: 84.58 | E52: 2003海南统计年鉴
B53: b一般财政预算支出 | D53: 待查
B54: c基本建设支出 | C54: 10.17 | E54: 国家统计局
B55: d农业支出 | D55: 农村综合开发，农村水利气象各支出1.17，2.47 | E55: 国家统计局
B56: e支农支出 | D56: 支援农村生产支出1.90 | E56: 国家统计局
B57: f科技三项支出 | C57: 0.2 | E57: 国家统计局
B58: g社会保障支出 | D58: 社会保障补助5.35 | E58: 国家统计局
B59: h科教文卫支出 | D59: 科学，教育，卫生事业各支出0.41，11.15，2.94 | E59: 国家统计局
A60: 10 | B60: 本省财政收入与全国财政收入的比较
B61: a全国财政收入 | C61: 16386.043000000001 | E61: 2002年中国财政部公告
B62: b省(市)财政收入 | C62: 107.24 | E62: 2003海南统计年鉴
B63: c本省财政收入占全国的比例 | C63: =107.24/16386.04 -> 6.5445952774434817E-3 | E63: 计算
A64: 11 | B64: 人民生活水平指标
B65: a城市居民人均可支配收入（元） | C65: 5839 | D65: 绝对数按现价计算 | E65: 国家统计局
B66: b城市居民恩格尔系数(%) | D66: 待查
B67: c农村居民人均纯收入（元） | C67: 2993 | D67: 绝对数按现价计算 | E67: 国家统计局
B68: d农村居民恩格尔系数(%) | D68: 待查
B69: e城乡收入水平差距（元） | C69: =5839-2993 -> 2846 | D69: e=a-c | E69: 计算