D2: 海南省2002年主要统计数据指标简表
D3: 本表主要根据《2003海南统计年鉴》整理 | E3: 精确度：小数点后保留两位
D4: 单位:亿元（人民币）(注：本表中第6、7项除外)
A5: 项目号 | B5: 指标名称 | C5: 基本情况 | D5: 备注 | E5: 出处
A6: 1 | B6: 国内生产总值
B7: a GDP 总额 | C7: 624.89 | E7: 2003海南统计年鉴
B8: b GDP增加额 | C8: =(624.89-566.72) -> 58.17 | E8: 2003海南统计年鉴
B9: c 人均GDP(单位：元) | C9: 8071 | E9: 2003海南统计年鉴
B10: d 第一产业增加值 | C10: 228.95 | E10: 2003海南统计年鉴
B11: e 第二产业增加值 | C11: 146.09 | E11: 2003海南统计年鉴
B12: f 第三产业增加值 | C12: 249.85 | E12: 2003海南统计年鉴
A13: 2 | B13: 全年实现工业增加值 | C13: 102 | D13: 绝对数按现价计算 | E13: 国家统计局
A14: 3 | B14: 农业情况
B15: a全年农业总产值 | C15: 360.23 | D15: 按当年价格计算 | E15: 2003海南统计年鉴
B16: b农业总产值 | C16: 151.45 | D16: 按当年价格计算（种植业） | E16: 2003海南统计年鉴
B17: c林业总产值 | C17: 49.14 | D17: 按当年价格计算 | E17: 2003海南统计年鉴
B18: d畜牧业总产值 | C18: 65.03 | D18: 按当年价格计算 | E18: 2003海南统计年鉴
B19: e渔业总产值 | C19: 94.6 | D19: 按当年价格计算 | E19: 2003海南统计年鉴
A20: 4 | B20: 投资情况
B21: a全社会固定资产投资额 | C21: 225.5 | D21: 绝对数按现价计算 | E21: 国家统计局
B22: b基本建设投资额 | C22: 152.02 | D22: 绝对数按现价计算 | E22: 国家统计局
B23: c更新改造投资额 | C23: 11.53 | D23: 绝对数按现价计算 | E23: 国家统计局
B24: d房地产开发投资额 | C24: 19.5 | D24: 绝对数按现价计算 | E24: 国家统计局
A25: 5 | B25: 全年居民消费水平
B26: a居民消费价格总指数（%） | C26: 98.4 | E26: 2003海南统计年鉴
B27: ①城镇居民消费价格指数（%） | C27: 99 | E27: 2003海南统计年鉴
B28: ②农村居民消费价格指数（%） | C28: 97.7 | E28: 2003海南统计年鉴
B29: b消费品零售总额 | C29: 204.4 | D29: 绝对数按现价计算 | E29: 2003海南统计年鉴
B30: ①城市消费品零售额 | C30: 152.28 | D30: 绝对数按现价计算 | E30: 2003海南统计年鉴
B31: ②农村消费品零售额 | C31: 52.12 | D31: 绝对数按现价计算 | E31: 2003海南统计年鉴
A32: ★6 | B32: 外贸情况(亿美元)
B33: a全年外贸总额(亿美元) | C33: 18.67 | D33: 绝对数按现价计算 | E33: 2003海南统计年鉴
B34: b出口总额(亿美元) | C34: 8.19 | D34: 绝对数按现价计算 | E34: 2003海南统计年鉴
B35: c 进口总额(亿美元) | C35: 10.48 | D35: 绝对数按现价计算 | E35: 2003海南统计年鉴
A36: ★7 | B36: 全年利用外资情况(亿美元)
B37: a 外资直接投资(亿美元) | C37: 5.12 | D37: 绝对数按现价计算 | E37: 2003海南统计年鉴
B38: b 合同外资(亿美元) | C38: 2.51 | D38: 绝对数按现价计算 | E38: 2003海南统计年鉴
B39: c 实际利用外资(亿美元) | C39: 9.99 | D39: 绝对数按现价计算 | E39: 2003海南统计年鉴
A40: 8 | B40: 全省(市)财政总收入 | C40: 119.68 | E40: 2003海南统计年鉴
B41: a财政收入/GDP （%） | C41: =119.68/624.89*100 -> 19.152170782057642 | E41: 2003海南统计年鉴
B42: b地方财政收入（实际） | C42: 51.83 | E42: 2003海南统计年鉴
B43: c一般预算收入 | C43: 46.24 | E43: 2003海南统计年鉴
B44: d税收收入总额 | C44: 51.83 | E44: 2003海南统计年鉴
B45: ①增值税税收收入 | C45: 3.93 | E45: 2003海南统计年鉴
B46: ②企业所得税税收收入 | C46: 3.3 | E46: 2003海南统计年鉴
B47: ③个人所得税税收收入 | C47: 待查
B48: ④营业税税收收入 | C48: 14.72 | E48: 2003海南统计年鉴
B49: ⑤资源税税收收入 | C49: 待查
B50: ⑥本省税收收入占本省财政收入比例（%） | C50: =51.83/119.68*100 -> 43.30715240641711 | E50: 计算
B51: ⑦税收收入占国内生产总值比例（%） | C51: =51.83/624.89*100 -> 8.2942597897229913 | E51: 计算
A52: 9 | B52: a全省（市）财政支出总额（实际） | C52: 98.45 | E52: 2003海南统计年鉴
B53: b一般财政预算支出 | C53: 92.26 | E53: 2003海南统计年鉴
B54: c基本建设支出 | C54: =(98.45*0.1148) -> 11.302060000000001 | E54: 2003海南统计年鉴
B55: d农业支出 | C55: ―― | E55: 2003海南统计年鉴
B56: e支农支出 | C56: =(98.45*0.0612) -> 6.0251399999999995 | E56: 2003海南统计年鉴
B57: f科技三项支出 | C57: ――
B58: g社会保障支出 | D58: 社会福利支出额为1.44 | E58: 2003海南统计年鉴
B59: h科教文卫支出 | C59: =(98.45*0.2036) -> 20.044420000000002 | E59: 2003海南统计年鉴
A60: 10 | B60: 本省财政收入与全国财政收入的比较
B61: a全国财政收入 | C61: 18903.64 | E61: 2002年中国财政部公告
B62: b省(市)财政收入 | C62: 119.68 | E62: 2003海南统计年鉴
B63: c本省财政收入占全国的比例 | C63: =119.68/18903.64 -> 6.3310558178213301E-3 | E63: 计算
A64: 11 | B64: 人民生活水平指标
B65: a城市居民人均可支配收入（元） | C65: 6823 | E65: 2003海南统计年鉴
B66: b城市居民恩格尔系数(%)
B67: c农村居民人均纯收入（元） | C67: 2423 | E67: 2003海南统计年鉴
B68: d农村居民恩格尔系数(%)
B69: e城乡收入水平差距（元） | C69: =6823-2423 -> 4400 | E69: 计算