D2: 海南省2004年主要统计数据指标简表
E3: 精确度：小数点后保留两位
D4: 单位:亿元（人民币）(注：本表中第6、7项除外)
A5: 项目号 | B5: 指标名称 | C5: 基本情况 | D5: 备注 | E5: 出处
A6: 1 | B6: 国内生产总值
B7: a GDP 总额 | C7: 790.12 | D7: 按可比价计算 | E7: 国家统计局
B8: b GDP增加额 | C8: 91.82 | D8: 按可比价计算 | E8: 国家统计局
B9: c 人均GDP(单位：元)
B10: d 第一产业增加值 | C10: 287.3 | E10: 国家统计局
B11: e 第二产业增加值 | C11: 201.17 | E11: 国家统计局
B12: f 第三产业增加值 | C12: 301.65 | E12: 国家统计局
A13: 2 | B13: 全年实现工业增加值 | C13: 140.44 | D13: 其中规模以上企业占123.46绝对数按现价计算 | E13: 国家统计局
A14: 3 | B14: 农业情况
B15: a全年农业总产值 | C15: 287.3 | D15: 按当年价格计算 | E15: 国家统计局
B16: b农业总产值 | C16: 109.9 | D16: 按当年价格计算（种植业） | E16: 国家统计局
B17: c林业总产值 | C17: 41.2 | D17: 按当年价格计算 | E17: 国家统计局
B18: d畜牧业总产值 | C18: 47.9 | D18: 按当年价格计算 | E18: 国家统计局
B19: e渔业总产值 | C19: 73.87 | D19: 按当年价格计算 | E19: 国家统计局
A20: 4 | B20: 投资情况
B21: a全社会固定资产投资额 | C21: 322.5 | D21: 按投资种类分，城镇，农村固定资产投资各有235.32，16.90 | E21: 国家统计局
B22: b基本建设投资额 | D22: 待查 | E22: 国家统计局
B23: c更新改造投资额 | D23: 待查
B24: d房地产开发投资额 | C24: 56 | D24: 绝对数按现价计算 | E24: 国家统计局
A25: 5 | B25: 全年居民消费水平
B26: a居民消费价格总指数（%） | D26: 居民消费价格水平涨4.4% | E26: 国家统计局
B27: ①城镇居民消费价格指数（%） | D27: 居民消费价格水平涨3.2% | E27: 国家统计局
B28: ②农村居民消费价格指数（%） | D28: 居民消费价格水平涨6.4% | E28: 国家统计局
B29: b消费品零售总额 | C29: 219.23 | D29: 绝对数按现价计算 | E29: 国家统计局
B30: ①城市消费品零售额 | C30: 167.55 | D30: 绝对数按现价计算 | E30: 国家统计局
B31: ②农村消费品零售额 | C31: 51.68 | D31: 绝对数按现价计算 | E31: 国家统计局
A32: ★6 | B32: 外贸情况(亿美元)
B33: a全年外贸总额(亿美元) | C33: 34.02 | D33: 绝对数按现价计算 | E33: 国家统计局
B34: b出口总额(亿美元) | C34: 10.93 | D34: 绝对数按现价计算 | E34: 国家统计局
B35: c 进口总额(亿美元) | C35: 23.09 | D35: 绝对数按现价计算 | E35: 国家统计局
A36: ★7 | B36: 全年利用外资情况(亿美元)
B37: a 外资直接投资(亿美元) | C37: 6.43 | D37: 绝对数按现价计算 | E37: 国家统计局
B38: b 合同外资(亿美元) | C38: 7.43 | D38: 绝对数按现价计算 | E38: 国家统计局
B39: c 实际利用外资(亿美元) | C39: 6.7 | D39: 绝对数按现价计算 | E39: 国家统计局
A40: 8 | B40: 全省(市)财政总收入 | C40: 122.76 | D40: 绝对数按现价计算 | E40: 国家统计局
B41: a财政收入/GDP （%） | C41: =122.76/790.12*100 -> 15.536880473852074
B42: b地方财政收入（实际） | C42: 69.39 | E42: 国家统计局
B43: c一般预算收入 | C43: 57 | E43: 国家统计局
B44: d税收收入总额 | C44: 96.22 | E44: 国家统计局
B45: ①增值税税收收入 | C45: =6.36*1.275 -> 8.109 | D45: 由增长率27.5%和上年数据计算得8.11 | E45: 国家统计局
B46: ②企业所得税税收收入 | C46: =2.6*1.29 -> 3.3540000000000001 | D46: 由增长率29.0%和上年数据计算得3.35 | E46: 国家统计局
B47: ③个人所得税税收收入 | C47: =2.78*1.131 -> 3.14418 | D47: 由增长率13.1%和上年数据计算得3.14 | E47: 国家统计局
B48: ④营业税税收收入 | C48: =16.06*1.184 -> 19.015039999999999 | D48: 由增长率18.4%和上年数据计算得19.02 | E48: 国家统计局
B49: ⑤资源税税收收入 | C49: =0.55*1.173 -> 0.64515000000000011 | D49: 由增长率17.3%和上年数据计算得0.65 | E49: 国家统计局
B50: ⑥本省税收收入占本省财政收入比例（%） | C50: =96.22/122.76*100 -> 78.380579993483209 | E50: 计算
B51: ⑦税收收入占国内生产总值比例（%） | C51: =96.22/790.12*100 -> 12.177897028299499 | E51: 计算
A52: 9 | B52: a全省（市）财政支出总额（实际） | C52: 141.11 | E52: 国家统计局
B53: b一般财政预算支出 | C53: 129.44 | D53: 同比上年增长23% | E53: 国家统计局
B54: c基本建设支出 | D54: 同比上年增长24.4% | E54: 国家统计局
B55: d农业支出 | D55: 待查
B56: e支农支出 | D56: 同比上年增长39.2% | E56: 国家统计局
B57: f科技三项支出 | D57: 全年科技经费6.0亿元，增长10.0%
B58: g社会保障支出 | D58: 待查
B59: h科教文卫支出 | D59: 其中教育同比上年增长22.3% | E59: 国家统计局
A60: 10 | B60: 本省财政收入与全国财政收入的比较
B61: a全国财政收入 | C61: =10086.1/0.383 -> 26334.464751958225 | E61: 国家统计局
B62: b省(市)财政收入 | C62: 122.76 | E62: 国家统计局
B63: c本省财政收入占全国的比例 | C63: =122.76/26334.46 -> 4.6615727073955572E-3 | E63: 计算
A64: 11 | B64: 人民生活水平指标
B65: a城市居民人均可支配收入（元） | C65: 7736 | E65: 国家统计局
B66: b城市居民恩格尔系数(%)
B67: c农村居民人均纯收入（元） | C67: 2818 | E67: 国家统计局
B68: d农村居民恩格尔系数(%)
B69: e城乡收入水平差距（元） | C69: 4918 | E69: 计算