D1: 宁夏回族自治区1990年
D2: 主要统计数据指标简表
D3: 本表主要根据《宁夏统计年鉴2003》整理
D4: 单位:亿元（人民币）(注：本表中第6、7项除外) | E4: 精确度：小数点后保留两位
A5: 项目号 | B5: 指标名称 | C5: 基本情况 | D5: 备注 | E5: 出处
A6: 1 | B6: 国内生产总值
B7: a GDP 总额 | C7: 64.84 | D7: 按当年价格计算 | E7: 《宁夏统计年鉴2003》28页
B8: b GDP增加额 | C8: =C7-59.21 -> 5.63 | D8: 按当年价格计算 | E8: 《宁夏统计年鉴2003》38页
B9: c 人均GDP(单位：元) | C9: 1393 | D9: 按当年价格计算 | E9: 《宁夏统计年鉴2003》28页
B10: d 第一产业增加值 | C10: 16.84 | D10: 按当年价格计算 | E10: 《宁夏统计年鉴2003》28页
B11: e 第二产业增加值 | C11: 25.34 | D11: 按当年价格计算 | E11: 《宁夏统计年鉴2003》28页
B12: f 第三产业增加值 | C12: 22.66 | D12: 按当年价格计算 | E12: 《宁夏统计年鉴2003》28页
A13: 2 | B13: 全年实现工业增加值 | C13: 21.29 | D13: 按当年价格计算 | E13: 《宁夏统计年鉴2003》30页
A14: 3 | B14: 农业情况
B15: a全年农业总产值 | C15: 24.688700000000001 | D15: 按当年价格计算 | E15: 《宁夏统计年鉴2003》210页
B16: b农业总产值 | C16: 17.511299999999999 | D16: 按当年价格计算 | E16: 《宁夏统计年鉴2003》210页
B17: c林业总产值 | C17: 1.3186 | D17: 按当年价格计算 | E17: 《宁夏统计年鉴2003》210页
B18: d畜牧业总产值 | C18: 5.3974000000000002 | D18: 按当年价格计算 | E18: 《宁夏统计年鉴2003》210页
B19: e渔业总产值 | C19: 0.46139999999999998 | D19: 按当年价格计算 | E19: 《宁夏统计年鉴2003》210页
A20: 4 | B20: 投资情况
B21: a全社会固定资产投资额 | C21: 21.9603 | D21: 按当年价格计算 | E21: 《宁夏统计年鉴2003》111页
B22: b基本建设投资额 | C22: 11.333600000000001 | D22: 按当年价格计算 | E22: 《宁夏统计年鉴2003》111页
B23: c更新改造投资额 | C23: 5.2611999999999997 | D23: 按当年价格计算 | E23: 《宁夏统计年鉴2003》111页
B24: d房地产开发投资额
A25: 5 | B25: 全年居民消费水平
B26: a居民消费价格总指数（%） | C26: 107.1 | D26: 上年价格=100 | E26: 《宁夏统计年鉴2003》163页
B27: ①城镇居民消费价格指数（%） | C27: 105.5 | D27: 上年价格=100 | E27: 《宁夏统计年鉴2003》163页
B28: ②农村居民消费价格指数（%） | C28: 109 | D28: 上年价格=100 | E28: 《宁夏统计年鉴2003》163页
B29: b消费品零售总额 | C29: 25.303899999999999 | D29: 按当年价格计算 | E29: 《宁夏统计年鉴2003》350页
B30: ①城市消费品零售额 | C30: 15.176 | D30: 按当年价格计算 | E30: 《宁夏统计年鉴2003》350页
B31: ②农村消费品零售额 | C31: =C29-C30 -> 10.127899999999999 | D31: 按当年价格计算 | E31: 《宁夏统计年鉴2003》350页
A32: ★6 | B32: 外贸情况(亿美元)
B33: a全年外贸总额(亿美元) | C33: 2.78 | D33: 按当年价格计算 | E33: 《宁夏统计年鉴2003》32页
B34: b出口总额(亿美元) | C34: 2.4 | D34: 按当年价格计算 | E34: 《宁夏统计年鉴2003》32页
B35: c 进口总额(亿美元) | C35: 0.38 | D35: 按当年价格计算 | E35: 《宁夏统计年鉴2003》32页
A36: ★7 | B36: 全年利用外资情况(亿美元)
B37: a 外资直接投资(亿美元)
B38: b 合同外资(亿美元) | D38: 注意使用
B39: c 实际利用外资(亿美元)
A40: 8 | B40: 全省(市)财政总收入
B41: a财政收入/GDP （%） | C41: 9.61 | E41: 《宁夏统计年鉴2003》147页
B42: b地方财政收入（实际） | C42: 6.23 | D42: 按当年价格计算 | E42: 《宁夏统计年鉴2003》145页
B43: d 一般预算收入
B44: e税收收入总额
B45: ①增值税税收收入
B46: ②企业所得税税收收入 | C46: 0.88049999999999995 | D46: 按当年价格计算 | E46: 《宁夏统计年鉴2003》145页
B47: ③个人所得税税收收入
B48: ④营业税税收收入
B49: ⑤资源税税收收入
B50: ⑥本省税收收入占本省财政收入比例（%）
B51: ⑦税收收入占国内生产总值比例（%）
A52: 9 | B52: a全省（市）财政支出总额（实际）
B53: b地方财政支出 | C53: 14.961600000000001 | D53: 按当年价格计算 | E53: 《宁夏统计年鉴2003》146页
B54: c基本建设支出 | C54: 1.4610000000000001 | D54: 按当年价格计算 | E54: 《宁夏统计年鉴2003》146页
B55: d农业支出
B56: e支农支出 | C56: 2.0015000000000001 | D56: 按当年价格计算 | E56: 《宁夏统计年鉴2003》146页
B57: f科技三项支出
B58: g社会保障支出 | C58: 0.2099 | D58: 按当年价格计算 | E58: 《宁夏统计年鉴2003》146页
B59: h科教文卫支出 | C59: 3.6659000000000002 | D59: 按当年价格计算 | E59: 《宁夏统计年鉴2003》146页
A60: 10 | B60: 本省财政收入与全国财政收入的比较
B61: a全国财政收入
B62: b省(市)财政收入
B63: c本省财政收入占全国的比例
A64: 11 | B64: 人民生活水平指标
B65: a城市居民人均可支配收入 | C65: 1421.2 | D65: 按当年价格计算 | E65: 《宁夏统计年鉴2003》182页
B66: b城市居民恩格尔系数(%) | C66: =639.48/1211.79 -> 0.52771519817790213 | D66: 人均食品支出/人均消费支出 | E66: 《宁夏统计年鉴2003》182页
B67: c农村居民人均纯收入 | C67: 594.28 | D67: 按当年价格计算 | E67: 《宁夏统计年鉴2003》191页
B68: d农村居民恩格尔系数(%) | C68: =275.25/486.32 -> 0.56598535943411743 | D68: 人均食品支出/人均消费支出 | E68: 《宁夏统计年鉴2003》191页
B69: e城乡收入水平差距 | C69: =C65-C67 -> 826.92 | D69: e=a-c