D1: 宁夏回族自治区1993年
D2: 主要统计数据指标简表
D3: 本表主要根据《宁夏统计年鉴2003》整理
D4: 单位:亿元（人民币）(注：本表中第6、7项除外) | E4: 精确度：小数点后保留两位
A5: 项目号 | B5: 指标名称 | C5: 基本情况 | D5: 备注 | E5: 出处
A6: 1 | B6: 国内生产总值
B7: a GDP 总额 | C7: 103.82 | D7: 按当年价格计算 | E7: 《宁夏统计年鉴2003》38页
B8: b GDP增加额 | C8: =C7-83.14 -> 20.68 | D8: 按当年价格计算 | E8: 《宁夏统计年鉴2003》38页
B9: c 人均GDP(单位：元) | C9: 2123 | D9: 按当年价格计算 | E9: 《宁夏统计年鉴2003》38页
B10: d 第一产业增加值 | C10: 20.84 | D10: 按当年价格计算 | E10: 《宁夏统计年鉴2003》38页
B11: e 第二产业增加值 | C11: 45.52 | D11: 按当年价格计算 | E11: 《宁夏统计年鉴2003》38页
B12: f 第三产业增加值 | C12: 37.46 | D12: 按当年价格计算 | E12: 《宁夏统计年鉴2003》38页
A13: 2 | B13: 全年实现工业增加值 | C13: 37.15 | D13: 按当年价格计算 | E13: 《宁夏统计年鉴2003》38页
A14: 3 | B14: 农业情况
B15: a全年农业总产值 | C15: 31.89 | D15: 按当年价格计算 | E15: 《宁夏统计年鉴2003》209页
B16: b农业总产值 | C16: 22.69 | D16: 按当年价格计算 | E16: 《宁夏统计年鉴2003》209页
B17: c林业总产值 | C17: 0.9042 | D17: 按当年价格计算 | E17: 《宁夏统计年鉴2003》209页
B18: d畜牧业总产值 | C18: 7.4996999999999998 | D18: 按当年价格计算 | E18: 《宁夏统计年鉴2003》209页
B19: e渔业总产值 | C19: 0.7954 | D19: 按当年价格计算 | E19: 《宁夏统计年鉴2003》209页
A20: 4 | B20: 投资情况
B21: a全社会固定资产投资额 | C21: 52.667299999999997 | D21: 按当年价格计算 | E21: 《宁夏统计年鉴2003》111页
B22: b基本建设投资额 | C22: 25.366199999999999 | D22: 按当年价格计算 | E22: 《宁夏统计年鉴2003》111页
B23: c更新改造投资额 | C23: 11.3741 | D23: 按当年价格计算 | E23: 《宁夏统计年鉴2003》111页
B24: d房地产开发投资额
A25: 5 | B25: 全年居民消费水平
B26: a居民消费价格总指数（%） | C26: 114.3 | D26: 上年价格=100 | E26: 《宁夏统计年鉴2003》163页
B27: ①城镇居民消费价格指数（%） | C27: 115.2 | D27: 上年价格=100 | E27: 《宁夏统计年鉴2003》163页
B28: ②农村居民消费价格指数（%） | C28: 113.8 | D28: 上年价格=100 | E28: 《宁夏统计年鉴2003》163页
B29: b消费品零售总额 | C29: 38.509099999999997 | D29: 按当年价格计算 | E29: 《宁夏统计年鉴2003》350页
B30: ①城市消费品零售额 | C30: 21.328600000000002 | D30: 按当年价格计算 | E30: 《宁夏统计年鉴2003》350页
B31: ②农村消费品零售额 | C31: =C29-C30 -> 17.180499999999995 | D31: 按当年价格计算 | E31: 《宁夏统计年鉴2003》350页
A32: ★6 | B32: 外贸情况(亿美元)
B33: a全年外贸总额(亿美元) | C33: 1.4350000000000001 | D33: 按当年价格计算 | E33: 《宁夏统计年鉴2003》359页
B34: b出口总额(亿美元) | C34: 1.1124000000000001 | D34: 按当年价格计算 | E34: 《宁夏统计年鉴2003》359页
B35: c 进口总额(亿美元) | C35: 0.3226 | D35: 按当年价格计算 | E35: 《宁夏统计年鉴2003》359页
A36: ★7 | B36: 全年利用外资情况(亿美元)
B37: a 外资直接投资(亿美元)
B38: b 合同外资(亿美元) | D38: 注意使用
B39: c 实际利用外资(亿美元)
A40: 8 | B40: 全省(市)财政总收入
B41: a财政收入/GDP （%） | C41: 10.45 | E41: 《宁夏统计年鉴2003》147页
B42: b地方财政收入（实际） | C42: 10.8522 | D42: 按当年价格计算 | E42: 《宁夏统计年鉴2003》145页
B43: d 一般预算收入
B44: e税收收入总额
B45: ①增值税税收收入
B46: ②企业所得税税收收入 | C46: 0.8962 | D46: 按当年价格计算 | E46: 《宁夏统计年鉴2003》145页
B47: ③个人所得税税收收入
B48: ④营业税税收收入
B49: ⑤资源税税收收入
B50: ⑥本省税收收入占本省财政收入比例（%）
B51: ⑦税收收入占国内生产总值比例（%）
A52: 9 | B52: a全省（市）财政支出总额（实际）
B53: b一般财政预算支出 | C53: 19.395900000000001 | D53: 按当年价格计算 | E53: 《宁夏统计年鉴2003》146页
B54: c基本建设支出 | C54: 1.4723999999999999 | D54: 按当年价格计算 | E54: 《宁夏统计年鉴2003》146页
B55: d农业支出
B56: e支农支出 | C56: 2.5356999999999998 | D56: 按当年价格计算 | E56: 《宁夏统计年鉴2003》146页
B57: f科技三项支出
B58: g社会保障支出 | C58: 0.25390000000000001 | D58: 按当年价格计算 | E58: 《宁夏统计年鉴2003》146页
B59: h科教文卫支出 | C59: 4.8159000000000001 | D59: 按当年价格计算 | E59: 《宁夏统计年鉴2003》146页
A60: 10 | B60: 本省财政收入与全国财政收入的比较
B61: a全国财政收入 | C61: 43.48.95 | D61: 按当年价格计算 | E61: 《中国统计年鉴1996》http://www.stats.gov.cn/ndsj/information/zh1/g011a
B62: b省(市)财政收入
B63: c本省财政收入占全国的比例
A64: 11 | B64: 人民生活水平指标
B65: a城市居民人均可支配收入 | C65: 2170.56 | D65: 按当年价格计算 | E65: 《宁夏统计年鉴2003》182页
B66: b城市居民恩格尔系数(%) | C66: =816.36/1877.4 -> 0.43483541067433684 | D66: 人均食品支出/人均消费支出 | E66: 《宁夏统计年鉴2003》182页
B67: c农村居民人均纯收入 | C67: 667.06 | D67: 按当年价格计算 | E67: 《宁夏统计年鉴2003》191页
B68: d农村居民恩格尔系数(%) | C68: =341.78/605.93 -> 0.56405855461852028 | D68: 人均食品支出/人均消费支出 | E68: 《宁夏统计年鉴2003》191页
B69: e城乡收入水平差距 | C69: =C65-C67 -> 1503.5 | D69: e=a-c