D1: 宁夏回族自治区1995年
D2: 主要统计数据指标简表
D3: 本表主要根据《中国统计年鉴1996》整理
D4: 单位:亿元（人民币）(注：本表中第6、7项除外) | E4: 精确度：小数点后保留两位
A5: 项目号 | B5: 指标名称 | C5: 基本情况 | D5: 备注 | E5: 出处
A6: 1 | B6: 国内生产总值
B7: a GDP 总额 | C7: 169.75 | D7: 按当年价格计算 | E7: 《宁夏统计年鉴2003》28页
B8: b GDP增加额 | C8: =C7-133.97 -> 35.78 | D8: 计算而得
B9: c 人均GDP(单位：元) | C9: 3328 | D9: 按当年价格计算 | E9: 《宁夏统计年鉴2003》28页
B10: d 第一产业增加值 | C10: 35.39 | D10: 按当年价格计算 | E10: 《宁夏统计年鉴2003》28页
B11: e 第二产业增加值 | C11: 74.14 | D11: 按当年价格计算 | E11: 《宁夏统计年鉴2003》28页
B12: f 第三产业增加值 | C12: 60.22 | D12: 按当年价格计算 | E12: 《宁夏统计年鉴2003》28页
A13: 2 | B13: 全年实现工业增加值 | C13: 62.45 | D13: 按当年价格计算 | E13: 《宁夏统计年鉴2003》30页
A14: 3 | B14: 农业情况
B15: a全年农业总产值 | C15: 56.55 | D15: 按当年价格计算 | E15: 《中国统计年鉴1996》http://www.stats.gov.cn/ndsj/information/zh1/e171a
B16: b农业总产值 | C16: 38.13 | D16: 按当年价格计算 | E16: 《中国统计年鉴1996》http://www.stats.gov.cn/ndsj/information/zh1/e171a
B17: c林业总产值 | C17: 0.97 | D17: 按当年价格计算 | E17: 《中国统计年鉴1996》http://www.stats.gov.cn/ndsj/information/zh1/e171a
B18: d畜牧业总产值 | C18: 16.29 | D18: 按当年价格计算 | E18: 《中国统计年鉴1996》http://www.stats.gov.cn/ndsj/information/zh1/e171a
B19: e渔业总产值 | C19: 1.16 | D19: 按当年价格计算 | E19: 《中国统计年鉴1996》http://www.stats.gov.cn/ndsj/information/zh1/e171a
A20: 4 | B20: 投资情况
B21: a全社会固定资产投资额 | C21: 62.17 | D21: 按当年价格计算 | E21: 《中国统计年鉴1996》http://www.stats.gov.cn/ndsj/information/zh1/e021a
B22: b基本建设投资额 | C22: 26.74 | D22: 按当年价格计算 | E22: 《中国统计年鉴1996》http://www.stats.gov.cn/ndsj/information/zh1/e061a
B23: c更新改造投资额 | C23: 15.17 | D23: 按当年价格计算 | E23: 《中国统计年鉴1996》http://www.stats.gov.cn/ndsj/information/zh1/e171a
B24: d房地产开发投资额 | C24: 4.91 | D24: 按当年价格计算 | E24: 《中国统计年鉴1996》http://www.stats.gov.cn/ndsj/information/zh1/e361a
A25: 5 | B25: 全年居民消费水平
B26: a居民消费价格总指数（%） | C26: 117.1 | D26: 上年价格=100 | E26: 《中国统计年鉴1996》http://www.stats.gov.cn/ndsj/information/zh1/h051a
B27: ①城镇居民消费价格指数（%） | C27: 117.3 | D27: 上年价格=100 | E27: 《中国统计年鉴1996》http://www.stats.gov.cn/ndsj/information/zh1/h051a
B28: ②农村居民消费价格指数（%） | C28: 116.4 | D28: 上年价格=100 | E28: 《中国统计年鉴1996》http://www.stats.gov.cn/ndsj/information/zh1/h051a
B29: b消费品零售总额 | C29: 57.2 | D29: 按当年价格计算 | E29: 《中国统计年鉴1996》http://www.stats.gov.cn/ndsj/information/zh1/o211a
B30: ①城市消费品零售额 | C30: 35.6 | D30: 按当年价格计算 | E30: 《中国统计年鉴1996》http://www.stats.gov.cn/ndsj/information/zh1/o211a
B31: ②农村消费品零售额 | C31: =C29-C30 -> 21.6 | D31: 按当年价格计算 | E31: 《中国统计年鉴1996》http://www.stats.gov.cn/ndsj/information/zh1/o211a
A32: ★6 | B32: 外贸情况(亿美元)
B33: a全年外贸总额(亿美元) | C33: 2.78 | D33: 按当年价格计算 | E33: 《宁夏统计年鉴2003》32页
B34: b出口总额(亿美元) | C34: 2.4 | D34: 按当年价格计算 | E34: 《宁夏统计年鉴2003》32页
B35: c 进口总额(亿美元) | C35: 0.38 | D35: 按当年价格计算 | E35: 《宁夏统计年鉴2003》32页
A36: ★7 | B36: 全年利用外资情况(亿美元)
B37: a 外资直接投资(亿美元) | C37: 0.54900000000000004 | D37: 按当年价格计算 | E37: 《中国统计年鉴1996》http://www.stats.gov.cn/ndsj/information/zh1/p161a
B38: b 合同外资(亿美元) | D38: 注意使用
B39: c 实际利用外资(亿美元) | C39: 1.8888 | D39: 按当年价格计算 | E39: 《中国统计年鉴1996》http://www.stats.gov.cn/ndsj/information/zh1/p161a
A40: 8 | B40: 全省(市)财政总收入
B41: a财政收入/GDP （%） | C41: 5.29 | E41: 《宁夏统计年鉴2003》147页
B42: b地方财政收入（实际） | C42: 8.98 | D42: 按当年价格计算 | E42: 《宁夏统计年鉴2003》28页
B43: d 一般预算收入
B44: e税收收入总额
B45: ①增值税税收收入
B46: ②企业所得税税收收入 | C46: 0.76900000000000002 | D46: 按当年价格计算 | E46: 《中国统计年鉴1996》http://www.stats.gov.cn/ndsj/information/zh1/g171a
B47: ③个人所得税税收收入
B48: ④营业税税收收入
B49: ⑤资源税税收收入
B50: ⑥本省税收收入占本省财政收入比例（%）
B51: ⑦税收收入占国内生产总值比例（%）
A52: 9 | B52: a全省（市）财政支出总额（实际）
B53: b地方财政支出 | C53: 22.996300000000002 | D53: 按当年价格计算 | E53: 《中国统计年鉴1996》http://www.stats.gov.cn/ndsj/information/zh1/g181a
B54: c基本建设支出 | C54: 1.5941000000000001 | D54: 按当年价格计算 | E54: 《中国统计年鉴1996》http://www.stats.gov.cn/ndsj/information/zh1/g181a
B55: d农业支出 | C55: 0.50039999999999996 | D55: 按当年价格计算 | E55: 《中国统计年鉴1996》http://www.stats.gov.cn/ndsj/information/zh1/g184a
B56: e支农支出 | C56: 1.1938 | D56: 按当年价格计算 | E56: 《中国统计年鉴1996》http://www.stats.gov.cn/ndsj/information/zh1/g182a
B57: f科技三项支出 | C57: 0.1613 | D57: 按当年价格计算 | E57: 《中国统计年鉴1996》http://www.stats.gov.cn/ndsj/information/zh1/g181a
B58: g社会保障支出 | C58: 0.3473 | D58: 抚恤和社会救济费 | E58: 《中国统计年鉴1996》http://www.stats.gov.cn/ndsj/information/zh1/g183a
B59: h科教文卫支出 | C59: =6.3037+0.2376 -> 6.5412999999999997 | D59: 按当年价格计算 | E59: 《中国统计年鉴1996》http://www.stats.gov.cn/ndsj/information/zh1/g183a
A60: 10 | B60: 本省财政收入与全国财政收入的比较
B61: a全国财政收入 | C61: 6242.2 | D61: 按当年价格计算 | E61: 《中国统计年鉴1996》http://www.stats.gov.cn/ndsj/information/zh1/g011a
B62: b省(市)财政收入 | C62: 8.9792000000000005 | D62: 按当年价格计算 | E62: 《中国统计年鉴1996》http://www.stats.gov.cn/ndsj/information/zh1/g171a
B63: c本省财政收入占全国的比例 | C63: =C62/C61 -> 1.4384672070744289E-3 | D63: 计算而得
A64: 11 | B64: 人民生活水平指标
B65: a城市居民人均可支配收入 | C65: 3382.81 | D65: 按当年价格计算 | E65: 《中国统计年鉴1996》http://www.stats.gov.cn/ndsj/information/zh1/i121a
B66: b城市居民恩格尔系数(%) | C66: =1331.12/2865.71 -> 0.46449919915134463 | E66: 《中国统计年鉴1996》http://www.stats.gov.cn/ndsj/information/zh1/i131a
B67: c农村居民人均纯收入 | C67: 998.75 | D67: 按当年价格计算 | E67: 《中国统计年鉴1996》http://www.stats.gov.cn/ndsj/information/zh1/i181a
B68: d农村居民恩格尔系数(%) | C68: =617.67/1063.2 -> 0.58095372460496608 | E68: 《中国统计年鉴1996》http://www.stats.gov.cn/ndsj/information/zh1/i201a
B69: e城乡收入水平差距 | C69: =C65-C67 -> 2384.06 | D69: e=a-c