D1: 宁夏回族自治区1996年
D2: 主要统计数据指标简表
D3: 本表主要根据《中国统计年鉴1997》整理
D4: 单位:亿元（人民币）(注：本表中第6、7项除外) | E4: 精确度：小数点后保留两位
A5: 项目号 | B5: 指标名称 | C5: 基本情况 | D5: 备注 | E5: 出处
A6: 1 | B6: 国内生产总值
B7: a GDP 总额 | C7: 193.62 | D7: 按可比价格计算 | E7: 《中国统计年鉴1997》http://www.stats.gov.cn/ndsj/zgnj/2000/C08c.htmhttp://www.stats.gov.cn/ndsj/information/nj97/B101A.END
B8: b GDP增加额 | C8: =C7-169.75 -> 23.87 | D8: 计算而得
B9: c 人均GDP(单位：元) | C9: 3731 | D9: 按当年价格计算 | E9: 《宁夏统计年鉴2003》38页
B10: d 第一产业增加值 | C10: 43.24 | D10: 按可比价格计算 | E10: 《中国统计年鉴1997》http://www.stats.gov.cn/ndsj/information/nj97/B111A.END
B11: e 第二产业增加值 | C11: 79.74 | D11: 按可比价格计算 | E11: 《中国统计年鉴1997》http://www.stats.gov.cn/ndsj/information/nj97/B111A.END
B12: f 第三产业增加值 | C12: 70.64 | D12: 按可比价格计算 | E12: 《中国统计年鉴1997》http://www.stats.gov.cn/ndsj/information/nj97/B111A.END
A13: 2 | B13: 全年实现工业增加值 | C13: 67.64 | D13: 按可比价格计算 | E13: 《中国统计年鉴1997》http://www.stats.gov.cn/ndsj/information/nj97/B111A.END
A14: 3 | B14: 农业情况
B15: a全年农业总产值 | C15: 69.168999999999997 | D15: 按可比价格计算 | E15: 《中国统计年鉴1997》http://www.stats.gov.cn/ndsj/information/nj97/K061A.END
B16: b农业总产值 | C16: 48.61 | D16: 按可比价格计算 | E16: 《中国统计年鉴1997》http://www.stats.gov.cn/ndsj/information/nj97/K061A.END
B17: c林业总产值 | C17: 1.38 | D17: 按可比价格计算 | E17: 《中国统计年鉴1997》http://www.stats.gov.cn/ndsj/information/nj97/K061A.END
B18: d畜牧业总产值 | C18: 17.98 | D18: 按可比价格计算 | E18: 《中国统计年鉴1997》http://www.stats.gov.cn/ndsj/information/nj97/K061A.END
B19: e渔业总产值 | C19: 1.19 | D19: 按可比价格计算 | E19: 《中国统计年鉴1997》http://www.stats.gov.cn/ndsj/information/nj97/K061A.END
A20: 4 | B20: 投资情况
B21: a全社会固定资产投资额 | C21: 72.1 | D21: 按可比价格计算 | E21: 《中国统计年鉴1997》http://www.stats.gov.cn/ndsj/information/nj97/E041A.END
B22: b基本建设投资额 | C22: 37.47 | D22: 按可比价格计算 | E22: 《中国统计年鉴1997》http://www.stats.gov.cn/ndsj/information/nj97/E081A.END
B23: c更新改造投资额 | C23: 17.37 | D23: 按可比价格计算 | E23: 《中国统计年鉴1997》http://www.stats.gov.cn/ndsj/information/nj97/E191A.END
B24: d房地产开发投资额 | C24: 5.45 | D24: 按可比价格计算 | E24: 《中国统计年鉴1997》http://www.stats.gov.cn/ndsj/information/nj97/E381A.END
A25: 5 | B25: 全年居民消费水平
B26: a居民消费价格总指数（%） | C26: 106.8 | D26: 上年价格=100 | E26: 《中国统计年鉴1997》http://www.stats.gov.cn/ndsj/information/nj97/H051A.END
B27: ①城镇居民消费价格指数（%） | C27: 106.6 | D27: 上年价格=100 | E27: 《中国统计年鉴1997》http://www.stats.gov.cn/ndsj/information/nj97/H051A.END
B28: ②农村居民消费价格指数（%） | C28: 106.9 | D28: 上年价格=100 | E28: 《中国统计年鉴1997》http://www.stats.gov.cn/ndsj/information/nj97/H051A.END
B29: b消费品零售总额 | C29: 65.7 | D29: 按可比价格计算 | E29: 《中国统计年鉴1997》http://www.stats.gov.cn/ndsj/information/nj97/O161A.END
B30: ①城市消费品零售额 | C30: 40.6 | D30: 按可比价格计算 | E30: 《中国统计年鉴1997》http://www.stats.gov.cn/ndsj/information/nj97/O161A.END
B31: ②农村消费品零售额 | C31: =C29-C30 -> 25.1 | D31: 按可比价格计算 | E31: 《中国统计年鉴1997》http://www.stats.gov.cn/ndsj/information/nj97/O161A.END
A32: ★6 | B32: 外贸情况(亿美元)
B33: a全年外贸总额(亿美元) | C33: 1.8979999999999999 | D33: 按可比价格计算 | E33: 《中国统计年鉴1997》http://www.stats.gov.cn/ndsj/information/nj97/P101A.END
B34: b出口总额(亿美元) | C34: 1.5472999999999999 | D34: 按可比价格计算 | E34: 《中国统计年鉴1997》http://www.stats.gov.cn/ndsj/information/nj97/P101A.END
B35: c 进口总额(亿美元) | C35: 0.35070000000000001 | D35: 按可比价格计算 | E35: 《中国统计年鉴1997》http://www.stats.gov.cn/ndsj/information/nj97/P101A.END
A36: ★7 | B36: 全年利用外资情况(亿美元)
B37: a 外资直接投资(亿美元) | C37: 0.63900000000000001 | D37: 按可比价格计算 | E37: 《中国统计年鉴1997》http://www.stats.gov.cn/ndsj/information/nj97/P161A.END
B38: b 合同外资(亿美元) | D38: 注意使用
B39: c 实际利用外资(亿美元) | C39: 2.1863999999999999 | D39: 按可比价格计算 | E39: 《中国统计年鉴1997》http://www.stats.gov.cn/ndsj/information/nj97/P161A.END
A40: 8 | B40: 全省(市)财政总收入
B41: a财政收入/GDP （%） | C41: 6.55 | E41: 《宁夏统计年鉴2003》147页
B42: b地方财政收入（实际） | C42: 12.6807 | D42: 按可比价格计算 | E42: 《中国统计年鉴1997》http://www.stats.gov.cn/ndsj/information/nj97/G171A.END
B43: d 一般预算收入
B44: e税收收入总额
B45: ①工商税收收入 | C45: 8.4078999999999997 | D45: 按可比价格计算 | E45: 《中国统计年鉴1997》http://www.stats.gov.cn/ndsj/information/nj97/G171A.END
B46: ②企业所得税税收收入 | C46: 1.1032999999999999 | D46: 按可比价格计算 | E46: 《中国统计年鉴1997》http://www.stats.gov.cn/ndsj/information/nj97/G171A.END
B47: ③个人所得税税收收入
B48: ④营业税税收收入
B49: ⑤资源税税收收入
B50: ⑥本省税收收入占本省财政收入比例（%）
B51: ⑦税收收入占国内生产总值比例（%）
A52: 9 | B52: a全省（市）财政支出总额（实际）
B53: b地方财政支出 | C53: 29.519600000000001 | D53: 按可比价格计算 | E53: 《中国统计年鉴1997》http://www.stats.gov.cn/ndsj/information/nj97/G181A.END
B54: c基本建设支出 | C54: 2.6208999999999998 | D54: 按可比价格计算 | E54: 《中国统计年鉴1997》http://www.stats.gov.cn/ndsj/information/nj97/G181A.END
B55: d农业支出 | C55: 0.4909 | D55: 按可比价格计算 | E55: 《中国统计年鉴1997》http://www.stats.gov.cn/ndsj/information/nj97/G184A.END
B56: e支农支出 | C56: 1.55 | D56: 按可比价格计算 | E56: 《中国统计年鉴1997》http://www.stats.gov.cn/ndsj/information/nj97/G182A.END
B57: f科技三项支出 | C57: 0.24410000000000001 | D57: 按可比价格计算 | E57: 《中国统计年鉴1997》http://www.stats.gov.cn/ndsj/information/nj97/G181A.END
B58: g社会保障支出 | C58: 0.42049999999999998 | D58: 抚恤和社会福利救济费 | E58: 《中国统计年鉴1997》http://www.stats.gov.cn/ndsj/information/nj97/G183A.END
B59: h科教文卫支出 | C59: =5.4238+0.2634 -> 5.6871999999999998 | D59: 按可比价格计算 | E59: 《中国统计年鉴1997》http://www.stats.gov.cn/ndsj/information/nj97/G183A.END
A60: 10 | B60: 本省财政收入与全国财政收入的比较
B61: a全国财政收入 | C61: 7407.99 | D61: 按可比价格计算 | E61: 《中国统计年鉴1997》http://www.stats.gov.cn/ndsj/information/nj97/G011A.END
B62: b省(市)财政收入 | C62: 29.519600000000001 | D62: 按可比价格计算 | E62: 《中国统计年鉴1997》http://www.stats.gov.cn/ndsj/information/nj97/G181A.END
B63: c本省财政收入占全国的比例 | C63: =C62/C61 -> 3.9848325929165672E-3 | D63: 计算而得
A64: 11 | B64: 人民生活水平指标
B65: a城市居民人均可支配收入 | C65: 3612.12 | D65: 按可比价格计算 | E65: 《中国统计年鉴1997》http://www.stats.gov.cn/ndsj/information/nj97/I121A.END
B66: b城市居民恩格尔系数(%) | C66: =1377.25/3038.95 -> 0.45319929580940788 | E66: 《中国统计年鉴1997》http://www.stats.gov.cn/ndsj/information/nj97/I131A.END
B67: c农村居民人均纯收入 | C67: 1397.8 | D67: 按可比价格计算 | E67: 《中国统计年鉴1997》http://www.stats.gov.cn/ndsj/information/nj97/I171A.END
B68: d农村居民恩格尔系数(%) | C68: =743.56/1235.67 -> 0.60174642096999997 | E68: 《中国统计年鉴1997》http://www.stats.gov.cn/ndsj/information/nj97/I201A.END
B69: e城乡收入水平差距 | C69: =C65-C67 -> 2214.32 | D69: e=a-c