D1: 宁夏回族自治区1997年
D2: 主要统计数据指标简表
D3: 本表主要根据《中国统计年鉴1998》整理
D4: 单位:亿元（人民币）(注：本表中第6、7项除外) | E4: 精确度：小数点后保留两位
A5: 项目号 | B5: 指标名称 | C5: 基本情况 | D5: 备注 | E5: 出处
A6: 1 | B6: 国内生产总值
B7: a GDP 总额 | C7: 210.92 | D7: 按可比价格计算 | E7: 中国统计年鉴1998http://www.stats.gov.cn/ndsj/information/nj98/ml98.htm
B8: b GDP增加额 | C8: =210.92-193.62 -> 17.3 | D8: 根据1997年与1996年GDP总额之差得来
B9: c 人均GDP(单位：元) | C9: 4025 | D9: 按当年价格计算 | E9: 《宁夏统计年鉴2003》38页
B10: d 第一产业增加值 | C10: 44.82 | D10: 按可比价格计算 | E10: 中国统计年鉴1998http://www.stats.gov.cn/ndsj/information/nj98/ml98.htm
B11: e 第二产业增加值 | C11: 87.65 | D11: 按可比价格计算 | E11: 中国统计年鉴1998http://www.stats.gov.cn/ndsj/information/nj98/ml98.htm
B12: f 第三产业增加值 | C12: 78.45 | D12: 按可比价格计算 | E12: 中国统计年鉴1998http://www.stats.gov.cn/ndsj/information/nj98/ml98.htm
A13: 2 | B13: 全年实现工业增加值 | C13: 73.18 | D13: 按可比价格计算 | E13: 中国统计年鉴1998http://www.stats.gov.cn/ndsj/information/nj98/ml98.htm
A14: 3 | B14: 农业情况
B15: a全年农业总产值 | C15: 72.817599999999999 | D15: 按可比价格计算 | E15: 中国统计年鉴1998http://www.stats.gov.cn/ndsj/information/nj98/ml98.htm
B16: b农业总产值 | C16: 49.48 | D16: 按可比价格计算 | E16: 中国统计年鉴1998http://www.stats.gov.cn/ndsj/information/nj98/ml98.htm
B17: c林业总产值 | C17: 1.34 | D17: 按可比价格计算 | E17: 中国统计年鉴1998http://www.stats.gov.cn/ndsj/information/nj98/ml98.htm
B18: d畜牧业总产值 | C18: 20.66 | D18: 按可比价格计算 | E18: 中国统计年鉴1998http://www.stats.gov.cn/ndsj/information/nj98/ml98.htm
B19: e渔业总产值 | C19: 1.34 | D19: 按可比价格计算 | E19: 中国统计年鉴1998http://www.stats.gov.cn/ndsj/information/nj98/ml98.htm
A20: 4 | B20: 投资情况
B21: a全社会固定资产投资额 | C21: 85.84 | D21: 按可比价格计算 | E21: 中国统计年鉴1998http://www.stats.gov.cn/ndsj/information/nj98/ml98.htm
B22: b基本建设投资额 | C22: 47.28 | D22: 按可比价格计算 | E22: 中国统计年鉴1998http://www.stats.gov.cn/ndsj/information/nj98/ml98.htm
B23: c更新改造投资额 | C23: 17.97 | D23: 按可比价格计算 | E23: 中国统计年鉴1998http://www.stats.gov.cn/ndsj/information/nj98/ml98.htm
B24: d房地产开发投资额 | C24: 6.05 | D24: 按可比价格计算 | E24: 中国统计年鉴1998http://www.stats.gov.cn/ndsj/information/nj98/ml98.htm
A25: 5 | B25: 全年居民消费水平
B26: a居民消费价格总指数（%） | C26: 103.8 | D26: 上年价格=100 | E26: 中国统计年鉴1998http://www.stats.gov.cn/ndsj/information/nj98/ml98.htm
B27: ①城镇居民消费价格指数（%） | C27: 103.9 | D27: 上年价格=100 | E27: 中国统计年鉴1998http://www.stats.gov.cn/ndsj/information/nj98/ml98.htm
B28: ②农村居民消费价格指数（%） | C28: 107.9 | D28: 上年价格=100 | E28: 中国统计年鉴1998http://www.stats.gov.cn/ndsj/information/nj98/ml98.htm
B29: b消费品零售总额 | C29: 71.2 | D29: 按可比价格计算 | E29: 中国统计年鉴1998http://www.stats.gov.cn/ndsj/information/nj98/ml98.htm
B30: ①城市消费品零售额 | C30: 45.5 | D30: 按可比价格计算 | E30: 中国统计年鉴1998http://www.stats.gov.cn/ndsj/information/nj98/ml98.htm
B31: ②农村消费品零售额 | C31: 25.7 | D31: 按可比价格计算 | E31: 中国统计年鉴1998http://www.stats.gov.cn/ndsj/information/nj98/ml98.htm
A32: ★6 | B32: 外贸情况(亿美元)
B33: a全年外贸总额(亿美元) | C33: 2.26 | D33: 按经营单位所在地分 | E33: http://www.gse.pku.edu.cn/yearbook/dataset/yearbook/yearbook00/2000/q10c.htm
B34: b出口总额(亿美元) | C34: 1.86 | D34: 按经营单位所在地分 | E34: http://www.gse.pku.edu.cn/yearbook/dataset/yearbook/yearbook00/2000/q10c.htm
B35: c 进口总额(亿美元) | C35: 0.4 | D35: 按经营单位所在地分 | E35: http://www.gse.pku.edu.cn/yearbook/dataset/yearbook/yearbook00/2000/q10c.htm
A36: ★7 | B36: 全年利用外资情况(亿美元)
B37: a 外资直接投资(亿美元) | C37: 6.7100000000000007E-2 | D37: 按可比价格计算 | E37: 中国统计年鉴1998http://www.stats.gov.cn/ndsj/information/nj98/ml98.htm
B38: b 合同外资(亿美元) | D38: 注意使用
B39: c 实际利用外资(亿美元) | C39: 0.43740000000000001 | D39: 按可比价格计算 | E39: 中国统计年鉴1998http://www.stats.gov.cn/ndsj/information/nj98/ml98.htm
A40: 8 | B40: 全省(市)财政总收入
B41: a财政收入/GDP （%） | C41: 6.67 | E41: 《宁夏统计年鉴2003》147页
B42: b地方财政收入（实际） | C42: 14.0738 | D42: 按可比价格计算 | E42: 中国统计年鉴1998http://www.stats.gov.cn/ndsj/information/nj98/ml98.htm
B43: d 一般预算收入
B44: e税收收入总额
B45: ①工商税收收入 | C45: 9.7673000000000005 | D45: 按可比价格计算 | E45: 中国统计年鉴1998http://www.stats.gov.cn/ndsj/information/nj98/ml98.htm
B46: ②企业所得税税收收入 | C46: 1.5071000000000001 | D46: 按可比价格计算 | E46: 中国统计年鉴1998http://www.stats.gov.cn/ndsj/information/nj98/ml98.htm
B47: ③个人所得税税收收入
B48: ④营业税税收收入
B49: ⑤资源税税收收入
B50: ⑥本省税收收入占本省财政收入比例（%）
B51: ⑦税收收入占国内生产总值比例（%）
A52: 9 | B52: a全省（市）财政支出总额（实际）
B53: b一般财政预算支出 | C53: 33.63 | D53: 按可比价格计算 | E53: 中国统计年鉴1998http://www.stats.gov.cn/ndsj/information/nj98/ml98.htm
B54: c基本建设支出 | C54: 2.7549999999999999 | D54: 按可比价格计算 | E54: 中国统计年鉴1998http://www.stats.gov.cn/ndsj/information/nj98/ml98.htm
B55: d农业支出 | C55: 0.55420000000000003 | D55: 按可比价格计算 | E55: 中国统计年鉴1998http://www.stats.gov.cn/ndsj/information/nj98/ml98.htm
B56: e支农支出 | C56: 1.8656999999999999 | D56: 按可比价格计算 | E56: 中国统计年鉴1998http://www.stats.gov.cn/ndsj/information/nj98/ml98.htm
B57: f科技三项支出 | C57: 0.34050000000000002 | D57: 按可比价格计算 | E57: 中国统计年鉴1998http://www.stats.gov.cn/ndsj/information/nj98/ml98.htm
B58: g社会保障支出 | C58: 0.501 | D58: 抚恤和社会福利救济费 | E58: 中国统计年鉴1998http://www.stats.gov.cn/ndsj/information/nj98/ml98.htm
B59: h科教文卫支出 | C59: =5.826+0.2823 -> 6.1082999999999998 | D59: 按可比价格计算 | E59: 中国统计年鉴1998http://www.stats.gov.cn/ndsj/information/nj98/ml98.htm
A60: 10 | B60: 本省财政收入与全国财政收入的比较
B61: a全国财政收入
B62: b省(市)财政收入
B63: c本省财政收入占全国的比例
A64: 11 | B64: 人民生活水平指标
B65: a城镇居民人均可支配收入 | C65: 3836.54 | D65: 按可比价格计算 | E65: 中国统计年鉴1998http://www.stats.gov.cn/ndsj/information/nj98/ml98.htm
B66: b城镇居民恩格尔系数(%) | C66: =1419.61/3271.32 -> 0.43395632344130192 | E66: 中国统计年鉴1998http://www.stats.gov.cn/ndsj/information/nj98/ml98.htm
B67: c农村居民人均纯收入 | C67: 1512.5 | D67: 按可比价格计算 | E67: 中国统计年鉴1998http://www.stats.gov.cn/ndsj/information/nj98/ml98.htm
B68: d农村居民恩格尔系数(%) | C68: =696.79/1249.57 -> 0.55762382259497267 | E68: 中国统计年鉴1998http://www.stats.gov.cn/ndsj/information/nj98/ml98.htm
B69: e城乡收入水平差距 | C69: =C65-C67 -> 2324.04 | D69: 计算而得