D1: 宁夏回族自治区1999年
D2: 主要统计数据指标简表
D3: 本表主要根据《2000年中国统计年鉴》整理
D4: 单位:亿元（人民币）(注：本表中第6、7项除外) | E4: 精确度：小数点后保留两位
A5: 项目号 | B5: 指标名称 | C5: 基本情况 | D5: 备注 | E5: 出处
A6: 1 | B6: 国内生产总值
B7: a GDP 总额 | C7: 241.49 | D7: 按可比价格计算 | E7: 2000年中国统计年鉴http://www.stats.gov.cn/ndsj/zgnj/2000/C08c.htm
B8: b GDP增加额 | C8: =C7-227.46 -> 14.03 | D8: 根据1999年与1998年GDP总额之差得来
B9: c 人均GDP(单位：元) | C9: 4473 | D9: 按可比价格计算 | E9: 2000年中国统计年鉴http://www.gse.pku.edu.cn/yearbook/dataset/yearbook/yearbook00/2000/c09c.htm
B10: d 第一产业增加值 | C10: 48.01 | D10: 按可比价格计算 | E10: 2000年中国统计年鉴http://www.gse.pku.edu.cn/yearbook/dataset/yearbook/yearbook00/2000/c09c.htm
B11: e 第二产业增加值 | C11: 102.68 | D11: 按可比价格计算 | E11: 2000年中国统计年鉴http://www.gse.pku.edu.cn/yearbook/dataset/yearbook/yearbook00/2000/c09c.htm
B12: f 第三产业增加值 | C12: 90.8 | D12: 按可比价格计算 | E12: 2000年中国统计年鉴http://www.gse.pku.edu.cn/yearbook/dataset/yearbook/yearbook00/2000/c09c.htm
A13: 2 | B13: 全年实现工业增加值 | C13: 80.7 | D13: 按可比价格计算 | E13: 2000年中国统计年鉴http://www.gse.pku.edu.cn/yearbook/dataset/yearbook/yearbook00/2000/c09c.htm
A14: 3 | B14: 农业情况
B15: a全年农业总产值 | C15: 78 | D15: 按可比价格计算 | E15: 2000年中国统计年鉴http://www.gse.pku.edu.cn/yearbook/dataset/yearbook/yearbook00/2000/l06c.htm
B16: b农业总产值 | C16: 51.3 | D16: 按可比价格计算 | E16: 2000年中国统计年鉴http://www.gse.pku.edu.cn/yearbook/dataset/yearbook/yearbook00/2000/l06c.htm
B17: c林业总产值 | C17: 2.6 | D17: 按可比价格计算 | E17: 2000年中国统计年鉴http://www.gse.pku.edu.cn/yearbook/dataset/yearbook/yearbook00/2000/l06c.htm
B18: d畜牧业总产值 | C18: 22.6 | D18: 按可比价格计算 | E18: 2000年中国统计年鉴http://www.gse.pku.edu.cn/yearbook/dataset/yearbook/yearbook00/2000/l06c.htm
B19: e渔业总产值 | C19: 1.5 | D19: 按可比价格计算 | E19: 2000年中国统计年鉴http://www.gse.pku.edu.cn/yearbook/dataset/yearbook/yearbook00/2000/l06c.htm
A20: 4 | B20: 投资情况
B21: a全社会固定资产投资额 | C21: 128.1 | D21: 按可比价格计算 | E21: 2000年中国统计年鉴http://www.gse.pku.edu.cn/yearbook/dataset/yearbook/yearbook00/2000/f04c.htm
B22: b基本建设投资额 | C22: 69.09 | D22: 按可比价格计算 | E22: 2000年中国统计年鉴http://www.gse.pku.edu.cn/yearbook/dataset/yearbook/yearbook00/2000/f08c.htm
B23: c更新改造投资额 | C23: 18.44 | D23: 按可比价格计算 | E23: 2000年中国统计年鉴http://www.gse.pku.edu.cn/yearbook/dataset/yearbook/yearbook00/2000/f19c.htm
B24: d房地产开发投资额 | C24: 13.02 | D24: 按可比价格计算 | E24: 2000年中国统计年鉴http://www.gse.pku.edu.cn/yearbook/dataset/yearbook/yearbook00/2000/f40c.htm
A25: 5 | B25: 全年居民消费水平
B26: a居民消费价格总指数（%） | C26: 98.7 | D26: 上年价格=100 | E26: 2000年中国统计年鉴http://www.gse.pku.edu.cn/yearbook/dataset/yearbook/yearbook00/2000/i05c.htm
B27: ①城镇居民消费价格指数（%） | C27: 99.1 | D27: 上年价格=100 | E27: 2000年中国统计年鉴http://www.gse.pku.edu.cn/yearbook/dataset/yearbook/yearbook00/2000/i05c.htm
B28: ②农村居民消费价格指数（%） | C28: 98.1 | D28: 上年价格=100 | E28: 2000年中国统计年鉴http://www.gse.pku.edu.cn/yearbook/dataset/yearbook/yearbook00/2000/i05c.htm
B29: b消费品零售总额 | C29: 82.7 | D29: 按可比价格计算 | E29: 国家统计局网http://www.stats.gov.cn/ndsj/zgnj/2000/P03c.htm
B30: ①城市消费品零售额 | C30: 53.6 | D30: 按可比价格计算 | E30: 国家统计局网http://www.stats.gov.cn/ndsj/zgnj/2000/P03c.htm
B31: ②农村消费品零售额 | C31: =C29-C30 -> 29.1 | D31: 按可比价格计算 | E31: 国家统计局网http://www.stats.gov.cn/ndsj/zgnj/2000/P03c.htm
A32: ★6 | B32: 外贸情况(亿美元)
B33: a全年外贸总额(亿美元) | C33: 3.18 | D33: 按经营单位所在地分 | E33: 2000年中国统计年鉴http://www.gse.pku.edu.cn/yearbook/dataset/yearbook/yearbook00/2000/q10c.htm
B34: b出口总额(亿美元) | C34: 2.48 | D34: 按经营单位所在地分 | E34: 2000年中国统计年鉴http://www.gse.pku.edu.cn/yearbook/dataset/yearbook/yearbook00/2000/q10c.htm
B35: c 进口总额(亿美元) | C35: 0.7 | D35: 按经营单位所在地分 | E35: 2000年中国统计年鉴http://www.gse.pku.edu.cn/yearbook/dataset/yearbook/yearbook00/2000/q10c.htm
A36: ★7 | B36: 全年利用外资情况(亿美元)
B37: a 外资直接投资(亿美元) | C37: 0.19 | D37: 按可比价格计算 | E37: 2000年中国统计年鉴http://www.gse.pku.edu.cn/yearbook/dataset/yearbook/yearbook00/2000/q16c.htm
B38: b 合同外资(亿美元) | D38: 注意使用
B39: c 实际利用外资(亿美元) | C39: 0.18559999999999999 | D39: 按可比价格计算 | E39: 2000年中国统计年鉴http://www.gse.pku.edu.cn/yearbook/dataset/yearbook/yearbook00/2000/q16c.htm
A40: 8 | B40: 全省(市)财政总收入
B41: a财政收入/GDP （%） | C41: 7.8 | E41: 《宁夏统计年鉴2003》147页
B42: b地方财政收入（实际） | C42: 18.84 | D42: 按可比价格计算 | E42: 2000年中国统计年鉴http://www.gse.pku.edu.cn/yearbook/dataset/yearbook/yearbook00/2000/h19c.htm
B43: d 一般预算收入 | C43: 17.39 | D43: 按可比价格计算 | E43: 1999年各省、自治区、直辖市财政收入完成预算情况http://www.fec.com.cn/admin/fecdata2/1999/c0006343.htm
B44: e税收收入总额 | C44: 15.27 | D44: 含其他税收 | E44: 2000年中国统计年鉴http://www.gse.pku.edu.cn/yearbook/dataset/yearbook/yearbook00/2000/h19c.htm
B45: ①增值税税收收入 | C45: 3.46 | D45: 按可比价格计算 | E45: 2000年中国统计年鉴http://www.gse.pku.edu.cn/yearbook/dataset/yearbook/yearbook00/2000/h19c.htm
B46: ②企业所得税税收收入 | C46: 1.88 | D46: 按可比价格计算 | E46: 2000年中国统计年鉴http://www.gse.pku.edu.cn/yearbook/dataset/yearbook/yearbook00/2000/h19c.htm
B47: ③个人所得税税收收入 | C47: 0.92 | D47: 按可比价格计算 | E47: 2000年中国统计年鉴http://www.gse.pku.edu.cn/yearbook/dataset/yearbook/yearbook00/2000/h19c.htm
B48: ④营业税税收收入 | C48: 5.52 | D48: 按可比价格计算 | E48: 2000年中国统计年鉴http://www.gse.pku.edu.cn/yearbook/dataset/yearbook/yearbook00/2000/h19c.htm
B49: ⑤资源税税收收入 | C49: 0.06 | D49: 按可比价格计算 | E49: 2000年中国统计年鉴http://www.gse.pku.edu.cn/yearbook/dataset/yearbook/yearbook00/2000/h19c.htm
B50: ⑥本省税收收入占本省财政收入比例（%） | C50: =C44/C42 -> 0.81050955414012738 | D50: e/a计算而得
B51: ⑦税收收入占国内生产总值比例（%） | C51: =C44/C7 -> 6.3232431984761264E-2 | D51: 计算而得
A52: 9 | B52: a全省（市）财政支出总额（实际） | C52: 49.534599999999998 | D52: 按可比价格计算 | E52: 2000年中国统计年鉴http://www.gse.pku.edu.cn/yearbook/dataset/yearbook/yearbook00/2000/h20c.htm
B53: b一般财政预算支出
B54: c基本建设支出 | C54: 6.06 | D54: 按可比价格计算 | E54: 2000年中国统计年鉴http://www.gse.pku.edu.cn/yearbook/dataset/yearbook/yearbook00/2000/h20c.htm
B55: d农业支出 | C55: 0.83 | D55: 按可比价格计算 | E55: 2000年中国统计年鉴http://www.gse.pku.edu.cn/yearbook/dataset/yearbook/yearbook00/2000/h20c.htm
B56: e支农支出 | C56: 1.81 | D56: 按可比价格计算 | E56: 2000年中国统计年鉴http://www.gse.pku.edu.cn/yearbook/dataset/yearbook/yearbook00/2000/h20c.htm
B57: f科技三项支出 | C57: 0.77 | D57: 按可比价格计算 | E57: 2000年中国统计年鉴http://www.gse.pku.edu.cn/yearbook/dataset/yearbook/yearbook00/2000/h20c.htm
B58: g社会保障支出 | C58: 4.59 | D58: 按可比价格计算 | E58: 2000年中国统计年鉴http://www.gse.pku.edu.cn/yearbook/dataset/yearbook/yearbook00/2000/h20c.htm
B59: h科教文卫支出 | C59: 10.95 | D59: 按可比价格计算 | E59: 2000年中国统计年鉴http://www.gse.pku.edu.cn/yearbook/dataset/yearbook/yearbook00/2000/h20c.htm
A60: 10 | B60: 本省财政收入与全国财政收入的比较
B61: a全国财政收入 | C61: 9875.95 | D61: 按可比价格计算 | E61: 国家统计局网http://www.stats.gov.cn/ndsj/zgnj/2000/H01c.htm
B62: b省(市)财政收入 | C62: 18.84 | D62: 按可比价格计算 | E62: 2000年中国统计年鉴http://www.gse.pku.edu.cn/yearbook/dataset/yearbook/yearbook00/2000/h19c.htm
B63: c本省财政收入占全国的比例 | C63: =C62/C61 -> 1.9076645791037822E-3 | D63: 计算而得
A64: 11 | B64: 人民生活水平指标
B65: a城市居民人均可支配收入 | C65: 4472.91 | D65: 按可比价格计算 | E65: 2000年中国统计年鉴http://www.gse.pku.edu.cn/yearbook/dataset/yearbook/yearbook00/2000/j11c.htm
B66: b城市居民恩格尔系数(%) | C66: 38.77 | D66: 按可比价格计算 | E66: 2000年中国统计年鉴http://www.gse.pku.edu.cn/yearbook/dataset/yearbook/yearbook00/2000/j12c.htm
B67: c农村居民人均纯收入 | C67: 1754.15 | D67: 按可比价格计算 | E67: 2000年中国统计年鉴http://www.gse.pku.edu.cn/yearbook/dataset/yearbook/yearbook00/2000/j16c.htm
B68: d农村居民恩格尔系数(%) | C68: 52.85 | D68: 按可比价格计算 | E68: 2000年中国统计年鉴http://www.gse.pku.edu.cn/yearbook/dataset/yearbook/yearbook00/2000/j19c.htm
B69: e城乡收入水平差距 | C69: =C65-C67 -> 2718.76 | D69: e=a-c