D1: 宁夏回族自治区2000年
D2: 主要统计数据指标简表
D3: 本表主要根据《宁夏回族自治区统计具关于2000年国民经济和社会发展的统计公报》整理
D4: 单位:亿元（人民币）(注：本表中第6、7项除外) | E4: 精确度：小数点后保留两位
A5: 项目号 | B5: 指标名称 | C5: 基本情况 | D5: 备注 | E5: 出处
A6: 1 | B6: 国内生产总值
B7: a GDP 总额 | C7: 265 | D7: 按可比价格计算 | E7: 宁夏回族自治区统计具关于2000年国民经济和社会发展的统计公报http://www.stats.gov.cn/was40/reldetail.jsp?docid=16167
B8: b GDP增加额 | C8: =C7-242 -> 23 | D8: 根据2000年GDP与1999年GDP之差得出
B9: c 人均GDP(单位：元) | C9: 4839 | D9: 按可比价格计算 | E9: 《宁夏统计年鉴2003》28页中国统计出版社
B10: d 第一产业增加值 | C10: 46 | D10: 按可比价格计算 | E10: 宁夏回族自治区统计具关于2000年国民经济和社会发展的统计公报http://www.stats.gov.cn/was40/reldetail.jsp?docid=16167
B11: e 第二产业增加值 | C11: 120 | D11: 按可比价格计算 | E11: 宁夏回族自治区统计具关于2000年国民经济和社会发展的统计公报http://www.stats.gov.cn/was40/reldetail.jsp?docid=16167
B12: f 第三产业增加值 | C12: 99 | D12: 按可比价格计算 | E12: 宁夏回族自治区统计具关于2000年国民经济和社会发展的统计公报http://www.stats.gov.cn/was40/reldetail.jsp?docid=16167
A13: 2 | B13: 全年实现工业增加值 | C13: 93 | D13: 工业总产值293.9亿元，按可比价格计算，比上年增长15.9% | E13: 宁夏回族自治区统计具关于2000年国民经济和社会发展的统计公报http://www.stats.gov.cn/was40/reldetail.jsp?docid=16167
A14: 3 | B14: 农业情况
B15: a全年农业总产值 | C15: 77.75 | D15: 按可比价格计算 | E15: 宁夏回族自治区统计具关于2000年国民经济和社会发展的统计公报http://www.stats.gov.cn/was40/reldetail.jsp?docid=16167
B16: b农业总产值 | C16: 46.99 | D16: 按可比价格计算 | E16: 《宁夏统计年鉴2003》中国统计出版社
B17: c林业总产值 | C17: 3.11 | D17: 按可比价格计算 | E17: 《宁夏统计年鉴2003》中国统计出版社
B18: d畜牧业总产值 | C18: 25.75 | D18: 按可比价格计算 | E18: 《宁夏统计年鉴2003》中国统计出版社
B19: e渔业总产值 | C19: 1.9 | D19: 按可比价格计算 | E19: 《宁夏统计年鉴2003》中国统计出版社
A20: 4 | B20: 投资情况
B21: a全社会固定资产投资额 | C21: 160.82 | D21: 按投资管理渠道分 | E21: 宁夏回族自治区统计具关于2000年国民经济和社会发展的统计公报http://www.stats.gov.cn/was40/reldetail.jsp?docid=16167
B22: b基本建设投资额 | C22: 88.87 | D22: 按投资管理渠道分 | E22: 宁夏回族自治区统计具关于2000年国民经济和社会发展的统计公报http://www.stats.gov.cn/was40/reldetail.jsp?docid=16167
B23: c更新改造投资额 | C23: 23.36 | D23: 按投资管理渠道分 | E23: 宁夏回族自治区统计具关于2000年国民经济和社会发展的统计公报http://www.stats.gov.cn/was40/reldetail.jsp?docid=16167
B24: d房地产开发投资额 | C24: 15.57 | D24: 按投资管理渠道分 | E24: 宁夏回族自治区统计具关于2000年国民经济和社会发展的统计公报http://www.stats.gov.cn/was40/reldetail.jsp?docid=16167
A25: 5 | B25: 全年居民消费水平
B26: a居民消费价格总指数（%） | C26: 99.6 | D26: 以上年价格为100 | E26: 《宁夏统计年鉴2003》163页，中国统计出版社
B27: ①城镇居民消费价格指数（%） | C27: 99.7 | D27: 以上年价格为100 | E27: 《宁夏统计年鉴2003》163页，中国统计出版社
B28: ②农村居民消费价格指数（%） | C28: 99.5 | D28: 以上年价格为100 | E28: 《宁夏统计年鉴2003》163页，中国统计出版社
B29: b消费品零售总额 | C29: 90.2 | D29: 不含房地产 | E29: 宁夏回族自治区统计具关于2000年国民经济和社会发展的统计公报http://www.stats.gov.cn/was40/reldetail.jsp?docid=16167
B30: ①城市消费品零售额 | C30: 58.9 | D30: 按可比价格计算 | E30: 宁夏回族自治区统计具关于2000年国民经济和社会发展的统计公报http://www.stats.gov.cn/was40/reldetail.jsp?docid=16167
B31: ②农村消费品零售额 | C31: 31.3 | D31: 按可比价格计算 | E31: 宁夏回族自治区统计具关于2000年国民经济和社会发展的统计公报http://www.stats.gov.cn/was40/reldetail.jsp?docid=16167
A32: ★6 | B32: 外贸情况(亿美元)
B33: a全年外贸总额(亿美元) | C33: 4.43 | D33: 按可比价格计算 | E33: 宁夏回族自治区统计具关于2000年国民经济和社会发展的统计公报http://www.stats.gov.cn/was40/reldetail.jsp?docid=16167
B34: b出口总额(亿美元) | C34: 3.27 | D34: 注意使用 | E34: 宁夏回族自治区统计具关于2000年国民经济和社会发展的统计公报http://www.stats.gov.cn/was40/reldetail.jsp?docid=16167
B35: c 进口总额(亿美元) | C35: 1.16 | D35: 按可比价格计算 | E35: 宁夏回族自治区统计具关于2000年国民经济和社会发展的统计公报http://www.stats.gov.cn/was40/reldetail.jsp?docid=16167
A36: ★7 | B36: 全年利用外资情况(亿美元)
B37: a 外资直接投资(亿美元) | C37: 0.99270000000000003 | D37: 《中国统计年鉴2001》外商直接投资为0.1911亿美元 | E37: 《宁夏统计年鉴2003》中国统计出版社
B38: b 合同外资(亿美元) | D38: 注意使用，待查
B39: c 实际利用外资(亿美元) | C39: 0.90910000000000002 | D39: 按可比价格计算 | E39: 宁夏回族自治区统计具关于2000年国民经济和社会发展的统计公报http://www.stats.gov.cn/was40/reldetail.jsp?docid=16167
A40: 8 | B40: 全省(市)财政总收入 | C40: 33.17 | D40: 财政总收入为地方本级收入加上消费税和增值税75%的部分 | E40: 各地区财政收入占国内生产总值的比例http://www.mof.gov.cn/news/uploadfile/yusuan00adsfas7.xls
B41: a财政收入/GDP （%） | C41: =C40/C7*100 -> 12.516981132075472 | D41: 由全省(市)财政总收入与全省GDP 总值之比得出
B42: b地方财政收入（实际） | C42: 20.8 | D42: 地方本级收入 | E42: 各地区财政收入占国内生产总值的比例http://www.mof.gov.cn/news/uploadfile/yusuan00adsfas7.xls
B43: d 一般预算收入 | D43: 待查
B44: e税收收入总额 | C44: 17.79 | D44: 根据《中国统计年鉴2001》计算得出得出
B45: ①增值税税收收入 | C45: 3.5449000000000002 | E45: 《中国统计年鉴2001》
B46: ②企业所得税税收收入 | C46: 2.6147 | D46: 按可比价格计算 | E46: 《中国统计年鉴2001》
B47: ③个人所得税税收收入 | C47: 1.2531000000000001 | D47: 按可比价格计算 | E47: 《中国统计年鉴2001》
B48: ④营业税税收收入 | C48: 6.5682 | D48: 按可比价格计算 | E48: 《中国统计年鉴2001》
B49: ⑤资源税税收收入 | C49: 6.0499999999999998E-2 | D49: 按可比价格计算 | E49: 《中国统计年鉴2001》
B50: ⑥本省税收收入占本省财政收入比例（%） | C50: =C44/C42 -> 0.8552884615384615
B51: ⑦税收收入占国内生产总值比例（%） | C51: =C42/C7 -> 7.8490566037735854E-2
A52: 9 | B52: a全省（市）财政支出总额（实际） | C52: 60.84 | D52: 按可比价格计算 | E52: 《中国统计年鉴2001》http://202.112.92.69/resource/data/yearbook/yearbook01/yearbook/h0820c.htm
B53: b一般财政预算支出 | D53: 待查
B54: c基本建设支出 | C54: 9.3938000000000006 | D54: 财政性 | E54: 《中国统计年鉴2001》http://202.112.92.69/resource/data/yearbook/yearbook01/yearbook/h0820c.htm
B55: d农业支出 | C55: 0.85580000000000001 | D55: 财政性 | E55: 《中国统计年鉴2001》http://202.112.92.69/resource/data/yearbook/yearbook01/yearbook/h0820c.htm
B56: e支农支出 | C56: 1.49 | D56: 财政性 | E56: 《中国统计年鉴2001》http://202.112.92.69/resource/data/yearbook/yearbook01/yearbook/h0820c.htm
B57: f科技三项支出 | C57: 0.64949999999999997 | D57: 财政性 | E57: 《中国统计年鉴2001》http://202.112.92.69/resource/data/yearbook/yearbook01/yearbook/h0820c.htm
B58: g社会保障支出 | C58: 8.78 | D58: 财政性，包括抚恤和社会福利救济费0.88亿元、行政事业单位离退休经费2.51亿元和社会保障补助支出5.38亿元 | E58: 《中国统计年鉴2001》http://202.112.92.69/resource/data/yearbook/yearbook01/yearbook/h0820c.htm
B59: h科教文卫支出 | C59: 12.7 | D59: 财政性，包括文体广播事业、科学事业、教育事业和卫生事业 | E59: 《中国统计年鉴2001》http://202.112.92.69/resource/data/yearbook/yearbook01/yearbook/h0820c.htm
A60: 10 | B60: 本省财政收入与全国财政收入的比较
B61: a全国财政收入 | C61: 13395.23 | D61: 按可比价格计算
B62: b省(市)财政收入 | C62: 20.8 | D62: 按可比价格计算
B63: c本省财政收入占全国的比例 | C63: =C42/C61 -> 1.5527915534111771E-3
A64: 11 | B64: 人民生活水平指标
B65: a城市居民人均可支配收入（单位：元） | C65: 4912.4 | D65: 按可比价格计算 | E65: 《宁夏统计年鉴2003》32页中国统计出版社
B66: b城市居民恩格尔系数(%) | C66: =15/42 -> 0.35714285714285715 | D66: 根据《中国统计年鉴2001》计算得出得出 | E66: http://202.112.92.69/resource/data/yearbook/yearbook01/yearbook/j1013c.htm
B67: c农村居民人均纯收入（单位：元） | C67: 1724.3 | D67: 按可比价格计算 | E67: 《宁夏统计年鉴2003》32页中国统计出版社
B68: d农村居民恩格尔系数(%) | C68: 0.48780000000000001 | D68: 根据《中国统计年鉴2001》计算得出得出 | E68: http://202.112.92.69/resource/data/yearbook/yearbook01/yearbook/j1021c.htm
B69: e城乡收入水平差距（单位：元） | C69: =C65-C67 -> 3188.1 | D69: 根据城市居民人均可支配收入与农村居民人均纯收入之差得出