D1: 宁夏回族自治区2001年
D2: 主要统计数据指标简表
D3: 本表主要根据《宁夏统计年鉴2003》整理
D4: 单位:亿元（人民币）(注：本表中第6、7项除外) | E4: 精确度：小数点后保留两位
A5: 项目号 | B5: 指标名称 | C5: 基本情况 | D5: 备注 | E5: 出处
A6: 1 | B6: 国内生产总值
B7: a GDP 总额 | C7: 298.3 | D7: 按可比价格计算 | E7: 2001年宁夏回族自治区国民经济和社会发展统计公报http://www.stats.gov.cn/was40/reldetail.jsp?docid=15674
B8: b GDP增加额 | C8: 33.3 | D8: 按可比价格计算
B9: c 人均GDP(单位：元) | C9: 5340 | D9: 按可比价格计算 | E9: 《宁夏统计年鉴2003》24页
B10: d 第一产业增加值 | C10: 49.5 | D10: 按可比价格计算 | E10: 2001年宁夏回族自治区国民经济和社会发展统计公报http://www.stats.gov.cn/was40/reldetail.jsp?docid=15674
B11: e 第二产业增加值 | C11: 135 | D11: 按可比价格计算 | E11: 2001年宁夏回族自治区国民经济和社会发展统计公报http://www.stats.gov.cn/was40/reldetail.jsp?docid=15674
B12: f 第三产业增加值 | C12: 113.8 | D12: 按可比价格计算 | E12: 2001年宁夏回族自治区国民经济和社会发展统计公报http://www.stats.gov.cn/was40/reldetail.jsp?docid=15674
A13: 2 | B13: 全年实现工业增加值 | C13: 102.23 | D13: 按可比价格计算 | E13: 2001年宁夏回族自治区国民经济和社会发展统计公报http://www.stats.gov.cn/was40/reldetail.jsp?docid=15674
A14: 3 | B14: 农业情况
B15: a全年农业总产值 | C15: 85.3 | D15: 按当年价格计算 | E15: 《中国统计年鉴2002》http://202.112.92.69/resource/data/yearbook/yearbook02/indexC.htm
B16: b农业总产值 | C16: 49.4 | D16: 按当年价格计算 | E16: 《中国统计年鉴2002》http://202.112.92.69/resource/data/yearbook/yearbook02/indexC.htm
B17: c林业总产值 | C17: 3.5 | D17: 按当年价格计算 | E17: 《中国统计年鉴2002》http://202.112.92.69/resource/data/yearbook/yearbook02/indexC.htm
B18: d畜牧业总产值 | C18: 30.3 | D18: 按当年价格计算 | E18: 《中国统计年鉴2002》http://202.112.92.69/resource/data/yearbook/yearbook02/indexC.htm
B19: e渔业总产值 | C19: 2.1 | D19: 按当年价格计算 | E19: 《中国统计年鉴2002》http://202.112.92.69/resource/data/yearbook/yearbook02/indexC.htm
A20: 4 | B20: 投资情况
B21: a全社会固定资产投资额 | C21: 195.81 | D21: 含其他投资 | E21: 《宁夏统计年鉴2003》111页
B22: b基本建设投资额 | C22: 105.31 | D22: 按可比价格计算 | E22: 《宁夏统计年鉴2003》111页
B23: c更新改造投资额 | C23: 26.08 | D23: 按可比价格计算 | E23: 《宁夏统计年鉴2003》111页
B24: d房地产开发投资额 | C24: 23.18 | D24: 按可比价格计算 | E24: 《宁夏统计年鉴2003》119页
A25: 5 | B25: 全年居民消费水平
B26: a居民消费价格总指数（%） | C26: 101.6 | D26: 上年价格=100 | E26: 《宁夏统计年鉴2003》163页
B27: ①城镇居民消费价格指数（%） | C27: 101.3 | D27: 上年价格=100 | E27: 《宁夏统计年鉴2003》163页
B28: ②农村居民消费价格指数（%） | C28: 102.2 | D28: 上年价格=100 | E28: 《宁夏统计年鉴2003》163页
B29: b消费品零售总额 | C29: 98.86 | D29: 按可比价格计算 | E29: 《宁夏统计年鉴2003》349页
B30: ①城市消费品零售额 | C30: =64.78+18.11 -> 82.89 | D30: 按可比价格计算 | E30: 《宁夏统计年鉴2003》349页
B31: ②农村消费品零售额 | C31: 15.97 | D31: 按可比价格计算 | E31: 《宁夏统计年鉴2003》349页
A32: ★6 | B32: 外贸情况(亿美元)
B33: a全年外贸总额(亿美元) | C33: 5.3280000000000003 | D33: 按可比价格计算 | E33: 《中国统计年鉴2002》http://202.112.92.69/resource/data/yearbook/yearbook02/indexC.htm
B34: b出口总额(亿美元) | C34: 3.52 | D34: 按可比价格计算 | E34: 《中国统计年鉴2002》http://202.112.92.69/resource/data/yearbook/yearbook02/indexC.htm
B35: c 进口总额(亿美元) | C35: 1.81 | D35: 按可比价格计算 | E35: 《中国统计年鉴2002》http://202.112.92.69/resource/data/yearbook/yearbook02/indexC.htm
A36: ★7 | B36: 全年利用外资情况(亿美元)
B37: a 外资直接投资(亿美元) | C37: 0.16800000000000001 | D37: 按可比价格计算 | E37: 2001年宁夏回族自治区国民经济和社会发展统计公报http://www.stats.gov.cn/was40/reldetail.jsp?docid=15674
B38: b 合同外资(亿美元) | D38: 注意使用，待查
B39: c 实际利用外资(亿美元) | C39: 0.50860000000000005 | D39: 按可比价格计算 | E39: 2001年宁夏回族自治区国民经济和社会发展统计公报http://www.stats.gov.cn/was40/reldetail.jsp?docid=15674
A40: 8 | B40: 全省(市)财政总收入 | C40: 40.69 | D40: 计算而得
B41: a财政收入/GDP （%） | C41: 13.64 | E41: 各地区财政收入占国内生产总值的比例http://www.mof.gov.cn/news/uploadfile/yusuan00adsfas7.xls
B42: b地方财政收入（实际） | C42: 27.57 | D42: 按可比价格计算 | E42: 《中国统计年鉴2002》http://202.112.92.69/resource/data/yearbook/yearbook02/indexC.htm
B43: d 一般预算收入 | C43: 27.5 | D43: 按可比价格计算 | E43: 2001年宁夏回族自治区国民经济和社会发展统计公报http://www.stats.gov.cn/was40/reldetail.jsp?docid=15674
B44: e税收收入总额 | C44: 23.73 | D44: 按可比价格计算 | E44: 《中国统计年鉴2002》http://202.112.92.69/resource/data/yearbook/yearbook02/indexC.htm
B45: ①增值税税收收入 | C45: 3.8530000000000002 | D45: 按可比价格计算 | E45: 《中国统计年鉴2002》http://202.112.92.69/resource/data/yearbook/yearbook02/indexC.htm
B46: ②企业所得税税收收入 | C46: 6.01 | D46: 按可比价格计算 | E46: 《中国统计年鉴2002》http://202.112.92.69/resource/data/yearbook/yearbook02/indexC.htm
B47: ③个人所得税税收收入 | C47: 1.98 | D47: 按可比价格计算 | E47: 《中国统计年鉴2002》http://202.112.92.69/resource/data/yearbook/yearbook02/indexC.htm
B48: ④营业税税收收入 | C48: 7.52 | D48: 按可比价格计算 | E48: 《中国统计年鉴2002》http://202.112.92.69/resource/data/yearbook/yearbook02/indexC.htm
B49: ⑤资源税税收收入 | C49: 0.07 | D49: 按可比价格计算 | E49: 《中国统计年鉴2002》http://202.112.92.69/resource/data/yearbook/yearbook02/indexC.htm
B50: ⑥本省税收收入占本省财政收入比例（%） | C50: =C44/C42 -> 0.86071817192600653 | D50: 计算而得
B51: ⑦税收收入占国内生产总值比例（%） | C51: =C44/C7 -> 7.9550787797519271E-2 | D51: 计算而得
A52: 9 | B52: a全省（市）财政支出总额（实际） | C52: 93.58 | D52: 按可比价格计算 | E52: 《中国统计年鉴2002》http://202.112.92.69/resource/data/yearbook/yearbook02/indexC.htm
B53: b一般财政预算支出 | C53: 93.3 | D53: 按可比价格计算 | E53: 2001年宁夏回族自治区国民经济和社会发展统计公报http://www.stats.gov.cn/was40/reldetail.jsp?docid=15674
B54: c基本建设支出 | C54: 24.3 | D54: 按可比价格计算 | E54: 《中国统计年鉴2002》http://202.112.92.69/resource/data/yearbook/yearbook02/indexC.htm
B55: d农业支出 | C55: 1.27 | D55: 按可比价格计算 | E55: 《中国统计年鉴2002》http://202.112.92.69/resource/data/yearbook/yearbook02/indexC.htm
B56: e支农支出 | C56: 14.18 | D56: 按可比价格计算 | E56: 《中国统计年鉴2002》http://202.112.92.69/resource/data/yearbook/yearbook02/indexC.htm
B57: f科技三项支出 | C57: 0.71 | D57: 按可比价格计算 | E57: 《中国统计年鉴2002》http://202.112.92.69/resource/data/yearbook/yearbook02/indexC.htm
B58: g社会保障支出 | C58: 12.16 | D58: 财政性，包括抚恤和社会福利救济费、行政事业单位离退休经费和社会保障补助支出 | E58: 《中国统计年鉴2002》http://202.112.92.69/resource/data/yearbook/yearbook02/indexC.htm
B59: h科教文卫支出 | C59: 17.63 | D59: 财政性，包括文体广播事业、科学事业、教育事业和卫生事业 | E59: 《中国统计年鉴2002》http://202.112.92.69/resource/data/yearbook/yearbook02/indexC.htm
A60: 10 | B60: 本省财政收入与全国财政收入的比较
B61: a全国财政收入 | C61: 16386.04 | D61: 不包括国内外债务收入 | E61: 《中国统计年鉴2002》http://202.112.92.69/resource/data/yearbook/yearbook02/indexC.htm
B62: b省(市)财政收入 | C62: 27.57 | D62: 按可比价格计算
B63: c本省财政收入占全国的比例 | C63: =C62/C61 -> 1.6825297631398433E-3 | D63: 计算而得
A64: 11 | B64: 人民生活水平指标
B65: a城市居民人均可支配收入 | C65: 5544 | D65: 按可比价格计算 | E65: 2001年宁夏回族自治区国民经济和社会发展统计公报http://www.stats.gov.cn/was40/reldetail.jsp?docid=15674
B66: b城市居民恩格尔系数(%) | C66: =1562.58/4595.4 -> 0.34003133568350963 | D66: 根据《中国统计年鉴2002》计算得出
B67: c农村居民人均纯收入 | C67: 1823 | D67: 按可比价格计算 | E67: 2001年宁夏回族自治区国民经济和社会发展统计公报http://www.stats.gov.cn/was40/reldetail.jsp?docid=15674
B68: d农村居民恩格尔系数(%) | C68: =651.8/1388.79 -> 0.4693294162544373 | D68: 根据《中国统计年鉴2002》计算得出
B69: e城乡收入水平差距 | C69: =C65-C67 -> 3721 | D69: 根据a-c得出