D1: 宁夏回族自治区2002年
D2: 主要统计数据指标简表
D3: 本表主要根据《宁夏回族自治区统计局关于2002年国民经济和社会发展的统计公报》整理
D4: 单位:亿元（人民币）(注：本表中第6、7项除外) | E4: 精确度：小数点后保留两位
A5: 项目号 | B5: 指标名称 | C5: 基本情况 | D5: 备注 | E5: 出处 | F5: 增长率（%）
A6: 1 | B6: 国内生产总值
B7: a GDP 总额 | C7: 330 | D7: 按可比价格计算 | E7: 宁夏回族自治区统计局关于2002年国民经济和社会发展的统计公报http://www.stats.gov.cn/was40/reldetail.jsp?docid=73219 | F7: 0.10199999999999999
B8: b GDP增加额 | C8: 31.7 | D8: 根据2002年GDP与2001年GDP之差得出 | F8: ――――
B9: c 人均GDP(单位：元) | C9: 5804 | D9: 按当年价格计算 | E9: 《宁夏统计年鉴2003》29页
B10: d 第一产业增加值 | C10: 52.8 | D10: 按可比价格计算 | E10: 宁夏回族自治区统计局关于2002年国民经济和社会发展的统计公报http://www.stats.gov.cn/was40/reldetail.jsp?docid=73219 | F10: 0.06
B11: e 第二产业增加值 | C11: 151 | D11: 按可比价格计算 | E11: 宁夏回族自治区统计局关于2002年国民经济和社会发展的统计公报http://www.stats.gov.cn/was40/reldetail.jsp?docid=73219 | F11: 0.125
B12: f 第三产业增加值 | C12: 126 | D12: 按可比价格计算 | E12: 宁夏回族自治区统计局关于2002年国民经济和社会发展的统计公报http://www.stats.gov.cn/was40/reldetail.jsp?docid=73219 | F12: 9.4E-2
A13: 2 | B13: 全年实现工业增加值 | C13: 114.8 | D13: 按可比价格计算 | E13: 宁夏回族自治区统计局关于2002年国民经济和社会发展的统计公报http://www.stats.gov.cn/was40/reldetail.jsp?docid=73219 | F13: 0.13
A14: 3 | B14: 农业情况
B15: a全年农业总产值 | C15: 92.5 | D15: 按可比价格计算 | E15: 宁夏回族自治区统计局关于2002年国民经济和社会发展的统计公报http://www.stats.gov.cn/was40/reldetail.jsp?docid=73219 | F15: 7.8E-2
B16: b农业总产值 | C16: 52.91 | D16: 根据宁夏统计年鉴第35页比例计算而得
B17: c林业总产值 | C17: 5.18 | D17: 根据宁夏统计年鉴第35页比例计算而得
B18: d畜牧业总产值 | C18: 32.01 | D18: 根据宁夏统计年鉴第35页比例计算而得
B19: e渔业总产值 | C19: 2.4 | D19: 根据宁夏统计年鉴第35页比例计算而得
A20: 4 | B20: 投资情况
B21: a全社会固定资产投资额 | C21: 230.83 | D21: 按当年价格计算 | E21: 宁夏回族自治区统计局关于2002年国民经济和社会发展的统计公报http://www.stats.gov.cn/was40/reldetail.jsp?docid=73219 | F21: 0.17899999999999999
B22: b基本建设投资额 | C22: 124.36 | D22: 按当年价格计算 | E22: 宁夏回族自治区统计局关于2002年国民经济和社会发展的统计公报http://www.stats.gov.cn/was40/reldetail.jsp?docid=73219 | F22: 0.18099999999999999
B23: c更新改造投资额 | C23: 26.36 | D23: 按当年价格计算 | E23: 宁夏回族自治区统计局关于2002年国民经济和社会发展的统计公报http://www.stats.gov.cn/was40/reldetail.jsp?docid=73219 | F23: 1.0999999999999999E-2
B24: d房地产开发投资额 | C24: 30.86 | D24: 按当年价格计算 | E24: 宁夏回族自治区统计局关于2002年国民经济和社会发展的统计公报http://www.stats.gov.cn/was40/reldetail.jsp?docid=73219 | F24: 0.33100000000000002
A25: 5 | B25: 全年居民消费水平
B26: a居民消费价格总指数（%） | C26: 99.4 | D26: 以上年价格为100 | E26: 《宁夏统计年鉴2003》 | F26: ――――
B27: ①城镇居民消费价格指数（%） | C27: 99.5 | D27: 以上年价格为100 | E27: 《宁夏统计年鉴2003》 | F27: ――――
B28: ②农村居民消费价格指数（%） | C28: 99.4 | D28: 以上年价格为100 | E28: 《宁夏统计年鉴2003》 | F28: ――――
B29: b消费品零售总额 | C29: 109 | D29: 按当年价格计算 | E29: 宁夏回族自治区统计局关于2002年国民经济和社会发展的统计公报http://www.stats.gov.cn/was40/reldetail.jsp?docid=73219 | F29: 0.1
B30: ①城市消费品零售额 | C30: 72 | D30: 按当年价格计算 | E30: 宁夏回族自治区统计局关于2002年国民经济和社会发展的统计公报http://www.stats.gov.cn/was40/reldetail.jsp?docid=73219 | F30: 0.115
B31: ②农村消费品零售额 | C31: 37 | D31: 按当年价格计算 | E31: 宁夏回族自治区统计局关于2002年国民经济和社会发展的统计公报http://www.stats.gov.cn/was40/reldetail.jsp?docid=73219 | F31: 7.2999999999999995E-2
A32: ★6 | B32: 外贸情况(亿美元)
B33: a全年外贸总额(亿美元) | C33: 4.43 | D33: 按当年价格计算 | E33: 宁夏回族自治区统计局关于2002年国民经济和社会发展的统计公报http://www.stats.gov.cn/was40/reldetail.jsp?docid=73219 | F33: -0.16900000000000001
B34: b出口总额(亿美元) | C34: 3.28 | D34: 按当年价格计算 | E34: 宁夏回族自治区统计局关于2002年国民经济和社会发展的统计公报http://www.stats.gov.cn/was40/reldetail.jsp?docid=73219 | F34: -3.4674999999999998
B35: c 进口总额(亿美元) | C35: 1.15 | D35: 按当年价格计算 | E35: 宁夏回族自治区统计局关于2002年国民经济和社会发展的统计公报http://www.stats.gov.cn/was40/reldetail.jsp?docid=73219 | F35: -0.36709999999999998
A36: ★7 | B36: 全年利用外资情况(亿美元)
B37: a 外资直接投资(亿美元) | C37: 0.22 | D37: 按当年价格计算 | E37: 宁夏区情数据手册http://www.nxdxlib.gov.cn/qx3.htm
B38: b 合同利用外资(亿美元) | C38: 0.54986999999999997 | D38: 按当年价格计算 | E38: 宁夏区情数据手册http://www.nxdxlib.gov.cn/qx3.htm
B39: c 实际利用外资(亿美元) | C39: 0.31659999999999999 | D39: 按当年价格计算 | E39: 宁夏区情数据手册http://www.nxdxlib.gov.cn/qx3.htm
A40: 8 | B40: 全省(市)财政总收入 | C40: 44.4 | D40: 按当年价格计算 | E40: 宁夏区情数据手册http://www.nxdxlib.gov.cn/qx3.htm
B41: a财政收入/GDP （%） | C41: =C40/330 -> 0.13454545454545455 | D41: 计算而得，待核。42.10/330.00。《宁夏统计年鉴2003》147页记录比重为8.04 | F41: ――――
B42: b地方财政收入（实际） | C42: 26.47 | D42: 待查 | E42: 《宁夏统计年鉴2003》145页
B43: c一般预算收入 | C43: 26.47 | D43: 待查 | E43: 关于2002年全区及区本级财政决算和2003年财政预算上半年执行情况的报告http://www.nxnews.net/1214/2005-1-11/25@66130.htm
B44: d税收收入总额 | C44: 39.6 | D44: 按当年价格计算 | E44: 宁夏区情数据手册http://www.nxdxlib.gov.cn/qx3.htm
B45: ①增值税税收收入 | C45: 4.3890000000000002 | D45: 按当年价格计算 | E45: 《中国统计年鉴2003》275页
B46: ②企业所得税税收收入 | C46: 1.84 | D46: 按当年价格计算 | E46: 《中国统计年鉴2003》275页
B47: ③个人所得税税收收入 | C47: 1.45 | D47: 按当年价格计算 | E47: 《中国统计年鉴2003》275页
B48: ④营业税税收收入 | C48: 9.3 | D48: 按当年价格计算 | E48: 《中国统计年鉴2003》275页
B49: ⑤资源税税收收入 | C49: 0.13 | D49: 按当年价格计算 | E49: 《中国统计年鉴2003》275页
B50: ⑥本省税收收入占本省财政收入比例（%） | C50: =C44/C40 -> 0.891891891891892 | D50: 根据44行数据计算而得，待核 | F50: ――――
B51: ⑦税收收入占国内生产总值比例（%） | C51: =C44/C7 -> 0.12 | D51: 根据44行数据计算而得，待核 | F51: ――――
A52: 9 | B52: a全省（市）财政支出总额（实际） | C52: 115.34 | D52: 待核 | E52: 关于2002年全区及区本级财政决算和2003年财政预算上半年执行情况的报告http://www.nxnews.net/1214/2005-1-11/25@66130.htm
B53: b一般财政预算支出 | C53: 114.57 | D53: 待核 | E53: 关于2002年全区及区本级财政决算和2003年财政预算上半年执行情况的报告http://www.nxnews.net/1214/2005-1-11/25@66130.htm | F53: 0.224
B54: c基本建设支出 | C54: 25.5 | D54: 按当年价格计算 | E54: 《中国统计年鉴2003》297页
B55: d农业支出 | C55: 1.0274000000000001 | D55: 按当年价格计算 | E55: 《中国统计年鉴2003》297页
B56: e支农支出 | C56: 1.84 | D56: 按当年价格计算 | E56: 《中国统计年鉴2003》297页
B57: f科技三项支出 | C57: 0.78320000000000001 | D57: 按当年价格计算 | E57: 《中国统计年鉴2003》297页
B58: g社会保障支出 | C58: 18.748999999999999 | D58: 按当年价格计算 | E58: 《中国统计年鉴2003》299页
B59: h科教文卫支出 | C59: 20 | D59: 按当年价格计算 | E59: 《宁夏统计年鉴2003》146页
A60: 10 | B60: 本省财政收入与全国财政收入的比较
B61: a全国财政收入 | C61: 18903.64 | D61: 按当年价格计算
B62: b省(市)财政收入 | C62: 42.1 | D62: 按当年价格计算 | E62: 《宁夏统计年鉴2003》147页
B63: c本省财政收入占全国的比例 | C63: =C62/C61 -> 2.2270843075725098E-3 | F63: ――――
A64: 11 | B64: 人民生活水平指标
B65: a城市居民人均可支配收入（单位：元） | C65: 6067.4 | D65: 按当年价格计算 | E65: 《宁夏统计年鉴2003》179页
B66: b城市居民恩格尔系数(%) | C66: 34.76 | D66: 根据《中国统计年鉴2003》356页城市居民食品支出与生活消费品支出之比得出 | F66: ――――
B67: c农村居民人均纯收入（单位：元） | C67: 1917.4 | D67: 按当年价格计算 | E67: 《宁夏统计年鉴2003》179页
B68: d农村居民恩格尔系数(%) | C68: 44.65 | D68: 根据《中国统计年鉴2003》372页农村居民食品支出与生活消费品支出之比得出 | F68: ――――
B69: e城乡收入水平差距 | C69: =C65-C67 -> 4150 | D69: 根据城市居民人均可支配收入与农村居民人均纯收入之差得出