D1: 宁夏回族自治区2004年
D2: 主要统计数据指标简表
D3: 本表主要根据《宁夏回族自治区统计局关于2004年国民经济和社会发展的统计公报》整理
D4: 单位:亿元（人民币）(注：本表中第6、7项除外) | E4: 精确度：小数点后保留两位
A5: 项目号 | B5: 指标名称 | C5: 基本情况 | D5: 备注 | E5: 出处
A6: 1 | B6: 国内生产总值
B7: a GDP 总额 | C7: 460.3 | D7: 按可比价格计算 | E7: 宁夏回族自治区统计局关于2004年国民经济和社会发展的统计公报http://www.stats.gov.cn/tjgb/ndtjgb/dfndtjgb/t20050318_402236668.htm
B8: b GDP增加额 | C8: =460.3-385 -> 75.3 | D8: 根据2004年与2003年GDP之差计算而得
B9: c 人均GDP(单位：元) | C9: 7880 | D9: 按当年价格计算 | E9: 宁夏回族自治区统计局关于2004年国民经济和社会发展的统计公报http://www.stats.gov.cn/tjgb/ndtjgb/dfndtjgb/t20050318_402236668.htm
B10: d 第一产业增加值 | C10: 65.1 | D10: 按当年价格计算 | E10: 宁夏回族自治区统计局关于2004年国民经济和社会发展的统计公报http://www.stats.gov.cn/tjgb/ndtjgb/dfndtjgb/t20050318_402236668.htm
B11: e 第二产业增加值 | C11: 239.4 | D11: 按当年价格计算 | E11: 宁夏回族自治区统计局关于2004年国民经济和社会发展的统计公报http://www.stats.gov.cn/tjgb/ndtjgb/dfndtjgb/t20050318_402236668.htm
B12: f 第三产业增加值 | C12: 155.8 | D12: 按当年价格计算 | E12: 宁夏回族自治区统计局关于2004年国民经济和社会发展的统计公报http://www.stats.gov.cn/tjgb/ndtjgb/dfndtjgb/t20050318_402236668.htm
A13: 2 | B13: 全年实现工业增加值 | C13: 186.3 | D13: 按当年价格计算 | E13: 宁夏回族自治区统计局关于2004年国民经济和社会发展的统计公报http://www.stats.gov.cn/tjgb/ndtjgb/dfndtjgb/t20050318_402236668.htm
A14: 3 | B14: 农业情况
B15: a全年农业总产值 | C15: 125.5 | D15: 按当年价格计算 | E15: 宁夏回族自治区统计局关于2004年国民经济和社会发展的统计公报http://www.stats.gov.cn/tjgb/ndtjgb/dfndtjgb/t20050318_402236668.htm
B16: b种植业总产值 | C16: 71.3 | D16: 按当年价格计算 | E16: 宁夏回族自治区统计局关于2004年国民经济和社会发展的统计公报http://www.stats.gov.cn/tjgb/ndtjgb/dfndtjgb/t20050318_402236668.htm
B17: c林业总产值
B18: d畜牧业总产值 | C18: 41.2 | D18: 按当年价格计算 | E18: 宁夏回族自治区统计局关于2004年国民经济和社会发展的统计公报http://www.stats.gov.cn/tjgb/ndtjgb/dfndtjgb/t20050318_402236668.htm
B19: e渔业总产值
A20: 4 | B20: 投资情况
B21: a全社会固定资产投资额 | C21: 379.7 | D21: 按当年价格计算 | E21: 宁夏回族自治区统计局关于2004年国民经济和社会发展的统计公报http://www.stats.gov.cn/tjgb/ndtjgb/dfndtjgb/t20050318_402236668.htm
B22: b基本建设投资额 | C22: 190.9 | D22: 按当年价格计算 | E22: 宁夏回族自治区统计局关于2004年国民经济和社会发展的统计公报http://www.stats.gov.cn/tjgb/ndtjgb/dfndtjgb/t20050318_402236668.htm
B23: c更新改造投资额 | C23: 53.2 | D23: 按当年价格计算 | E23: 宁夏回族自治区统计局关于2004年国民经济和社会发展的统计公报http://www.stats.gov.cn/tjgb/ndtjgb/dfndtjgb/t20050318_402236668.htm
B24: d房地产开发投资额 | C24: 67.2 | D24: 按当年价格计算 | E24: 宁夏回族自治区统计局关于2004年国民经济和社会发展的统计公报http://www.stats.gov.cn/tjgb/ndtjgb/dfndtjgb/t20050318_402236668.htm
A25: 5 | B25: 全年居民消费水平
B26: a居民消费价格总指数（%） | C26: 103.7 | D26: 上年价格=100 | E26: 宁夏回族自治区统计局关于2004年国民经济和社会发展的统计公报http://www.stats.gov.cn/tjgb/ndtjgb/dfndtjgb/t20050318_402236668.htm
B27: ①城镇居民消费价格指数（%） | C27: 103.3 | D27: 上年价格=100 | E27: 宁夏回族自治区统计局关于2004年国民经济和社会发展的统计公报http://www.stats.gov.cn/tjgb/ndtjgb/dfndtjgb/t20050318_402236668.htm
B28: ②农村居民消费价格指数（%） | C28: 104.5 | D28: 上年价格=100 | E28: 宁夏回族自治区统计局关于2004年国民经济和社会发展的统计公报http://www.stats.gov.cn/tjgb/ndtjgb/dfndtjgb/t20050318_402236668.htm
B29: b消费品零售总额 | C29: 137.8 | D29: 按当年价格计算 | E29: 宁夏回族自治区统计局关于2004年国民经济和社会发展的统计公报http://www.stats.gov.cn/tjgb/ndtjgb/dfndtjgb/t20050318_402236668.htm
B30: ①城市消费品零售额 | C30: 94.7 | D30: 按当年价格计算 | E30: 宁夏回族自治区统计局关于2004年国民经济和社会发展的统计公报http://www.stats.gov.cn/tjgb/ndtjgb/dfndtjgb/t20050318_402236668.htm
B31: ②农村消费品零售额 | C31: 43.1 | D31: 按当年价格计算 | E31: 宁夏回族自治区统计局关于2004年国民经济和社会发展的统计公报http://www.stats.gov.cn/tjgb/ndtjgb/dfndtjgb/t20050318_402236668.htm
A32: ★6 | B32: 外贸情况(亿美元)
B33: a全年外贸总额(亿美元) | C33: 9.1 | D33: 按当年价格计算 | E33: 宁夏回族自治区统计局关于2004年国民经济和社会发展的统计公报http://www.stats.gov.cn/tjgb/ndtjgb/dfndtjgb/t20050318_402236668.htm
B34: b出口总额(亿美元) | C34: 6.5 | D34: 按当年价格计算 | E34: 宁夏回族自治区党校图书馆《宁夏区情报告》http://www.nxdxlib.gov.cn/qq05-2.htm
B35: c 进口总额(亿美元) | C35: 2.6 | D35: 按当年价格计算 | E35: 宁夏回族自治区党校图书馆《宁夏区情报告》http://www.nxdxlib.gov.cn/qq05-2.htm
A36: ★7 | B36: 全年利用外资情况(亿美元)
B37: a 外资直接投资(亿美元) | C37: 0.66890000000000005 | D37: 按当年价格计算 | E37: 2004年宁夏回族自治区金融运行报告
B38: b 合同外资(亿美元) | C38: 2.8 | D38: 按当年价格计算 | E38: 宁夏回族自治区统计局关于2004年国民经济和社会发展的统计公报http://www.stats.gov.cn/tjgb/ndtjgb/dfndtjgb/t20050318_402236668.htm
B39: c 实际利用外资(亿美元) | C39: 1.3 | D39: 按当年价格计算 | E39: 宁夏回族自治区统计局关于2004年国民经济和社会发展的统计公报http://www.stats.gov.cn/tjgb/ndtjgb/dfndtjgb/t20050318_402236668.htm
A40: 8 | B40: 全省(市)财政总收入 | C40: 67 | D40: 按当年价格计算 | E40: 宁夏回族自治区统计局关于2004年国民经济和社会发展的统计公报http://www.stats.gov.cn/tjgb/ndtjgb/dfndtjgb/t20050318_402236668.htm
B41: a财政收入/GDP （%） | C41: =C40/C7 -> 0.14555724527482078 | D41: 全省（市）财政总收入/GDP
B42: b地方财政收入（实际） | C42: 37.47 | D42: 按当年价格计算 | E42: 陕西经济信息网
B43: d 一般预算收入 | C43: 66.9 | D43: 2004年宁夏回族自治区金融运行报告 | E43: 2004年宁夏回族自治区金融运行报告
B44: e税收收入总额 | C44: 60.7 | D44: 按当年价格计算 | E44: 宁夏回族自治区党校图书馆《宁夏区情报告》http://www.nxdxlib.gov.cn/qq05-2.htm
B45: f地税收入总额 | C45: 22.8 | D45: 按当年价格计算 | E45: 宁夏回族自治区党校图书馆《宁夏区情报告》http://www.nxdxlib.gov.cn/qq05-2.htm
B46: g国税收入总额 | C46: 37.9 | D46: 按当年价格计算 | E46: 宁夏回族自治区党校图书馆《宁夏区情报告》http://www.nxdxlib.gov.cn/qq05-2.htm
B47: ①增值税税收收入 | C47: 6.8 | D47: 按当年价格计算 | E47: 宁夏回族自治区统计局关于2004年国民经济和社会发展的统计公报http://www.stats.gov.cn/tjgb/ndtjgb/dfndtjgb/t20050318_402236668.htm
B48: ②企业所得税税收收入
B49: ③个人所得税税收收入 | C49: 1.9 | D49: 按当年价格计算 | E49: 宁夏回族自治区统计局关于2004年国民经济和社会发展的统计公报http://www.stats.gov.cn/tjgb/ndtjgb/dfndtjgb/t20050318_402236668.htm
B50: ④营业税税收收入 | C50: 13.4 | D50: 按当年价格计算 | E50: 宁夏回族自治区统计局关于2004年国民经济和社会发展的统计公报http://www.stats.gov.cn/tjgb/ndtjgb/dfndtjgb/t20050318_402236668.htm
B51: ⑤资源税税收收入
B52: ⑥本省税收收入占本省财政收入比例（%） | C52: =C45/C42 -> 0.60848678943154533 | D52: 地税收入/地方财政收入
B53: ⑦税收收入占国内生产总值比例（%） | C53: =C45/C7 -> 4.9532913317401693E-2 | D53: 地税收入/GDP
A54: 9 | B54: a全省（市）财政支出总额（实际） | C54: 123.01 | D54: 按当年价格计算 | E54: 陕西经济信息网
B55: b一般财政预算支出 | C55: 122.9 | D55: 按当年价格计算 | E55: 宁夏回族自治区统计局关于2004年国民经济和社会发展的统计公报http://www.stats.gov.cn/tjgb/ndtjgb/dfndtjgb/t20050318_402236668.htm
B56: c基本建设支出 | C56: 20.5 | D56: 按当年价格计算 | E56: 宁夏回族自治区统计局关于2004年国民经济和社会发展的统计公报http://www.stats.gov.cn/tjgb/ndtjgb/dfndtjgb/t20050318_402236668.htm
B57: d农业支出
B58: e支农支出
B59: f科技三项支出
B60: g社会保障支出
B61: h科教文卫支出
A62: 10 | B62: 本省财政收入与全国财政收入的比较
B63: a全国财政收入
B64: b省(市)财政收入 | C64: 67 | D64: 按当年价格计算 | E64: 宁夏回族自治区统计局关于2004年国民经济和社会发展的统计公报http://www.stats.gov.cn/tjgb/ndtjgb/dfndtjgb/t20050318_402236668.htm
B65: c本省财政收入占全国的比例
A66: 11 | B66: 人民生活水平指标
B67: a城市居民人均可支配收入 | C67: 7217.87 | D67: 按当年价格计算 | E67: 宁夏回族自治区统计局关于2004年国民经济和社会发展的统计公报http://www.stats.gov.cn/tjgb/ndtjgb/dfndtjgb/t20050318_402236668.htm
B68: b城市居民恩格尔系数(%) | C68: 0.36 | E68: 宁夏回族自治区统计局关于2004年国民经济和社会发展的统计公报http://www.stats.gov.cn/tjgb/ndtjgb/dfndtjgb/t20050318_402236668.htm
B69: c农村居民人均纯收入 | C69: 2320.05 | D69: 按当年价格计算 | E69: 宁夏回族自治区统计局关于2004年国民经济和社会发展的统计公报http://www.stats.gov.cn/tjgb/ndtjgb/dfndtjgb/t20050318_402236668.htm
B70: d农村居民恩格尔系数(%) | C70: 0.42 | E70: 宁夏回族自治区统计局关于2004年国民经济和社会发展的统计公报http://www.stats.gov.cn/tjgb/ndtjgb/dfndtjgb/t20050318_402236668.htm
B71: e城乡收入水平差距 | C71: =C67-C69 -> 4897.82 | D71: e=a-c