D1: 广东省2000年
D2: 主要统计数据指标简表
D3: 本表主要根据《广东统计年鉴2003》整理 | E3: 精确度：小数点后保留两位
E4: 单位:亿元（人民币）(注：本表中第6、7项除外)
A5: 项目号 | B5: 指标名称 | C5: 基本情况 | D5: 备注 | E5: 出处
A6: 1 | B6: 国内生产总值
B7: a GDP 总额 | C7: 9662.23 | D7: 按当年价格计算 | E7: 广东统计年鉴（2003）2-7 国内生产总值30页
B8: b GDP增加额 | C8: 1043.521 | D8: 通过该年GDP总额与增长率计算所得 | E8: ----
B9: c 人均GDP(单位：元) | C9: 12885 | D9: 按当年价格计算 | E9: 广东统计年鉴（2003）2-16 人均国内生产总值及人均消费水平42页
B10: d 第一产业增加值 | C10: 1000.06 | D10: 按当年价格计算 | E10: 广东统计年鉴（2003）2-7 国内生产总值30页
B11: e 第二产业增加值 | C11: 4868.75 | D11: 按当年价格计算 | E11: 同上
B12: f 第三产业增加值 | C12: 4868.75 | D12: 按当年价格计算 | E12: 同上
A13: 2 | B13: 全年实现工业增加值
A14: 3 | B14: 农业情况
B15: a全年农业总产值 | C15: 1701.18 | D15: 按现价计算 | E15: 广东统计年鉴（2003）11-12农业总产值和指数230页
B16: b农业总产值 | C16: 714.74 | D16: 按现价计算 | E16: 同上
B17: c林业总产值 | C17: 59.64 | D17: 按现价计算 | E17: 同上
B18: d畜牧业总产值 | C18: 448.01 | D18: 按现价计算 | E18: 同上
B19: e渔业总产值 | C19: 383.42 | D19: 按现价计算 | E19: 同上
A20: 4 | B20: 投资情况
B21: a全社会固定资产投资额 | C21: 3233.7 | E21: 广东统计年鉴（2003）6-2 全社会固定资产投资总额 114页
B22: b基本建设投资额 | C22: 1163.63 | E22: 同上
B23: c更新改造投资额 | C23: 435.44 | E23: 同上
B24: d房地产开发投资额 | C24: 858.61 | E24: 同上
A25: 5 | B25: 全年居民消费水平
B26: a居民消费价格总指数（%） | C26: 101.4 | D26: 上年=100 | E26: 广东统计年鉴（2003）165页9-1 各种物价总指数165页
B27: ①城镇居民消费价格指数（%） | C27: 102.2 | D27: 上年=100 | E27: 同上
B28: ②农村居民消费价格指数（%） | C28: 100 | D28: 上年=100 | E28: 同上
B29: b消费品零售总额
B30: ①城市消费品零售额
B31: ②农村消费品零售额
A32: ★6 | B32: 外贸情况(亿美元)
B33: a全年外贸总额(亿美元) | C33: 1701.06 | E33: 广东统计年鉴（2003）16-1 对 外 经 济 主 要 指 标409页
B34: b出口总额(亿美元) | C34: 919.19 | E34: 同上
B35: c 进口总额(亿美元) | C35: 781.87 | E35: 同上
A36: ★7 | B36: 全年利用外资情况(亿美元)
B37: a 外资直接投资(亿美元) | C37: =0.4245+86.8393+122.372 -> 209.63579999999999 | D37: 包括签订项目、合同外资额和实际利用外资中的外资直接投资额 | E37: 广东统计年鉴（2003）16-17 利 用 外 资 情 况431页
B38: b 合同外资(亿美元) | C38: 110.85899999999999 | E38: 同上
B39: c 实际利用外资(亿美元) | C39: 145.7466 | E39: 同上
A40: 8 | B40: 全省(市)财政总收入 | C40: 1368.8122000000001 | E40: 广东统计年鉴（2003）8-1 财政一般预算收支基本情况 155页
B41: a财政收入/GDP （%） | C41: 0.14169999999999999 | D41: 通过计算所得
B42: b地方财政收入（实际） | C42: 910.6
B43: d 一般预算收入 | C43: 907.23 | E43: www.gdczt.gov.cn
B44: e税收收入总额 | C44: 798.61 | D44: 包括其他未列税种
B45: ①增值税税收收入 | C45: 132.13
B46: ②企业所得税税收收入 | C46: 167.42
B47: ③个人所得税税收收入 | C47: 84.8
B48: ④营业税税收收入 | C48: 272.42
B49: ⑤资源税税收收入 | C49: ----
B50: ⑥本省税收收入占本省财政收入比例（%） | C50: =798.61/1368.8122 -> 0.58343284783697869
B51: ⑦税收收入占国内生产总值比例（%） | C51: =798.61/9662.23 -> 8.2652762354032155E-2
A52: 9 | B52: a全省（市）财政支出总额（实际） | C52: 1069.86 | E52: 广东统计年鉴（2003）8-1 财政一般预算收支基本情况155页
B53: b一般财政预算支出 | C53: 1066.29 | E53: www.gdczt.gov.cn
B54: c基本建设支出 | C54: 153.35
B55: d农业支出 | C55: ----
B56: e支农支出 | C56: 26.89
B57: f科技三项支出 | C57: 21.47
B58: g社会保障支出 | C58: 14.3 | D58: 包括抚恤和社会福利救济费
B59: h科教文卫支出 | C59: =26.33+144.39+10.96+47.64 -> 229.32
A60: 10 | B60: 本省财政收入与全国财政收入的比较
B61: a全国财政收入 | C61: 13395.23
B62: b省(市)财政收入 | C62: 1368.8122000000001
B63: c本省财政收入占全国的比例 | C63: =1368.8122/13395.23 -> 0.10218653953683514 | D63: 通过计算所得
A64: 11 | B64: 人民生活水平指标
B65: a城市居民人均可支配收入（元） | C65: 9761.57 | E65: 广东统计年鉴（2003）10-1 人民生活主要指标189页
B66: b城市居民恩格尔系数(%) | C66: 0.39 | E66: http://www.usogd.gov.cn广东城市调查队
B67: c农村居民人均纯收入 | C67: 3654.48 | E67: 广东统计年鉴（2003）10-1 人民生活主要指标 189页
B68: d农村居民恩格尔系数(%)
B69: e城乡收入水平差距